Title,PriceMin,PriceMax,Sold,Rating,Shipping,Store,URL
Rack Storage-Holder Spice-Organizer Kitchen-Shelf Wall-Drain Stainless-Steel Multifunction,10.92,44.1,69,4.8,0,LoveWife Store,https://www.aliexpress.com/item/4000384814001.html
Kids Balloons Number Globos Birthday-Party-Decorations Animal Rabbit Bing 30inch 25PCS,5.3,9.75,108,5,0,Balloons Wonderland Store,https://www.aliexpress.com/item/4001018447043.html
Patches Decoration TN Car-Sticker Self-Adhesion Pu-Sofa-Hole-Repair Faux-Synthetic-Leather,2.91,3.16,59,0,0.63,T-N Handmade Store,https://www.aliexpress.com/item/4000756781423.html
Container-Holder Seal-Bottle Storage Black Waterproof Mini Case Outdoor for Edc-Box Capsule,5.25,5.25,2,0,0.25,Prepared Makes Quality life Store,https://www.aliexpress.com/item/4001102992878.html
Nexgard Spectra Chewable For Dogs All Size Merial Fast Delivery,33.25,49.4,152,4.4,0,GreatDanes VET Store,https://www.aliexpress.com/item/4000571499527.html
Plain Weave Epoxy Coating 3K 200gsm 42% Prepreg carbon fabric 0.5m*1m,18.7,18.7,28,5,3.83,jeely UHMWPE Carbon Aramid Fabric Store,https://www.aliexpress.com/item/4000817552042.html
Hanger-Bracket Hanging-Holder Medal Challenge Triathlon Running Wall-Hooks Acrylic Home,9.45,9.45,4,0,0,Tianxuan03 Store,https://www.aliexpress.com/item/4001116682682.html
Lace-Fabric French-Net Velvet African Sequins Sewging High-Quality with,47.6,47.6,5,0,0,Kaisheng Wax And Embroidery Store,https://www.aliexpress.com/item/4001141442467.html
Round-Stone Clothing-Decoration Rivoli Crystals Swarovski Foiled-Point-Back 1122,0.33,124.29,49,5,0,SewingClub Store,https://www.aliexpress.com/item/32920865967.html
Free shipping 30 pcs planar resin halloween catoon resin pr24866,4.56,4.56,3,5,2.6,topribbon Store,https://www.aliexpress.com/item/4000247744271.html
Swimsuit Crochet 100-Microfiber Acrylic Alize Made-In-Turkey Diva-Yarn Summer Lace Knitting,1.85,1.85,8,5,7.68,MAGROPA Store,https://www.aliexpress.com/item/4000712580706.html
Riche-Fabric Dress-Material Embroidery Bazin Nigerian African New-Arrival with Beads,44.8,44.8,7,0,0,Jonson Fabric Store,https://www.aliexpress.com/item/4001119181774.html
Wall-Sticker Background-Decoration Wood-Grain Living-Room Primary-Color Splicing 3D Glued,2.95,2.95,5,0,0,White windmill Store,https://www.aliexpress.com/item/4000908031410.html
Dotting-Tools-Set Painting-Pen Template Art-Tool Rocks-Dot-Kit Mandala for Cosmetic DIY,14.56,14.56,34,5,0,DSRAY Store,https://www.aliexpress.com/item/4001018485861.html
Punchers-Tools Punch-Machine Belt Holes Household with 1pc Quality 3-In-1,2.47,14.7,18,4.9,7.48,Hoppy House Store,https://www.aliexpress.com/item/4000606796698.html
Truelove Cooling Vest Harnesses Reflective-Vest Dogs Quick-Release Summer for Adjustable,20.46,31.35,67,4.9,0,Sudui Always Online Store,https://www.aliexpress.com/item/32813145660.html
2020 chinese new arrival ceramics cuo 202,7.6,7.6,182,4.9,0,Shop637971 Store,https://www.aliexpress.com/item/4000350208330.html
Toy Platform Hamster Chewing-Toys Playground Dwarf Climb Wooden Rat Mice Entertainment,6.64,8.53,1,0,6.71,Shop5254081 Store,https://www.aliexpress.com/item/4001044402788.html
AIR-FILTER Sanitization-Card Block-Out Virus for Student 30-Days Validity Safe Period,6.94,6.94,1,0,0,BearLink Store,https://www.aliexpress.com/item/4001061318020.html
Transport-Box Pet-Cat-Cage Air-Plane Small for Cats And Dogs Dog-Pet Breathable,4.99,4.99,12,0,10.53,Shop5586279 Store,https://www.aliexpress.com/item/10000090951370.html
Commemorative Coin Love-Russia Souvenir Collection Antique-Color Child Mom Art-Gifts,1.02,1.02,38,4.7,0.37,Worldwide Chinese Arts Store emm Store,https://www.aliexpress.com/item/32968377562.html
feeder drinker bird feedWide Mouth Waist Hummingbird Feeder Free Nectar Patio Yard,2.07,4.84,14,0,1.73,Shop5126074 Store,https://www.aliexpress.com/item/4000587108628.html
Organizer-Box Cream-Bottle Makeup-Jar Empty-Storage-Container Cosmetic-Pot Foam-Slime,0.51,1.05,132,4.8,0.82,Happyness Life Store,https://www.aliexpress.com/item/32953036084.html
Tin Sign Wall-Decor Restroom Plaque Metal Vintage for Toilet,4.89,4.89,193,4.9,3.34,Fonseca Decor Store,https://www.aliexpress.com/item/4000815963815.html
Shelves Storage-Shelf Wardrobe Closet Kitchen-Rack Saving-Organizer Wall-Mounted Cabinet-Holders,3.4,15.76,9,4,1.25,LED Solar Lighting Store,https://www.aliexpress.com/item/4000309423838.html
Forehead Digital Infrared Non-Contact Adults Indoor Bag Kid High-Precision,5.99,11.49,15,0,3.44,Beautiful Exquisite Life Dropshipping Store,https://www.aliexpress.com/item/4001128382626.html
Worms Intestinal Ticks Dog-Fleas Nexgard Spectra for by MERIAL MERIAL,34.96,101.65,318,4.7,0,KindsGoods Store,https://www.aliexpress.com/item/33012464817.html
Snap-Button Matt-Cap Plastic Resin WHITE T8 T5 T3 KAM Or Face-Finish Glossy 1000sets/color-Kb22,17.08,24.68,156,4.8,1.05,Nice Accessories,https://www.aliexpress.com/item/929198099.html
Cup Party-Cup Restaurant-Supplies Household-Items Disposable Plastic 450ml Red for High-Quality,7.54,19.18,44,5,0,Beautiful Life Global Store,https://www.aliexpress.com/item/4000407046879.html
Dog-Training-Collar Lcd-Display Stop Barking Remote Electronic Waterproof Rechargeable,12.78,42.49,127,5,0,YAC Group,https://www.aliexpress.com/item/4000874142928.html
Embossing-Stamp Your-Logo Design-Your-Own-Embosser-Stamp/custom Personalized for,12.22,12.22,226,4.7,6.97,Cathy's Love Store($ 3 - $ 5 DIY Store),https://www.aliexpress.com/item/33061098977.html
Living-Room Decoration Stickers Wallpaper Decals Mural Flowers Bedroom Pink Water-Color,3.89,3.89,19,0,0,White windmill Store,https://www.aliexpress.com/item/4001091724549.html
Gorilla Sculpture Statue-Model Office-Decoration Geometric Animal Kong Wedding Monkey King,14.69,26.45,60,4.4,0,NewBeautifulLife Store,https://www.aliexpress.com/item/4000843364729.html
Decor Painting Circuit-Track Poster Prints Canvas Wall-Art Formula-1 J109 Park Layout,2.84,13.14,37,3.9,0,Yamazaki Art Poster Store,https://www.aliexpress.com/item/4000559148470.html
Decorative Painting Kobe Bryant-Poster Canvas Wall-Art Bedroom Living-Room Classic,4.61,19.17,616,4.8,2.58,Terry's Lucky Gift Store,https://www.aliexpress.com/item/4000550567210.html
ZONESUN Embossing-Stamp-Logo Envelope Document Invitation-Card Letter Brass Custom Wedding,6.99,16.02,57,4.7,6.18,ZONESUN Official Store,https://www.aliexpress.com/item/33054242527.html
Loaf Mold Making-Tools Wooden-Box Swirl-Soap Rectangle for High-Quality Eco-Friendly,5.49,10.25,29,5,0,Zanhome Store,https://www.aliexpress.com/item/4000953347992.html
Garden-Tool-Organizer Storage-System Wall-Holder Adjustable-Tool 12-Hooks 48inch,18.45,18.45,5,0,0,Shop4609022 Store,https://www.aliexpress.com/item/4001079915314.html
Meian Art-Accessories Diamond-Painting-Kit Embroidery Mosaic Rhinestone Special-Shaped,5.56,45.78,1543,4.8,0,Meian Official Store,https://www.aliexpress.com/item/32845829494.html
Roll-Holder Toilet-Paper Water-Pipe-Rack Shelf Rustic Wall-Mounted Floating Industrial,14.16,14.16,20,5,0,"Alikafeii Trading Co., Ltd.",https://www.aliexpress.com/item/4000406779414.html
Case Crochet-Set Knitting-Needles-Kit Sewing-Tool Soft-Handles Aluminum Agulha-Set Craft,1.31,7.38,85,4.6,1.98,Good Life 666 Store,https://www.aliexpress.com/item/4000245327500.html
Inflatable Fun Bubble-Ball Amazing Durable Super-Wubble 120CM XL Tear-Resistant,1.86,10.82,22,0,0.15,SixSixSix Life Store,https://www.aliexpress.com/item/4001062853427.html
Megalodon Tooth Fossil Mineral-Specimen Shark Biological-Collection Teeth Natural Gift,12.34,12.34,3,0,4.16,pinhan Sculpture gifts Store,https://www.aliexpress.com/item/4001032225436.html
Decorative Painting Whisky Cigar Chivas Jack Daniel Minimalist Modern Vintage Restaurant,2.77,16.5,2,0,0,Gu's Log Cabin Store,https://www.aliexpress.com/item/4001046162480.html
Background-Decoration Wallpaper Peach Ink-Painting Blossom Home-Stickers Landscape Living-Room,4.92,4.92,7,0,0,White windmill Store,https://www.aliexpress.com/item/4001028538635.html
Metal Cutting Dies Die-Planner Album-Card-Punch Gate Notebook Paper-Craft Storage Scrapbooking,11.9,26.9,87,0,0,AlinaCraft Store,https://www.aliexpress.com/item/4001118736107.html
Pouches Packing Self-Sealing-Bags Stand-Up Kraft-Paper Zip-Lock Fruit Dried-Food 100pcs,4.37,4.37,27,5,0.75,Fashionable Supermarket life Store,https://www.aliexpress.com/item/4000967071274.html
Feeder Toys Dispensing Puppy Dog-Puzzle Pet-Dog Training-Games Slow Interactive Small,3.26,3.26,1641,4.9,5.96,LottoLife Store,https://www.aliexpress.com/item/10000008069800.html
DHK Printed Elastic Distroller Decoration Headband 5yards-Fold FOE Wholesale OEM C534,1.93,1.93,9,5,0,DHK Ribbon&Accessories 2 Store,https://www.aliexpress.com/item/32853722689.html
Speaker Table-Clock Subwoofer Mirror Music-Player Fm-Radio Bluetooth Wireless Snooze,7.25,10.66,11,0,5.53,Sula's Life Store,https://www.aliexpress.com/item/4001073003832.html
Gardening-Gloves Gauntlet Forearm-Protection Pruning Thron-Proof Rose Women And,9.88,9.95,28,4.8,0.25,FUNNY WARM Store,https://www.aliexpress.com/item/4000875490613.html
Closet-Hanger Organizer Rack Holder Hanging-Strip Baseball-Cap Door-Cap Door-Back-Storage,3.73,3.73,17,5,0.16,Lucy's cozy house Store,https://www.aliexpress.com/item/4000773521007.html
Toy Lifting-Balls Teaser-Toys Pet-Supply Pet-Cat-Ball Interactive-Puzzle Electric Smart,8.26,8.26,347,4.6,0,ABEDOE Factory Store,https://www.aliexpress.com/item/4000782138801.html
Alarm-Clock Mirror Phone-Charger Time-Memory Desktop Digital Electric Wireless LED,12.04,12.04,10,0,0,Ninth Life's Store,https://www.aliexpress.com/item/4001063027233.html
OOTDTY Food-Container Pigeon Parrot Poultry-Feeding-Tool Automatic-Birds-Feeder Chicken,4.03,4.03,37,4.9,0.88,Bonnie Life House Store,https://www.aliexpress.com/item/33008303852.html
Vividtiles Peel Stick Vinyl Wallpaper Subway Tiles-10-Sheet Self-Adhesive Waterproof,37.05,37.05,338,4.8,0,Vividtiles Official Store,https://www.aliexpress.com/item/33042893984.html
Shelf Storage-Rack Cabinet Multi-Layer-Storage Rotating Bathroom Kitchen Triangle 360-Degree,24.67,25.36,45,5,0.25,Good life starts with me Store,https://www.aliexpress.com/item/4000618774041.html
LTWHOME Compatiable Foam and Carbon Rings Fit for Biorb Filter Set / Service Kit,15.99,15.99,40,4.8,0,Clean On Line,https://www.aliexpress.com/item/4000258246088.html
Cherry Blossom Flowers Wall-Decoration Tree Silk Fake Wedding 3-Fork sakura-Branch Background,2.81,2.81,778,4.6,2.05,yumai Store,https://www.aliexpress.com/item/33049840313.html
Clipper Combs-Supply Grooming-Tools Pet-Trimmer Cat-Brush Dog-Hair-Remover Furmins Attachment,7.05,8.35,77,5,0,Cats MiMi Store,https://www.aliexpress.com/item/4000778366793.html
AsyPets Crystal Pet Cage Hamster Cottage Double Layer House for Hamster Golden Hamster,12.66,12.66,37,4,0,AsyPets Official Store,https://www.aliexpress.com/item/32955629535.html
Pet-Toy Ball-Disk Interactive-Toy Intelligence Crazy Funny Cat Triple-Play-Disc,2.89,7.94,18,5,0,Kovely Store,https://www.aliexpress.com/item/4000300324084.html
Captain-America-Shield Halloween-Gift Steve Rogers Cosplay Metal 1:1 Weapons Superhero,10.93,14.09,49,4.6,5.79,LoveLight Store,https://www.aliexpress.com/item/4000005141889.html
How I Met Your Mother Art Film Print Silk Poster Home Wall Decor 24x36inch,2.27,10.65,1,0,4.08,Shop5652004 Store,https://www.aliexpress.com/item/4000927489254.html
Mask Bags Storage-Box Face-Mask-Holder Dust-Proof Security Silicone 1PC Artifact-3 Temporary-Clip,2.64,3.76,10,0,0,Dreamy H Show Store,https://www.aliexpress.com/item/4001090298478.html
FLAT-FILTER Accessories Vacuum-Cleaner Karcher for Nt 65/2 Eco-Nt Ap G3 1pcs,7.28,9.7,9,5,0,ikeloy zone Store,https://www.aliexpress.com/item/4000735284047.html
Sharpening-Tools Knife-Sharpener Grinder Whetstone Kitchen-Knives Diamond Professional,1.8,4.4,55,0,1.99,Ci LeLe Store,https://www.aliexpress.com/item/4000636497745.html
Dining-Cover Chairs-Seat Jacquard-Chair Banquet-Protector Spandex Kitchen Case Elastic,1.7,23.97,43,5,1.47,Newlylife Store,https://www.aliexpress.com/item/4001028083831.html
Plastic Hanger Coat Closet Home-Organizer Toddler Portable Kids Children 10pcs/Lot,0.33,9.72,28,5,0,Murmure Store,https://www.aliexpress.com/item/4000994979378.html
Digital-Counter Tasbih Gift Rotating-Prayer-Beads Islamic Muslim with Portable Misbaha,4.82,4.82,37,0,0.19,Housekeeper Store,https://www.aliexpress.com/item/4000983656421.html
Body-Vase Flowers Home-Decoration-Accessories Modern Ceramic Human White Indoor for Crafts,26.82,31.92,1,0,2.35,Shop5842141 Store,https://www.aliexpress.com/item/4001102661838.html
Storage-Case Oil-Roll Essential Oils Portable Carrying Collecting on 5ml,23.69,23.69,32,5,0,Cowslip Storage Bag Store,https://www.aliexpress.com/item/4000532437500.html
FILTER-CLEANER Sand-Washer Siphon Aquarium Fish-Tank Syphon-Operated Vacuum-Gravel Powerful,22.54,23.61,112,5,0,Quality Commodity Store,https://www.aliexpress.com/item/4000115308369.html
Shisha-Hookah-Set Chicha Stainless-Steel Sheesha Aluminium-Alloy Metal Art Edelstahl,11.7,14.47,90,4,98.98,Moonking Hookah Store,https://www.aliexpress.com/item/4000799981316.html
Nitrile-Gloves Rubber Mechanic Right-Hand Disposable Latex 100pcs for Left Guantes Comfortable,1.21,22.58,89,4.8,0,urban life Store,https://www.aliexpress.com/item/4000994639661.html
Pet-Nest Pig-Cage Double-Hamster-Cage Small-Pet Dutch Acrylic Blue Large-Size with 30x20x30cm,3.44,45.3,16,5,0,MengXin Ant Store,https://www.aliexpress.com/item/4000798144084.html
Nordic Posters Canvas-Painting Wall-Art-Picture Geometric Living-Room-Decor No-Frame,2.93,35.28,177,4.4,0,CLSTROSE Official Store,https://www.aliexpress.com/item/33040427490.html
Shower-Curtain Bathroom Elephant Polyester Home-Decoration Waterproof Thickening 3D,6.59,11.06,38,5,0,Still new Store,https://www.aliexpress.com/item/4000630066409.html
Oven Grill Probe-Barbecue Digital-Probe Bbq Bluetooth Wireless Cooking Kitchen,27.98,27.98,212,4.7,0,European house Store,https://www.aliexpress.com/item/4000282060932.html
35PCS Mandala Dotting Tools for Rock Painting Kit Dot Art Rock Pen Paint Stencil,13.28,13.28,21,0,0,Shop4507089 Store,https://www.aliexpress.com/item/4000983589714.html
Black design British Army Multicam MTP Rank Embroidery patch,3.85,3.85,5,5,0,Yu&Jia Patch Factory,https://www.aliexpress.com/item/32623320398.html
Organizer Storage-Bag Waterproof Tampon OYOURLIFE Makeup Data-Cables Mini Cute Earphone,1.96,1.96,1,0,0.41,OYOURLIFE Store,https://www.aliexpress.com/item/4001076382938.html
Bedding-Set Pillowcase Duvet-Cover-Set Queen King Bangtan Boys Korean Bts-Printed Popular,24.33,39.32,22,0,0,NanTong Store,https://www.aliexpress.com/item/4001091125421.html
Lamp Light Sterilizing-Algae CUV Sunsun Aquarium Germicidal Fish-Pond Ultraviolet Removing-Lamp,7.36,20.24,183,4.9,4.02,China Aquarium Store,https://www.aliexpress.com/item/32916960233.html
Guardia Civil Espana Embroidery Patch Hook and Loop Badge for Clothing Spanish Army Military,2.56,2.56,7,0,0,GreenPatch Store,https://www.aliexpress.com/item/4001127431221.html
Wooden Frame Picture Wall-Mounting Black Simple White A3 A4 Solid Hardware Included,5.11,15.35,176,4.6,0,DHROOM Store,https://www.aliexpress.com/item/4000030950489.html
Car-Seat-Cover Protector Pocket Car-Hammock-Cushion Dog-Carrier Travel-Mat Zipper Waterproof,29.22,29.22,1448,5,0,VIEFIN Official Store,https://www.aliexpress.com/item/4000401905325.html
10PCS/Lot Stampspage Black 2 Side Stamp Page of Stamp Album PVC loose-leaf Inners of,7.91,9.85,148,4.8,0,DoersuppTool Store,https://www.aliexpress.com/item/4000394265367.html
Food-Grad Safe-Gloves Ecofriendly Disposable Plastic Kitchen Ce-Vegetable Restaurant,3.22,20.74,41,5,0,Co-co'sPet Store,https://www.aliexpress.com/item/4000904190225.html
KSCRAFT Metal Cutting Dies Slimline-Edge Stencils Paper-Cards Decorative Embossing Scrapbooking/photo-Album,5.12,5.12,20,0,4.67,KSCRAFT LOVERS Store,https://www.aliexpress.com/item/4001143205819.html
Pepper Mill Salt Cooking Stainless-Steel Kitchen Electric Grinding-Tool-Accessories Seasoning,2.57,7.75,9,0,1.47,Shop5512062 Store,https://www.aliexpress.com/item/4000638421411.html
Ornament Canvas-Fabric Cross-Stitch Wind-Chimes Clear Plastic 14CT for Bell Windbells-28x21cm/Piece,3.75,3.75,42,4.8,3.16,WUXIJCSOYFULCROSSSTITCH Store,https://www.aliexpress.com/item/33048789781.html
Clear-Stamp Decorative Stamp/seal Transparent Scrapbooking/photo-Album German for DIY,3.77,3.77,37,0,0,WQQ Store,https://www.aliexpress.com/item/4001076663303.html
Tea-Ball Blossom Flowers Blooming-Tea Chinese Green 20-Kinds Artistic Tea-20pieces,13.29,13.29,32,4.7,1.32,CHINA GRANDNESS TEA SET Store,https://www.aliexpress.com/item/4000695493551.html
2020 New China Ceramic Cup,8.06,31.16,26,4.8,0,Minnanyun Tea Store,https://www.aliexpress.com/item/4000351520423.html
Triangular Exotic Pillows Body Waist Support Inflatable Wave Pillow Bedding Bed Travel,10.18,10.18,38,5,1.96,Overseas Dropshipping Factory Store,https://www.aliexpress.com/item/4000355450561.html
Sewing-Machines Pedal Replaceable-Foot Electric Built-In-Stitch-Patterns Speed with Led-Light,39.44,49.3,28,4.9,4.21,Dreamhouse life Store,https://www.aliexpress.com/item/4000777870573.html
Sealing-Tool Sealer Plastic-Bag New-Package Portable Heat Handheld Mini -30 1PC Feb19,3.27,3.27,586,4.7,0,"IUNeed Technology Co.,Ltd.",https://www.aliexpress.com/item/32977427027.html
Canvas Poster Watercolor Abstract-Square-Picture Living-Room-Decoration Nordic Painting,2.8,14.84,16,5,0,NICOLESHENTING Official Store,https://www.aliexpress.com/item/4000250774522.html
Leashes-Strap Dog-Belt-Rope Dogs Walking-Training Long Lead-Cats Nylon 6ft Pet-Dog Multifunctional,13.49,13.49,49,5,0,Star Pets Product Workshop,https://www.aliexpress.com/item/4000691090141.html
Shower-Curtain Octopus Bath-Decor Turtle-Print Waterproof with Polyester Sea Hooks Washable,2.48,12.46,19,5,0,PAPASGIX LED Light Store,https://www.aliexpress.com/item/4000622859983.html
Storage-Case Bottle Handbag Travel-Box Essential-Oil Durable 15ml-Holder Zipper Shockproof,10.42,10.65,36,0,2.63,Ali Home Bar,https://www.aliexpress.com/item/4000107497495.html
Life-Jacket Vest Swimwear Shark-Dog Mermaid Reflective Summer Dog Large Small,10.59,15.55,188,4.9,1.11,Lucy's cozy house Store,https://www.aliexpress.com/item/32949799857.html
Alarm-Clock Projector Temperature Digital Multifunctional LCD LED,4.17,10.62,90,4.3,0,Daily Life Houseware Store,https://www.aliexpress.com/item/4000185921941.html
Dotting-Tools-Set Painting-Pen Rocks-Dot-Kit Mandala for Polka Cosmetic,13.1,13.1,92,4.9,0,Shop5577076 Store,https://www.aliexpress.com/item/4000935617549.html
Waist-Fan Mobile-Cooler Clippable-On-Belt Usbportable Rechargeable Mini Small 1 for Outdoors,8.76,8.76,8,0,1.31,My Lifestyle Store,https://www.aliexpress.com/item/4000108331878.html
Power-Scrubber-Brush Cordless Multi Electric Tile Rotating-Bathtub Us-Plug,18.97,18.97,28,3,0.25,AA42 Store,https://www.aliexpress.com/item/4001022148347.html
Cleaner Grill Grates Barbecue-Cleaning-Brush Rescue Effective Bristle Free-Fit,12.47,12.47,104,0,0,Cozy Cottage Dropshipping Store,https://www.aliexpress.com/item/4000656883889.html
28-Grids Poultry-Feeder Farming-Tool Pigeon Trough Bird Feeding-Bucket Chicken-Ground,6.9,6.9,11,0,0,Voraca Pets World Store,https://www.aliexpress.com/item/4001003321446.html
NICREW Aquarium-Accessories Sterilizer Algae-Remover Cleaning-Tools Doctor Chihiros Twinstar-Style,19.72,44.81,295,4.8,0,NICREW Official Store,https://www.aliexpress.com/item/32914779745.html
Oil-Painting Numbers-On-Canvas Landscape Home-Decoration Unique Frameless SDOYUNO 60x75cm,3.61,25.44,444,5,0,SDOYUNO Artwork Store,https://www.aliexpress.com/item/4000804325522.html
Body-Pillow Cushion 150x50cm Filling Inner-Insert Anime Core-White Hugging Long-Dakimakura,8.52,31.83,318,4.8,0,EnjoyLife Fashion Home,https://www.aliexpress.com/item/32992219337.html
Ribbon-Cutter-Machine Hand-Cut-Tool Home-Use DIY Hot Craft 220V Lbsisi-Life Rope-Ribbons,14.79,20.71,60,4.9,0,LBSISI Life Package Store,https://www.aliexpress.com/item/4000786206461.html
Craft-Supplies Pieces. Planar Resins Cartoon-Character DIY Flat-Back 30 PR-16737-17827,4.65,4.65,51,4.9,0,Shop4251011 Store,https://www.aliexpress.com/item/33023670276.html
FULLCANG Embroidery Decor Diamond-Painting Abstract Diy 5d African-Girl Sale Square FC2311,3.08,146.33,116,4.7,0,Fullcang Official Store,https://www.aliexpress.com/item/4000791168832.html
Water-Waterfall-Fountain Ornaments Tabletop Feng-Shui-Company Wealth Desktop-Flowing,25.84,32.54,723,5,5.03,TINYPRICE Store,https://www.aliexpress.com/item/4000392858873.html
Water-Waterfall-Fountain Ornaments Tabletop Feng-Shui-Company Wealth Desktop-Flowing,25.84,32.54,723,5,5.03,TINYPRICE Store,https://www.aliexpress.com/item/4000392858873.html
Safety-Clothes Harness-Saver Life-Vest Bones-Patterns Swimwer Summer Preserver Pet-Dog,3.59,15.26,114,4.8,2.95,TOP10 Petfactory Droppshipping Store,https://www.aliexpress.com/item/32975565019.html
Comb Cleaner Massage-Brush Pet-Washer Quickly-Cleaing-Brush Gentle Silicone Puppy-Wash-Tools,11.77,12.41,55,4.8,1.05,ZZSLHL Fourth Store,https://www.aliexpress.com/item/4001048186593.html
Shelves Shower-Shelf Toilet-Cabinet Bathroom-Organizer Stortage-Rack Corner Rotating,17.73,17.73,65,4.8,0,JusendaHome Store,https://www.aliexpress.com/item/4000223349083.html
Essential-Oil-Case Storage-Bag Hanging-Organizer Doterra Portable Travel 10 Carry 1-3ML,4.23,19.85,11,0,1.56,Sweetest Life Store,https://www.aliexpress.com/item/4001064722555.html
Silicone-Mat Dough-Mat Pastry-Tools Baking-Sheet Cookie Rolling Non-Slip with Scale Pad,3.95,13.65,65,5,0,ATDecoration Store,https://www.aliexpress.com/item/4000747162529.html
Storage-Rack Paper-Towel-Holder Preservative-Film-Dispenser Sauce Bottle Kitchen-Organizer,12.81,12.81,27,0,1.26,ONME Official Store,https://www.aliexpress.com/item/4000861155889.html
blade runner Lapel Pin,2.46,2.46,32,5,0,GuDeke Shop,https://www.aliexpress.com/item/33000001579.html
Water-Bottle Straw-Lid Hydro-Flask Stainless-Steel 40oz Sports Insulated 32oz Vsco,15.47,19.85,159,4.4,0,Stainless Water Bottle Store,https://www.aliexpress.com/item/4000690924822.html
Digital-Camera Microphone Webcam Desktop Fast-Delivery 1080P HD with for PC Laptop Usb-2.0,313.67,313.67,13,0,0,Have Fun With You Store,https://www.aliexpress.com/item/4001010509039.html
Leashes-Belt Ropes Leads Dog-Leash Dogs Walking-Training Long Round Outdoor 150cm Pet,9.83,9.83,378,4.8,2.61,David's Mall-Pet Products Supplier,https://www.aliexpress.com/item/4000449281898.html
Hanging-Ornament Windchime Amazing Home-Decoration Antique Chapel Grace 27-Tubes,10.87,10.87,68,4.7,0.98,ShinyHome Store,https://www.aliexpress.com/item/32631717889.html
Silicone Molds for Concrete Cement Pots DIY Round Planter Pot Mold Garden Vase Molds,7.19,20.24,20,5,0,Relaxing Store,https://www.aliexpress.com/item/4001075811032.html
Face-Cover FILTER-ACCESSORIES Cycling Bacteria-Proof Breathable with Activated-Carbon,2.02,20.04,95,4.3,0.42,Today is a Gift Store,https://www.aliexpress.com/item/4000974585751.html
Ornaments Gypsum-Vase Flower-Pot David-Head Plants Michelangelo Craftwork Living-Room,17.34,31.55,48,4.5,0,OQ Arts Store,https://www.aliexpress.com/item/33036835193.html
Coat Dog-Jacket Sport-Hoodie Bulldog Reflective Outdoor Fashion Windbreaker Waterproof,16.63,18.98,153,4.9,0.99,FancyDog Store,https://www.aliexpress.com/item/4000479161865.html
Instax Album Name-Card Mini Holds Fuji Cute for Fuji/Instax/Name-card/.. Jelly-Color,1.29,1.29,6,0,1.96,HarPaper Store,https://www.aliexpress.com/item/4001043407239.html
Funlife Tiles Kitchen Floor-Stickers Living-Room-Decor Non-Slip Waterproof Bathroom,7.85,68.81,640,4.8,0,Funlife Home Decor,https://www.aliexpress.com/item/32986367077.html
Wall-Sticker Tv-Background-Wallpaper Living-Room decoration Rabbit-Decals Acrylic Love-Tree,9.86,52.78,253,4.7,0,Shop3879055 Store,https://www.aliexpress.com/item/32979666070.html
Album-Book Coin-Holder Money-Organizer Collector World-Coin-Storage-Bag Pockets-Coins,1.27,3.6,125,4.4,0,A Little Life Store,https://www.aliexpress.com/item/4000549372445.html
Armrest-Organizer Tray Storage-Bag Cup-Holder Armchair Couch Sofa Remote-Control-Cellphone,7.27,7.27,42,4.7,0,ABEDOE Franchised Store,https://www.aliexpress.com/item/4000373932556.html
HUACAN Diamond Painting Embroidery Cross-Stitch Home-Decor Animal-Sale 5d Diy Tiger Full,4.5,25.55,2,0,0,huacan official store,https://www.aliexpress.com/item/4001066142430.html
Sign Metal Decorative Plaque Pub Vintage Tin Whiskey Club Man Bar,3.92,4.9,20,5,0,Putuo Decor Official Store,https://www.aliexpress.com/item/4001019289138.html
SOAP STAMP Embosser Logo Glass Handmade Acrylic Custom-Made Personalized,8.24,30.74,159,4.7,0,Your Pary Decor Store,https://www.aliexpress.com/item/32954811625.html
Blade Punch Stencils-Dies Paper-Craft Scrapbook Branches Flower Die-Mold Metal New Cut,1.3,1.3,66,4.9,0.29,Piggy Store,https://www.aliexpress.com/item/4000754004715.html
Toy Tray Playground Bird Station-Parrots Training-Stand Wood Stainless-Steel Pet-Bird-Frame,9.62,9.62,9,5,0.25,Your life product Store,https://www.aliexpress.com/item/4001023981408.html
Pet-Carriers Dogs Backpack Dog-Transport-Bag KENNEL Cats Small CAWAYI for Bolso Perro,13.55,13.55,135,5,0,Cawayi Kennel Official Store,https://www.aliexpress.com/item/4000863459790.html
Non-Contact Body Infrared Forehead Thermometer For Adults And Children With Lcd Display,18.99,18.99,5334,4.5,2.09,gavaer Official Store,https://www.aliexpress.com/item/4000894731262.html
Smell-Proof-Bag Container Medicine-Bag Storage-Case Lock Smoking-Accessories-Set Stash,12.9,12.9,4,0,0.53,Ineffable Store,https://www.aliexpress.com/item/4001064697054.html
