Title,PriceMin,PriceMax,Sold,Rating,Shipping,Store,URL
Christmas-Ribbons Wrapping-Decoration Handmade-Supplies Silk Gift DIY 25-Yards/Roll 6/10/15-/..,0.26,2.99,654,5,0,hellomery Store,https://www.aliexpress.com/item/4000833482892.html
Container-Box Bowl Snacks-Seeds Phone-Holder Dish-Layer Dry-Fruit Plastic Hot-Sale Creative,1.32,3.99,371,4.8,0,Apricot Store,https://www.aliexpress.com/item/4000782714312.html
50/100/200 Pieces Teddy bear of roses 3cm Foam wedding decorative flowers christmas decor,0.7,2.57,6726,4.9,0,Yiwu wedding Supplies Store,https://www.aliexpress.com/item/4000098964790.html
Cleaner Siphon-Pump WATER-FILTER-TOOL Tank-Gravel Aquarium Hang-Up Vacuum-Cleaning,0.67,1.58,59,0,0,Exquisite Life Store Store,https://www.aliexpress.com/item/4001034532139.html
Men Gift Cigarette-Holder Smoking-Accessories Pops-Beads Mint-Flavor Unique 100pcs/Pack,0.66,1.68,261,5,0,Beautiful Day 1989,https://www.aliexpress.com/item/4001037187554.html
Erasable Label Blackboard-Sticker Chalk-Board Craft Bottle-Organizer Kitchen Waterproof,0.17,1.49,43,5,0,L-Super Convenient Store,https://www.aliexpress.com/item/4000805280548.html
Bathroom Accessories organizer Set Toothbrush Holder Automatic Toothpaste Dispenser Holder Toothbrush Wall Mount Rack Tools Set,18.19,25.9,46,0,0,Shop5791426 Store,https://www.aliexpress.com/item/4001098020397.html
Sponges-Holder Organizer Sink-Accessories Drying-Rack Kitchen-Tool Drain Self-Adhesive,0.48,1.44,182,5,0.16,Midia sportsfans online Store,https://www.aliexpress.com/item/4000956880316.html
Bouquet Peony Rose Artificial-Flowers Bride Faux Pink Home-Decoration Wedding Small 5-Big-Heads,2.18,2.36,17535,4.8,0,Americashop Store,https://www.aliexpress.com/item/4000021430479.html
Pastry-Tools Dough Scraper Baking-Accessories Spatula Cake-Topper Kitchen-Butter-Knife,0.58,0.58,624,5,0,cakelove Official Store,https://www.aliexpress.com/item/4001049326934.html
HUACAN Diamond Painting Pictures Embroidery Rhinestones-Kit Full-Square Home-Decoration,3.19,21.37,965,4.8,0,huacan official store,https://www.aliexpress.com/item/32988694986.html
Organizer Plastic Container Clip Case Storage Face-Masks Eco-Friendly Disposable Bins,0.82,0.82,59,0,0,AnyHD Recorder Store,https://www.aliexpress.com/item/4001105234283.html
Pearl Air-Balloons Kids Toy Birthday-Party-Decoration White Latex Gold Colorful 10inch,0.17,1.64,1080,4.3,0,YQ party Store,https://www.aliexpress.com/item/4000894732068.html
Case Folder Storage-Clip Recycling-Storage-Masks Face-Mask Plastic-Sheet Portable Box,0.77,3.87,77,4,0,Daily life is Goods Store,https://www.aliexpress.com/item/4001004139173.html
High quality 14M x 3M 30mm Bird trap net Polyester 110D/2 Knotted Anti Bird Mist Net bird trap 1pcs,15,15,4,5,0,Shijiemesh Store,https://www.aliexpress.com/item/32846920944.html
Toy Figures Balloons Helium-Number Happy-Birthday-Party-Decorations Wedding-Air-Globos,0.41,1.44,26624,4.8,0,YiWu party Store,https://www.aliexpress.com/item/32867524407.html
1 PCS Funny Pet LED Laser Pet Cat Toy 5MW Red Dot Laser Light Toy Laser Sight 650Nm Pointer,0.41,0.8,5715,4.7,0,Green House Dropshipping Store,https://www.aliexpress.com/item/4000121901017.html
Meat-Thermometer Oven Probe-Water Milk Digital Kitchen Electronic-Cooking,1.37,1.37,2148,4.8,0.38,A TO Z TO ALL Store,https://www.aliexpress.com/item/33006599436.html
Number Balloons Shower-Supplies Globos Birthday-Party-Decoration Wedding Digital Silver,0.36,0.84,15335,4.8,0,Balloons Hut Store,https://www.aliexpress.com/item/32914827854.html
Stamen Decoration Wedding-Box Diy Wreath Artificial-Flower Wire-Stem/marriage-Leaves,0.26,0.28,2133,4.8,0.23,Flowers world Store,https://www.aliexpress.com/item/33042740904.html
Piping-Cream Nozzle-Set Tips-Set Pastry-Bag Cake-Decorating Kitchen-Accessories Icing,0.55,1.56,4321,4.7,0,TTLIFE Fondant World Store,https://www.aliexpress.com/item/33001633457.html
Wall-Stickers Decal Moon-Energy-Storage Fluorescent 3d-Star Living-Room Glow-In-The-Dark,0,0,2260,4.8,0.95,Karrie Store,https://www.aliexpress.com/item/4000567106209.html
Kitchen Dishwashing Brush Press The Liquid Box Sponge Wipe Combination Kitchen Dishwashing Detergent Cleaning Brush,4.4,4.4,6,0,0,GiveMeaSmile Store,https://www.aliexpress.com/item/4001108267033.html
Cake-Nozzle Pastry-Tools Cake-Decorating-Tips Icing-Piping-Cream Fondant Stainless-Steel,0.36,1.2,1896,5,0.17,YXMOULD Fondant Museum Store,https://www.aliexpress.com/item/4000865043319.html
Interactive-Toy-Stick Toys Mouse-Cage Feather-Wand Pet-Supplies Cat-Teaser-Toy Plastic,0.23,0.69,813,4.5,0,urban life Store,https://www.aliexpress.com/item/4000711871166.html
Induction-Lighter Charging Fingerprint Usb Electronic Male Tide Personality Windproof,1.77,2.94,8773,4.6,0,SZFR Store,https://www.aliexpress.com/item/4000176723593.html
Shirt Outfits Dogs-Costume Dog-Vest Puppy Cotton Cheap Cute for Perro Ropa,0.86,1.94,1464,4.8,0,PetMundo Store,https://www.aliexpress.com/item/4000570916110.html
Silk Peony Bouquet Scrapbook Artificial-Roses-Flowers Pompons Home-Decoration-Accessories,2.05,2.05,10835,4.9,0,joe joe store,https://www.aliexpress.com/item/33026292714.html
TTLIFE Slicer-Device Bakeware Cake-Decorating-Mold Adjustable Double-Line Stainless-Steel,1.86,1.99,791,4.7,0,TTLIFE Fondant World Store,https://www.aliexpress.com/item/33014089552.html
Wall-Stickers Decal Moon-Energy-Storage Fluorescent 3d-Star Living-Room Glow-In-The-Dark,0.45,1.64,7574,4.5,0,Yajia Decorative Store,https://www.aliexpress.com/item/33046759494.html
High quality 14M x 3M 35mm Mesh Bird net Polyester 110D/2 Bat net Bat trap Anti Bird Mist Net 5pcs,36,36,2,5,0,Shijiemesh Store,https://www.aliexpress.com/item/32262219696.html
Peony Artificial Flowers Wedding Bouquet Bride Faux Living-Room Home-Decoration High-Quality,1.57,1.7,6389,4.7,0,Kahaul Store,https://www.aliexpress.com/item/4000030743379.html
Battery-Box String-Light Garland Wedding-Decoration Copper-Wire LED Fairy Party for 3m/10m,0.31,3.11,1768,4.7,0,CHASANWAN Official Store,https://www.aliexpress.com/item/4000510010201.html
Cotton-Fabric Cloth Sewing Handmade-Accessories Patchwork Printed DIY Needlework 10x10cm,0.84,1.69,12918,4.7,0,No.3 fabric Store,https://www.aliexpress.com/item/32952446411.html
Kareem-Decoration Balloons Ramadan Mubarak-Banner Festival Party DIY Islamic Muslim Eid,0.94,3.21,4904,4.8,0,Party Decorative Favors Store,https://www.aliexpress.com/item/4000712131861.html
Sucker Hooks Suction Wall-Hangers Self-Adhesive Heavy-Load-Rack Door Bathroom Transparent,0.67,1.84,4197,4.8,0.71,O-heart HomeDecor Store,https://www.aliexpress.com/item/4000703939197.html
Sewing Elastic Garment-Accessories Trim Spandex Band DIY 5yards/Lot 3/6/8-/..,0.59,1.29,11955,4.8,0,RYFDBMauve MM Store,https://www.aliexpress.com/item/4000456852872.html
Cotton Mask Respirator Muffle-Face-Masks Halloween-Mask Festive Purge Mouth-Protection,1.29,1.82,2356,4.8,2.84,P aradise Store,https://www.aliexpress.com/item/4000901105371.html
100/200PCS Glow In The Dark Garden Pebbles Glow Stones Rocks for Garden Walkways Garden Luminous Stones Garden Decoration,1.33,11.44,562,4.8,1.56,Sweetest Life Store,https://www.aliexpress.com/item/4000002056268.html
Dentures-Props Diy-Decoration Party Favor Environmentally-Friendly Teeth-Fangs Halloween,0.14,0.5,388,4,0,Yummy! Store,https://www.aliexpress.com/item/4000928644446.html
Satin Ribbons Crafts-Supplies Sewing-Accessories Scrapbooking-Material Roses Artificial-Silk,0.35,3.25,8465,4.8,0,justyourstyle,https://www.aliexpress.com/item/32922346692.html
Balloons Number-Foil Digit-Ball Rainbow Birthday-Party-Decorations Rose-Gold Pink Silver,0.95,1.11,14384,4.7,0,BY Store,https://www.aliexpress.com/item/33017600795.html
Wall-Hooks Self-Adhesive Seamless Bathroom Transparent Kitchen Reusable 20pcs Oilproof,2.95,2.95,4225,4.8,0.53,Winzwon Official Store,https://www.aliexpress.com/item/4000246012367.html
Clips-Holder Quilting-Clip Clothing Fabric-Clamps Craft Patchwork Plastic LMDZ Multicolor,23.63,23.63,1082,4.9,0,LMDZ Official Store,https://www.aliexpress.com/item/4000922237478.html
Storage-Rack Refrigerator-Organizer Drawer-Basket Spacer Adjustable Layer Fresh Pull-Out,3.88,4.56,5547,4.6,0,"HongKong BestLife General Merchandise Co., Ltd",https://www.aliexpress.com/item/33012688451.html
HL Wrapping-Belt Decorative Crafts Gift-Box Satin Ribbons DIY Wedding 5-Meters Solid-Color,0.53,1.18,3245,4.9,0,HL Official Store,https://www.aliexpress.com/item/32861752006.html
Bathroom Accessories Set Toothbrush Holder Automatic Toothpaste Dispenser Holder Toothbrush Wall Mount Rack Bathroom Tools Set,24.99,24.99,1,0,0,Shop5791426 Store,https://www.aliexpress.com/item/4001125287980.html
Cakelove Flag Crown Wedding-Decoration-Supplies Baby Shower Heart-Star Party for Birthday,0.49,0.49,4037,4.8,0,cakelove Official Store,https://www.aliexpress.com/item/4000186508384.html
Silk Satin Ribbons Bow Gift-Wrap Crafts Wedding-Decorative Handmade 15mm Party 20mm 40mm,0.37,3.31,7476,4.9,0,HY warm Store,https://www.aliexpress.com/item/4000081403164.html
24-Nozzle-Set Pastry-Bag Tips Cake-Decorating-Tools Icing-Piping-Cream Kitchen Silicone,2.65,2.84,14981,4.8,0,miliner,https://www.aliexpress.com/item/32990015987.html
Pad Flour Table-Sheet Pastry Dough-Liner Cake-Bakeware-Paste Kitchen-Tools Thickening-Mat,2.09,2.09,1068,5,0,shincoo Store,https://www.aliexpress.com/item/4001066361957.html
Balloon Cartoon Mouse Foil Gift Birthday-Party-Decorations Giant Mickey Minnie Toys 112cm,0.27,1.26,6946,4.7,0,DAWM Store,https://www.aliexpress.com/item/32949468504.html
Utensils Bakeware Pizza-Dough-Maker Kneading-Accessories Baking-Mat Pastry Kitchen-Gadgets,2.41,4.9,8637,4.7,0,Textile & kitchen Store,https://www.aliexpress.com/item/32919441067.html
Cigarette-Holder Glass-Bottle Beads Smoking-Accessories Mint-Flavor Fruit Coffee Pops,0.63,1.74,567,5,0,Big Sale,https://www.aliexpress.com/item/4001031830470.html
Personalized Makeup Compact Mirror Bridesmaid Bachelorette Party Gift Your Name Watercolor Background Birthday Mother's Day Gift,4.99,4.99,0,0,3.96,wadbeev Store,https://www.aliexpress.com/item/10000287710823.html
Party Favor Necklace Souvenir Wedding-Present Gift Girlfriend Bridesmaid Guest Valentines,0.28,1.4,2945,4.8,0,LOLEDE House Supplies Store,https://www.aliexpress.com/item/4000410526021.html
Natural Dried Flowers Bouquet Easter-Decorations Tail-Grass Wedding Rabbit Home 30pcs/Lot,1.63,3.24,7030,4.4,0,QIANHUAYU handcrafted Store,https://www.aliexpress.com/item/33054161841.html
Shelves Organizer Hook Mop-Holder Storage-Shelf Broom Wall-Mounted Kitchen-Tools Home,0.71,0.71,403,5,0,ZSmagic Store,https://www.aliexpress.com/item/4000742158226.html
3D Butterfly Wall-Sticker Wedding-Decoration Window Living-Room Gold Silver for Hollow,1.14,1.14,3040,4.9,0,White windmill Store,https://www.aliexpress.com/item/33034272447.html
Piping-Cream Nozzle Pastry-Bag Cake-Decorating Kitchen-Accessories Icing Silicone 6-Stainless-Steel,1.49,1.49,11085,4.8,0.53,Winzwon Official Store,https://www.aliexpress.com/item/32945180221.html
2pcs/set Stainless Steel Cited Clips Elastic Belt Wearing Rope Weaving Tool Bag Wrap,0.6,0.6,1811,4.7,0,Shop5580128 Store,https://www.aliexpress.com/item/4000638403622.html
Garlic Grinder Chopper Press-Ginger Kitchen-Accessories 1pc Crusher Cutter Cocina,0.61,1.17,186,0,0,LIFE HOUSE 111 Store,https://www.aliexpress.com/item/4001066020999.html
Battery-Operated String-Lights Garland Photo-Clip Led Usb Home-Decoration Outdoor,1.42,3.94,3843,4.9,0,Glitter Cardstock Crafts Store,https://www.aliexpress.com/item/4000473424489.html
"6Pcs fit for Dolce Gusto Coffee Filter Cup Reusable Coffee Capsule Filters For Nespresso,With Spoon Brush Kitchen Accessories",2.24,3.92,2809,4.8,0,Imellow Coffee Store,https://www.aliexpress.com/item/4000583140596.html
Garden Planter Pot-Accessories Model-Pen Groot Flower-Pot Gift Tree-Man Cute Baby Kids,1.96,11.38,3104,4.7,0,Strongwell Official Store,https://www.aliexpress.com/item/32998869746.html
30cm Rose Pink Silk Peony Artificial Flowers Bouquet 5 Big Head and 4 Bud Cheap Fake,2.44,2.44,26554,4.8,0,Kahaul Store,https://www.aliexpress.com/item/32880916034.html
Tulip Flowers Artificial-Bouquet Wedding-Decoration Home-Garen-Decor Real-Touch 10PCS,4.17,4.17,16079,4.8,0,Party Decorative Favors Store,https://www.aliexpress.com/item/4000001513758.html
Balloons Letter Party-Decoration-Supplies Mubarak-Foil Star Rose-Gold Moon Silver Muslim,1.04,3.35,1086,4.8,0,Interesting Party Store,https://www.aliexpress.com/item/33053855381.html
Case Cap Suit Toothbrush-Cover Head-Protective-Cover Travel Electric New 4pcs,0.3,0.93,5277,4.7,0,urban life Store,https://www.aliexpress.com/item/33031319128.html
Cat Toy Claws Vocal-Toy Mint Pet-Kitten Thumb-Bite-Cat Teeth-Grinding Interactive Funny,0.29,0.64,7203,4.7,0,ALLPET Store,https://www.aliexpress.com/item/33032572444.html
Essential-Oil Stickers Patches Mosquito-Repellent Away Insects Travel Pure 100%Natural,1.55,1.55,19193,4.8,0,Boutique of small bones Store,https://www.aliexpress.com/item/32899189362.html
Personalized Makeup Compact Mirror Bridesmaid Bachelorette Party Gift Your Name Watercolor Background Birthday Mother's Day Gift,4.99,4.99,0,0,3.96,wadbeev Store,https://www.aliexpress.com/item/10000287710823.html
Interactive-Stick-Toy Wire-Chaser Turkey Cat Kitten Random-Color Wholesale 1PC,0.36,0.36,203,0,0,Worriless Houseware Dropship Store,https://www.aliexpress.com/item/4000918672836.html
Soap-Box Storage-Rack Soap-Sponge-Holder Drain Bathroom-Organizer Hanging Wall-Mounted,1.95,1.95,643,4.7,0,Mincai Life Enjoying Store,https://www.aliexpress.com/item/4000602148368.html
Balloons Pearl-Latex Christmas-Decorations Globos Happy-Birthday-Party Wedding 50pcs,0.19,1.97,16682,4.6,0,Handcrafts Party Store,https://www.aliexpress.com/item/4000087909598.html
Organizer Sink-Shelf Drain-Rack Soap Suction-Cup Bathroom-Holder Sponge Kitchen-Accessories,0.29,0.94,867,4.7,0.16,FQ Party Store,https://www.aliexpress.com/item/4000413700800.html
Painting Mosaic Diamond Embroidery Cross-Stitch Home-Decoration Full-Round-Drill Princess,2.34,2.34,3879,4.7,0,Qluo Store,https://www.aliexpress.com/item/4000372198079.html
Cotton-Fabric Cloth Sewing Handmade-Material Patchwork Printed 25cmx25cm for Needlework,2.07,2.9,7504,4.8,0,MENSUGEN JESSICA'S FABRIC Store,https://www.aliexpress.com/item/32960020962.html
Racks Clip Organizer-Holder Broom Hanger Mop Wall-Mounted Seamless Home-Goods 1PC,0.68,0.72,1421,4.9,0,522 Smily House Store,https://www.aliexpress.com/item/33036407596.html
Monogrammed Compact Mirror Gold Initial Your Name Alphabet Wedding Junior Bridesmaid Bachelorette Party Favor Mom Birthday Gift,4.99,4.99,0,0,3.96,wadbeev Store,https://www.aliexpress.com/item/10000287732961.html
LIQUID-FILTER-BAG Mesh-Net Kitchen-Accessories Food-Nut Milk-Tea Wine Strain-Herb Practical,0.15,1.55,95,5,0,Beautiful Day 1989,https://www.aliexpress.com/item/4000966939063.html
3PCS/Lot Cream Scraper Irregular Teeth Edge DIY Scraper Cake Decorating Fondant Pastry,0.61,0.97,2662,4.9,0.17,YXMOULD Fondant Museum Store,https://www.aliexpress.com/item/4000855907807.html
Sewing-Machine Fabric Manual Handy Simple-Operation Mini Portable Cloth 1pc LYQ,2.74,2.74,6280,4.5,0,IFITU PUBO Kitchenware Store,https://www.aliexpress.com/item/32844273795.html
Hoodies Coat Outfit Puppy Pet-Dog-Jacket Christmas-Clothing Dogs Small Winter Yorkshire,1.77,2.98,845,4.8,0.88,Zhang HaoXiang BaBa De Store,https://www.aliexpress.com/item/4000492214521.html
Grooming-Tool Removal Tick-Collar Flea-Effect Anti-Flea Kitten Cat Pet-Supplies Remedy-Neck,0.24,0.6,85,5,0.66,Vnvl daily necessities consumer shop Store,https://www.aliexpress.com/item/33050806114.html
Nail-Art-Decoration Nails Rhinestones Crystal Clear Non-Hotfix Flatback AB 1000pcs,0.44,1.96,5938,4.8,0,ZOTOONE Handcraft Store,https://www.aliexpress.com/item/32895870390.html
Molds Nozzles Flower-Cream Decorating-Tools Pastry-Tips Cupcake Tulip Russian Stainless-Steel,0.44,0.57,492,5,0,YXMOULD Sugarcraft Museum Store,https://www.aliexpress.com/item/4001033340595.html
Floating Solar Fountain Garden Water Fountain Pool Pond Decoration Solar Panel Powered Fountain Water Pump Garden Decoration,6.54,10.19,463,5,1.86,Everything goes well Store,https://www.aliexpress.com/item/4001095938363.html
Scrapbooking Stickers Decorative Crafts Label DIY And Student 24pcscar Stationery,1.99,1.99,277,5,0,Ok! Buy it Store,https://www.aliexpress.com/item/4000547183902.html
Strap-Hook Masks Extension-Strap Pain Adjustable Relieving Wearing Pressure for 15pcs,1.89,1.89,218,4.7,0,"Hi,we are Store",https://www.aliexpress.com/item/4001020552045.html
Napkin Tableware-Kit Decors Balloon-Cups Plates Unicorn Party-Supplies Birthday Disposable,1.02,12.86,4872,4.7,0,joy-enlife Official Store,https://www.aliexpress.com/item/32916653602.html
Mask-Case Bag-Organizer Storage-Container Pollution-Free-Mask Disposable Safe Dustproof,0.32,1.11,48,5,0.11,Midi House Store,https://www.aliexpress.com/item/4001034991117.html
Men Gift Cigarette-Holder Smoking-Accessories Pops-Beads Mint-Flavor 30pcs/Pack,0.28,1.12,1240,4.5,0,LOLEDE House Supplies Store,https://www.aliexpress.com/item/4000899506935.html
Strainer Gadgets TEA-FILTER-DIFFUSER Handle Sphere-Mesh Tea-Ball Kitchen-Tools Teapot,0.45,1.53,46,5,0,Murmure Store,https://www.aliexpress.com/item/4000936217641.html
Diamond Painting Bicycle-Sticker Embroidery Flowers Cross-Stitch-Kit Full-Square Landscape,2.05,48.41,2392,4.7,0,Painting imagine Store,https://www.aliexpress.com/item/4000411086815.html
High quality 14M x 3M 35mm Mesh Bird net Polyester 110D/2 Bat net Bat trap Anti Bird Mist Net 5pcs,36,36,2,5,0,Shijiemesh Store,https://www.aliexpress.com/item/32262219696.html
Necklace-Collar Charm Puppy Pet Pet-Name Pendant-Bone Cat Dog-Id-Tag New 1pcs,1.12,2.52,7726,4.8,0,Pawfect pet Store,https://www.aliexpress.com/item/32860592420.html
Seam-Guide-Gauge Sewing-Machine-Accessories Presser Flat DIY,0.34,0.66,529,4.9,0,Comfortable Life & Warm House Store,https://www.aliexpress.com/item/4000595027540.html
Elastic-Band Tape Mask Rope Ear-Cord Round Diy-Accessories Ear-Hanging 5/30/50/100m-mouth-mask,0.52,6.28,1820,4.8,0,Miaow Life Store,https://www.aliexpress.com/item/4000893670737.html
Cakelove Party-Supplies Mariage Bride Groom Wedding-Decoration Acrylic Gold Mr Mrs Black,0.69,0.97,782,4.7,0,cakelove Official Store,https://www.aliexpress.com/item/4000273132401.html
Bedroom Stickers Decal Bubble Home-Decoration 3D Luminous-Stars Glow-In-The-Dark Wall,1.55,1.55,6234,4.7,0,White windmill Store,https://www.aliexpress.com/item/4000509816890.html
Container Toothpaste-Holder Ladybug Bathroom-Sets Insect Toiletries Wall-Suction Cute,1,1,284,4.4,0.24,Romantic FullHome Store,https://www.aliexpress.com/item/4000742447658.html
Rose Cute Cartoon Patches Embroidery Patch for Clothing Sewing Iron on Patch baby clothes,0.28,0.86,382,5,0,MY-LOVE Store,https://www.aliexpress.com/item/4000971088254.html
1 pcs defrost tray quick defrost food meat fish seafood seafood fruit quick defrost plate defrost kitchen tool Dropshipping,6.96,9.04,14,0,1.58,Zhengjin Store,https://www.aliexpress.com/item/4001116123269.html
Confetti Balloons Column Xmas-Decoration-Supplies Baby Shower Birthday-Party Wedding,0.2,1.92,7042,4.8,0,TTTplay Official Store,https://www.aliexpress.com/item/4000583599317.html
HUACAN Diamond Painting Embroidery Cross-Stitch Rhinestone Photo Custom Full-Square-Picture,2.95,36.74,18815,4.8,0,huacan official store,https://www.aliexpress.com/item/32827868245.html
Box Background-Accessories Clothing Lining Satin-Fabric Party-Decoration Sewing Wedding,0.98,3.03,1218,4.7,0,Cathy Roberts's store,https://www.aliexpress.com/item/4000432590382.html
Kitchen Tongs Clamp Salad-Tools Grill Cooking-Clip BBQ Stainless-Steel Silicone Non-Slip,0.89,1.55,325,4.9,0.17,YXMOULD Fondant Museum Store,https://www.aliexpress.com/item/4000996838932.html
Rack Toothbrush-Organizer Bathroom-Accessories Traceless-Stand Wall-Mounted-Holder Space-Saving,1.2,1.2,2643,4.9,0,Shop5254163 Store,https://www.aliexpress.com/item/4000415171067.html
Mold Jelly-Moulds Cake-Tools Ice-Tray Candy-Maker Chocolate Gummy Bear 50-Cavity Silicone,1.72,1.9,1651,4.9,0,Shop5494113 Store,https://www.aliexpress.com/item/4000479262691.html
Decals Wall-Stickers Home-Decor Baby Rooms Glow-In-The-Dark Colorful Luminous Kids,1.58,1.58,3327,4.7,0,White windmill Store,https://www.aliexpress.com/item/32853778149.html
Automatic Toothpaste Dispenser Dust-proof Toothbrush Holder Wall Mount Stand Bathroom Accessories Set Toothpaste Squeezers Tooth,4.27,4.27,67,5,0,Dian Fan Boutique Store,https://www.aliexpress.com/item/4000989528191.html
Round Diamond Painting Embroidery-Kits Decorative-Drill Cross-Stitch Home 5d Diy,3.07,3.07,1412,4.6,0,Skillful Craftsman Store,https://www.aliexpress.com/item/32947884523.html
Rack Shaver Toothbrush-Holder Toothpaste-Storage Bathroom-Organizer Plastic Access 1PC,0.81,0.81,373,4.9,0,Muhann Harvest Life Store,https://www.aliexpress.com/item/10000015676713.html
Embroidery-Pen-Set Needle Knitting-Needles-Tool Interchangeable-Punch Abs-Plastic Fancy,2.74,2.74,2000,4.7,0,Shop680 Store,https://www.aliexpress.com/item/32964007498.html
Storage-Bag Reclosable Zip-Lock Poly Plastic 100pcssmall Food,0.18,2.48,396,5,0,urban life Store,https://www.aliexpress.com/item/4000704046964.html
Lable-Seal Sticker Decoration-Supplies Gift Ramadan Eid Muslim Islamic Paper Al-Fitr,1.31,2.92,1587,4.9,0,Party Decorative Favors Store,https://www.aliexpress.com/item/4000695892287.html
50pcs Fresh succulent cactus ~Living stones Lithops Pseudotruncatella SS,3.78,3.78,7,0,1.04,Doo Poo Store,https://www.aliexpress.com/item/4001098103482.html
Sticker Wire-Organizer Plug-Fixer Cable Power-Strip-Holder Self-Adhesive Punch-Free Wall-Mounted,0.4,0.8,735,4.8,0,Efficient life store,https://www.aliexpress.com/item/4000595183986.html
Tiguanyin Oolong Tea Set,7.5,7.5,0,0,0,www.89tea Store,https://www.aliexpress.com/item/33008741828.html
Necklace-Collar Charm Puppy Pet Pet-Name Pendant-Bone Cat Dog-Id-Tag New 1pcs,1.12,2.52,7726,4.8,0,Pawfect pet Store,https://www.aliexpress.com/item/32860592420.html
Seam-Guide-Gauge Sewing-Machine-Accessories Presser Flat DIY,0.34,0.66,529,4.9,0,Comfortable Life & Warm House Store,https://www.aliexpress.com/item/4000595027540.html
Elastic-Band Tape Mask Rope Ear-Cord Round Diy-Accessories Ear-Hanging 5/30/50/100m-mouth-mask,0.52,6.28,1820,4.8,0,Miaow Life Store,https://www.aliexpress.com/item/4000893670737.html
Anpro 5kg/1g 1kg/0.1g Portable Digital Scale LED Electronic Scales Postal Food Measuring Weight Kitchen LED Electronic Scales,7.68,7.68,1622,4.7,0,Anpro Official Store,https://www.aliexpress.com/item/32948714149.html
Decals Wall-Stickers Home-Decor Baby Rooms Glow-In-The-Dark Colorful Luminous Kids,1.58,1.58,3327,4.7,0,White windmill Store,https://www.aliexpress.com/item/32853778149.html
Cakelove Party-Supplies Mariage Bride Groom Wedding-Decoration Acrylic Gold Mr Mrs Black,0.69,0.97,782,4.7,0,cakelove Official Store,https://www.aliexpress.com/item/4000273132401.html
Bedroom Stickers Decal Bubble Home-Decoration 3D Luminous-Stars Glow-In-The-Dark Wall,1.55,1.55,6234,4.7,0,White windmill Store,https://www.aliexpress.com/item/4000509816890.html
Container Toothpaste-Holder Ladybug Bathroom-Sets Insect Toiletries Wall-Suction Cute,1,1,284,4.4,0.24,Romantic FullHome Store,https://www.aliexpress.com/item/4000742447658.html
Doinb Silicone Mold Cosmetic-Tools Hand-Craft Comb-Series Jewelry-Making Epoxy Resin,0.79,1.44,1232,4.8,3.03,Suke Store,https://www.aliexpress.com/item/33056316761.html
Rose Cute Cartoon Patches Embroidery Patch for Clothing Sewing Iron on Patch baby clothes,0.28,0.86,382,5,0,MY-LOVE Store,https://www.aliexpress.com/item/4000971088254.html
Confetti Balloons Column Xmas-Decoration-Supplies Baby Shower Birthday-Party Wedding,0.2,1.92,7042,4.8,0,TTTplay Official Store,https://www.aliexpress.com/item/4000583599317.html
Automatic Toothpaste Dispenser Dust-proof Toothbrush Holder Wall Mount Stand Bathroom Accessories Set Toothpaste Squeezers Tooth,4.27,4.27,67,5,0,Dian Fan Boutique Store,https://www.aliexpress.com/item/4000989528191.html
HUACAN Diamond Painting Embroidery Cross-Stitch Rhinestone Photo Custom Full-Square-Picture,2.95,36.74,18815,4.8,0,huacan official store,https://www.aliexpress.com/item/32827868245.html
Box Background-Accessories Clothing Lining Satin-Fabric Party-Decoration Sewing Wedding,0.98,3.03,1218,4.7,0,Cathy Roberts's store,https://www.aliexpress.com/item/4000432590382.html
Interactive-Toy-Stick Toys Bell Mouse-Cage Pet-Supplies Feather-Wand Cat-Teaser-Toy Plastic,0.52,1.5,8434,4.7,0.53,Warm Animal Supplies Retail Store,https://www.aliexpress.com/item/33005760911.html
Kitchen Tongs Clamp Salad-Tools Grill Cooking-Clip BBQ Stainless-Steel Silicone Non-Slip,0.89,1.55,325,4.9,0.17,YXMOULD Fondant Museum Store,https://www.aliexpress.com/item/4000996838932.html
Needles Embroidery-Tool Opening Hand-Sewing Gold-Tail Multi-Size-Side Stainless-Steel,0.33,0.33,3054,4.9,0,Shop4666137 Store,https://www.aliexpress.com/item/4000636269946.html
Rack Toothbrush-Organizer Bathroom-Accessories Traceless-Stand Wall-Mounted-Holder Space-Saving,1.2,1.2,2643,4.9,0,Shop5254163 Store,https://www.aliexpress.com/item/4000415171067.html
Mineral-Ornament Repair-Stick Study-Decoration Gift Rose-Quartz Crystal-Point Magic Natural,1.96,3.27,1623,4.7,0,Shop4948006 Store,https://www.aliexpress.com/item/33023377492.html
Automatic Toothpaste Dispenser Dust-proof Toothbrush Holder Wall Mount Stand Bathroom Accessories Set Toothpaste Squeezers Tooth,4.61,4.61,123,4.5,1.89,QDRR Store,https://www.aliexpress.com/item/4000751464013.html
Mold Jelly-Moulds Cake-Tools Ice-Tray Candy-Maker Chocolate Gummy Bear 50-Cavity Silicone,1.72,1.9,1651,4.9,0,Shop5494113 Store,https://www.aliexpress.com/item/4000479262691.html
