Title,PriceMin,PriceMax,Sold,Rating,Shipping,Store,URL
Blade Punch Die-Mold Stencils-Dies Phone-Decoration Paper-Craft Scrapbook Metal Retro,1.01,1.01,84,5,0.29,Piggy Store,https://www.aliexpress.com/item/4000909647329.html
LMDZ Crochet Hook Sweater Weaving-Tools Knitting-Needles Aluminum 2-10mm 15-Sizes,1.24,1.38,270,4.6,0,LMDZ Official Store,https://www.aliexpress.com/item/32963009879.html
Laundry Folder Organizer Clothing Garment-Board Wardrobe-Storage Magic-Clothes Quick-T-Shirt,0.63,0.63,22,0,7.59,Dreaming Homes Store,https://www.aliexpress.com/item/4000615797025.html
Movie Poster Decorative-Painting Kraft-Paper Rocky Boxing Cafe Balboa Retro Restaurant,1.11,1.35,110,4.6,0.66,Shop5483042 Store,https://www.aliexpress.com/item/4000545429328.html
Handmade-Craft Frame Hoop Circle-Sewing-Kit Cross-Stitch Bamboo 6inch Wooden 12pcs 15cm,10.02,10.02,104,4.6,0,Better Living Store,https://www.aliexpress.com/item/4000585590525.html
Mosquito-Net Magnets Door Encryption Hands-Free Summer Mesh Bug Fly,2.72,10.73,178,4.1,0,Interesting Houseware Store,https://www.aliexpress.com/item/33002031975.html
Clothing Hanger Organizer Dress Non-Slip Plastic Household Black Outdoor Portable 10pcs,2.84,2.84,105,3,0,Shop5785338 Store,https://www.aliexpress.com/item/4000945059871.html
Birthday-Party Cake Topper Cake-Decoration Wedding-Favor-Supplies Gold-Ball Baby Shower,0.44,0.89,95,5,1.03,Artificial Flowers For Wedding Decoration Store,https://www.aliexpress.com/item/4000868762281.html
Oven Mitts Kitchen-Gloves Microwave Cat-Paws Non-Slip Heat-Resistant Long Cartoon Cotton,0.87,4.39,20,0,0,Beautiful Day 1989,https://www.aliexpress.com/item/4001080880616.html
Frame Painting Picture Wall-Art By Numbers Animal-Landscape Calligraphy Home-Decor Unique,6.23,25.38,311,5,0,GATYZTORY Store,https://www.aliexpress.com/item/4000897765959.html
Craft-Tools Casting-Mold Epoxy-Mould Agate Coasters Jewelry-Making Resin Silicone SDF-SHIP,1.71,2.41,13,0,0,SDF2019 Store,https://www.aliexpress.com/item/4001108386791.html
Canvas Posters Picture-Decor Paper Money-Heist The-House Casa-De-Papel Movie Wall-Art,1.84,8.14,146,4.2,2.08,JOYIA Official Store,https://www.aliexpress.com/item/4000908253447.html
Pictures-Decoration Poster-Art Movie Lady Bird Greta-Gerwig-Film-Saoirse-Rona,1.99,1.99,195,4.4,0.42,RandySticker NO.2 Store,https://www.aliexpress.com/item/4000594859618.html
GATYZTORY Oil-Painting Handpainted By Numbers Landscape Home-Decoration Children,2.97,26.44,322,4.4,0,GATYZTORY Factory Store,https://www.aliexpress.com/item/4000763620069.html
Foil-Balloon Decorations Number Air-Globos Birthday-Party Black Kids Cartoon Bing 6pcs,1.82,3.6,81,5,0,KUKUZHU Official Store,https://www.aliexpress.com/item/4001047772611.html
Shower Curtain Bath Indoor-Flowers Waterproof Polyester for Decorwith 12-Hooks Plants,7.13,12.74,64,4.6,1.39,Innovative blanket Store,https://www.aliexpress.com/item/4000660991955.html
Tablets De-Wormer Ivermectin Dog/horse/Poultry Albendazole 100PCS for 50-100,0.77,4.12,26,0,4.02,HOOO Store,https://www.aliexpress.com/item/4001093645385.html
Sports-Bottle Flask Tumbler Vacuum Stainless-Steel Insulated Outdoor Wide-Mouth 32oz,5.01,14.65,1195,4.8,1.84,Shop5246175 Store,https://www.aliexpress.com/item/4000545255534.html
Liplasting Candle-Wick Flameless Birthday Christmas Cotton 100PCS 15/20cm,0.59,3.53,3777,4.8,0,Sixth Life's Store,https://www.aliexpress.com/item/32856909889.html
Instant-Fix Replacement Zip-Slider Sewing-Clothes Repair-Kit Zipper Teeth-Rescue Universal,1.82,1.82,113,5,0,Shop5367212 Store,https://www.aliexpress.com/item/4000786195931.html
Caterpillar Toy Trick Worm Magic-Props Christmas-Gift Twisted Classic Cute Kid Beginner,0.76,0.97,34,0,0,mashangfa58 Store,https://www.aliexpress.com/item/4001094328616.html
Clothing Seal-Making Engraved Name Kindergarten Customized Baby Waterproof Personal Cartoon,1.87,4.69,603,4.5,0,Cathy's Love Store($ 3 - $ 5 DIY Store),https://www.aliexpress.com/item/4000205106875.html
ZRDR Algae Scraper Blade Multi-Tool-Cleaner-Kit-Set Aquarium Grass-Cleaning Fish-Tank,3.9,10.9,123,4.7,0,ZRDR Outlet Store Store,https://www.aliexpress.com/item/4000846195202.html
Bags Pouches Iridescent-Bags Cosmetic Laser Zip-Lock Hologram Plastic 20pcs,0.85,14.75,61,3.5,3.05,Alicia Living Store,https://www.aliexpress.com/item/4001015242853.html
Silk Bonnet Shower-Cap Fabric Satin Waterproof Large Super-Gi-Ant Luxurious Female High-Quality,2.15,3.03,519,4.6,0,Party Supplies Direct Store,https://www.aliexpress.com/item/4000470470479.html
Baby Shower Confetti Wedding-Ballon-Toy Latex Balloons Birthday-Party-Decorations Metal,0.64,3.14,1279,4.8,0,Osaani Store,https://www.aliexpress.com/item/4000324782541.html
Wax-Stamp Paper Plane World-Map Star-Moon Greeting-Invitation Retro Sun Head-Decorative,0.79,1.6,78,4.8,3.37,Retro Baby Store,https://www.aliexpress.com/item/4000486291250.html
Cat-Toys USB Moving Interactive Electric Dancing Plush Chew Molar 3D Wagging Bite-Resistant,0.9,3.81,28,0,0.73,Pet-life Dropshipping Store,https://www.aliexpress.com/item/4001077956577.html
GATYZTORY Painting-By-Numbers Wall-Decor Animals-Figure Drawing Gift Handpainted Canvas,2.44,25.96,196,4.5,0,GATYZTORY Factory Store,https://www.aliexpress.com/item/4000725426290.html
Organizer Container Case Screw-Holder Storage-Box Earring-Bead Display Jewelry Compartment,0.83,10.08,2438,4.8,3.02,COCOHome Store,https://www.aliexpress.com/item/32965626279.html
Oil-Spray-Bottle Watering Fuel-Injector Edible Barbecue-Spray Glass Stainless-Steel Lw02271125,1.99,5.99,235,4.8,0,CHAO WIN a Store,https://www.aliexpress.com/item/32979807366.html
Decorative-Statue Flamingo-Ornaments Home-Accessories Living-Room Pink Resin Nordic 1pc,4.48,4.48,124,4.9,0,Third Street Store,https://www.aliexpress.com/item/33028331840.html
Vest Dog-Harness Puppy Dogs French-Bulldog Printed Walking-Training Small for Pug,3.43,11.32,50,5,0,PetMundo Official Store,https://www.aliexpress.com/item/4001021894418.html
Wall-Clock Alarm Stand Table Date Temperature Desktop Digital Home-Decoration Automatic,10.69,10.69,356,4.9,0,wubowen Store,https://www.aliexpress.com/item/4000580039851.html
ONEUP Lunch-Box Worker Food-Container Portable 304-Stainless-Steel Children Student New,5.56,15.72,135,5,0,ONEUP Official Store,https://www.aliexpress.com/item/4000756584278.html
Canvas Posters Pictures Oil-Paintings Wall-Art No-Frame Landscape Abstract Print Red-Tree,5.28,12.65,205,4.9,0,MING ART DECOR Store,https://www.aliexpress.com/item/4000794948388.html
Metal Tin Sign Decorative-Plate Wall-Decor Rock-Band Cave-Bar Rolling-Stones Plaque,3.83,4.79,16,5,3.34,YiWu Painting Decor Store,https://www.aliexpress.com/item/4000921426647.html
Wood-Balls Spheres Natural Craft Accessories Round 50mm/60mm-Diameter,1.1,3.31,16,4.8,0,Youai House Store,https://www.aliexpress.com/item/4000288772999.html
HUACAN Embroidery Diamond-Painting Flowers Mosaic DIY Home-Decoration 5D Square Full,3.95,26.27,17,3.3,0,huacan official store,https://www.aliexpress.com/item/4000597799260.html
Cap-Opener Kitchen-Tools Glass-Bottle Wall-Mounted Beer Vintage Iron Bar Without 1pc,0.54,2.98,116,5,0,The Pythagras Store,https://www.aliexpress.com/item/33005168317.html
Alarm-Clock Led-Screen Kids Bedroom Curved-Dimmable Large 7inch for Lightweight Sma,9.24,9.24,161,4.8,0,SVIP Dropshipping & Customized Store,https://www.aliexpress.com/item/4000636140207.html
AAA 60-200g NATURAL Black TOURMALINE CRYSTAL STONE ORIGINAL 1pc,5.33,14.23,142,4.9,0,Mujia Store,https://www.aliexpress.com/item/4000808455155.html
Blade Punch Die-Mold Stencils-Dies Paper-Craft Label Embroidery Scrapbook Metal Tag Cut,1.22,1.22,51,4.9,0.29,Piggy Store,https://www.aliexpress.com/item/4000898485752.html
Rack Organizer Tray-Holder Pole-Shelf Shower-Storage Bathroom Largre,3.84,8.12,10,0,1.95,Shop4503052 Store,https://www.aliexpress.com/item/4000407120557.html
Marker-Set Clothing Garment Name-Labels Fabric-Tags Sewing-Accessories Iron Diy Love,2.13,2.9,106,4.5,0,She Love Official Store,https://www.aliexpress.com/item/4000222329704.html
LED Clock Watch Cube Desk-Gadget Digital Night-Glowing Home-Decor for Gifts TSLM1 7-Colors,1.12,3.1,693,4.5,0,522 Smily House Store,https://www.aliexpress.com/item/33029635968.html
Tapestry Decor Wall-Art Forest Landscape-Printed Bohemian Natural Large 150-200-230 Cheap,5.53,16.28,78,4.8,0,Wanna You Warm Store,https://www.aliexpress.com/item/4000768429207.html
Ceramics-Tools Pellet Polymorph Thermoplastic-Friendly Polycaprolactone for Handmade,2.55,4.09,59,4.6,0,Festiva Decor Store,https://www.aliexpress.com/item/32852827067.html
Plastic Feeder Quail-Kettle Hen Animal-Supplies Bird-Farm Waterer-Feeding Chicken Poultry-Drinker,1.39,3.21,83,3.3,0,Beautiful Day 1989,https://www.aliexpress.com/item/33023819224.html
Board Recipes Tropical-Bar Metal Iron Painting Tin-Signs Wall-Decor Hawaii Plaque Cocktail,3.42,4.89,1,0,0,You Are The One Fashion Boutique,https://www.aliexpress.com/item/4000793120091.html
Dog Grooming Comb Trimmer Pet-Hair-Removal Puppy Hair Shedding Newest Pets Cats Kitten,7.77,11.79,132,5,0,HomeDecor-Pet Store,https://www.aliexpress.com/item/4000778962634.html
Bright-Clip-Lamp Led-Light Aquarium Fish-Tank Aquatic-Plant Blue Waterproof Super-Slim,7.63,14.83,359,4.8,0,Leewince Official Store,https://www.aliexpress.com/item/4000619596698.html
Die-Mold Punch-Stencils Cutting-Dies Craft Leaf-Frame Scrapbook-Paper Irregular-Flower,1.15,1.15,170,4.8,0.29,Piggy Store,https://www.aliexpress.com/item/4000879109815.html
Blade Punch Stencils-Dies Cut-Die-Mold Ring-Decoration Paper-Craft Scrapbook Metal Leaf,1.57,1.57,39,4.9,0.29,Piggy Store,https://www.aliexpress.com/item/4000898656500.html
PVC Gloves Powder-Free Disposable 100pieces Soft Cleaning One-Box High-Huality,7.61,10.05,49,0,0,Dream Lifestyle Store,https://www.aliexpress.com/item/4000785074360.html
Clothing Seal Name-Seal Seal-Order Custom-Logo Kindergarten Waterproof Children's Photosensitive,1.42,2.83,47,4.9,3.68,My favourite Store,https://www.aliexpress.com/item/33035439533.html
Vintage Poster Picture Art-Painting Wall-Decoration Morocco-Door Quotes Canvas Print,2.3,10.6,197,4.7,0,NICOLESHENTING Official Store,https://www.aliexpress.com/item/4000765655107.html
AQUARIUM-FILTER Water-Purifier Oxygen Fish-Cylinder Turtle Mini Round Ultra-Quiet Triple,4.6,10.12,205,4.7,0,ReefOctopus Store,https://www.aliexpress.com/item/32977995551.html
Alarm-Clock Clock-Table Voice-Control Wooden Home-Decor Digital Backlight Electronic,7.44,10.92,159,5,0,Chenhan Store,https://www.aliexpress.com/item/4000911683326.html
Baking-Mat Non Stick Food-Grade Silicone Large-Size Reusable Bpa-Free 60--60cm/60--50cm,2.71,12.23,295,4.9,0,TWOYOUI Store,https://www.aliexpress.com/item/33014355809.html
Wall-Stickers Tv-Background-Wall World-Map Crystal Acrylic Office European-Type for Sofa,10.45,43.68,230,4.7,0,HOMEMCDS Official Store,https://www.aliexpress.com/item/4000516708782.html
Stencils Dies Stamp Football-Cutting-Dies Scrapbooking Embossing-Mold Paper-Card Birthday-Party,1.14,1.14,27,4.8,0.18,Fabulous Store,https://www.aliexpress.com/item/4000543520393.html
Blade Punch Letter Polish Die-Mold Stencils-Dies Scrapbook Paper-Craft Metal Cut Language,1.19,1.19,8,5,0.29,Piggy Store,https://www.aliexpress.com/item/32965966301.html
Windproof Ashtray Container Tobacco Folding-Cover Stainless-Steel Home Ash-Holder Smoke,9.19,9.61,239,4.7,0,Cozy Life Homes Store,https://www.aliexpress.com/item/4000308231477.html
Toy Launcher-Toy Reward-Machine Thrower Pet-Ball Interactive-Treatment Dogs Tennis Slow-Feeder,18.86,18.86,8,0,0,Junejour New Life Store,https://www.aliexpress.com/item/4001134705778.html
Window-Rainbow-Films Glass Sticker Self-Adhesive-Film Static-Decorative Privacy No-Glue,3.4,3.4,428,4.4,0,Whalen Store,https://www.aliexpress.com/item/4000910994858.html
Fabric-Material Lace-Fabric Accessories-Width Embroidered 9088cloth Off-White Cotton,8.91,10.71,43,5,0,Nala Wedding Lace Store,https://www.aliexpress.com/item/32668884410.html
ORGAN Sewing-Machine Stretch Twin-Needle Elastic-Fabric Knitted for Household Sewing-machine/Universal/Twin-needle/90-100,2.53,3.11,97,5,3.33,Tidy-home Store,https://www.aliexpress.com/item/4000543853389.html
Poster Decorative Kraft-Paper Tv-Series Lost Painting American Wall Bar,1.11,1.35,18,5,0.66,Shop5483042 Store,https://www.aliexpress.com/item/4000454584087.html
Toothpaste-Dispenser Bathroom Automatic Wall-Mounted Dust-Proof for LEDFRE Wheat-Straw,2.23,4.43,421,4.6,0,LEDFRE SanitaryWare Store,https://www.aliexpress.com/item/32965169128.html
HUACAN Diamond Painting Embroidery Mosaic Cross-Stitch Landscape Full-Drill Home-Decoration,3.95,26.27,36,4.2,0,huacan official store,https://www.aliexpress.com/item/4000696028932.html
Shower Curtain Cloth Bathing Polyester Waterproof Cat-Printing Lovely,9.2,12.47,214,4.9,0.12,OULII H O M E Store,https://www.aliexpress.com/item/32973211048.html
Egg-Incubator Hatchery Pigeon Bird Brooder Quail Chicken-Duck Temperature Small Digital,16.26,16.26,632,4.8,0,HowardHOME Store,https://www.aliexpress.com/item/32819780677.html
Table-Mat Placemat Heat-Insulation Kitchen Dining Washable Waterproof Silicone NEW,0.87,3.51,764,4.8,0,Leeseph Store,https://www.aliexpress.com/item/4000181266365.html
Card-Stencil Cutting-Dies Scrapbooking Metal Slimline Paper-Craft Handbook-Decoration,3.99,3.99,30,0,0,ANDY 'S STORE,https://www.aliexpress.com/item/4001128913059.html
Canvas Painting Posters Prints Art-Banksy Abstract Home-Decoration Living-Room Morden,1.6,59.98,23,0,0,HoneyArt Store,https://www.aliexpress.com/item/4001045667163.html
Blade Punch Die-Mold Stencils-Dies Scrapbook Paper-Craft Flower-Branch-Decoration Metal,2.27,2.27,150,4.9,0.29,Piggy Store,https://www.aliexpress.com/item/4000953822589.html
Engine-Booster-Cleaner Engine-Catalytic-Converter New Multipurpose,4.97,4.97,18,0,0,Daily Life Product (Offer Drop Shipping) Store,https://www.aliexpress.com/item/4001135250147.html
Oxygen-Pump-Hose Tube Acuario Air-Bubble-Stone Fish-Tank Soft-Silicone Accesorios,0.77,2.9,216,4.9,0,Angelia Pets Park Store,https://www.aliexpress.com/item/4000178619300.html
60-Pockets Album Organizer Storage-Bag Coins-Holder Book-Money Collection Dollar Penny,2.23,3.04,70,5,0.89,General Practical Tools Store,https://www.aliexpress.com/item/4000411949865.html
ZFPARTY Paper-Stickers Crafts Alphabet Scrapbooking Diy Self-Adhesive Photo-Album/card-Making,3.3,3.3,199,4.4,1.21,ZFPARTY Handcraft Store,https://www.aliexpress.com/item/32965263005.html
50-100 tablets Albendazole Tablets De-wormer for Animals,1.52,4.88,27,5,1.6,Ali-Family01 Store,https://www.aliexpress.com/item/4000991131817.html
Duvet-Cover-Set Bedding-Set Grid Bed-Linen Pastoral-Bed-Sheet Grey Classic Blue 4pcs/Set,18.69,25.57,786,4.6,0,"Lifeng Trading Co., LTD",https://www.aliexpress.com/item/32733196250.html
Tin Sign Poster Decorative Metal Wall-Decor Plaque Quote Metal Vintage,3.92,4.9,209,4.8,0,Putuo Decor Official Store,https://www.aliexpress.com/item/4000133692312.html
Ornament Trunk Aquarium-Decoration Driftwood-Tree-Fish-Tank Natural Stump Landscap-Decor,2.45,7.02,5,0,0,Larger Than Life Store,https://www.aliexpress.com/item/4001112081234.html
Tin Signs Decorative Painting Art-Crafts Metal Poster Plaque-Bar Beer Wall-Art Grolsch,3.92,4.9,17,0,0,YQ-Decor Official Store,https://www.aliexpress.com/item/4001095910159.html
Book Decoration Model-Room Club Fashion Soft for Women's Hotel Study,6.64,6.64,125,4.9,0,5253 Store,https://www.aliexpress.com/item/4000897566818.html
Pink Latex Balloon-Chain Wedding-Decoration-Supplies Gray Engagement Party-Wall Birthday-Party,9.34,14.88,103,5,0,China Party suppliers Store,https://www.aliexpress.com/item/4000816333564.html
Fans Usb-Fan Hanging Hands-Free Office Rechargeable Mini Sports Personal Home for 3-Speed,2.52,12.58,21,3,6.05,Hoppy House Store,https://www.aliexpress.com/item/4001029329722.html
Disposable-Gloves Rubber Latex Cleaning Household 100pcs Drop-Ship Universal,6.08,14.66,108,0,2.65,ONME Official Store,https://www.aliexpress.com/item/4001084106560.html
Wall-Decals Poster Mural Living-Room Spanish Home-Decoration Quotes for Phrase Large,1.06,4.74,7,0,0,CoCoPlay Toilet Stickers Store,https://www.aliexpress.com/item/4001031257297.html
Cross-Medal-Badge Fan-Decoration Ribbon Iron Deutschland Germany Military 1939 with Eisernes,3.94,3.94,103,4.8,0,Coins Medals for You Store,https://www.aliexpress.com/item/4000802876332.html
YOMDID Shower Curtains Bath-Screen Geometric Marble-Pattern Printed Waterproof for Gift,6.49,12.99,488,4.6,0,YOMDID Official Store,https://www.aliexpress.com/item/4000112167242.html
Bed House Kennel Pet-Basket Dog-Cushion Cat-Mat Cat-Supplies Banana Cat Funny Portable,6.8,16.15,160,4.7,0,WFGOGO Official Store,https://www.aliexpress.com/item/4000505678888.html
Handmade Dream Catchers Hanging White Lace Flower Dreamcatcher Wind Chimes Indiana Feather,1.48,3.7,48,4.8,0.32,Funny Kitchen Tool Store,https://www.aliexpress.com/item/4000312124374.html
Tablecloth Manteles Tropical-Banana-Leaf Toalha-De-Mesa Nappe Waterproof Decoracao Casa,3.84,37.44,374,4.7,1.58,cities dog Official Store,https://www.aliexpress.com/item/32918164449.html
Music-Box Paper-House Money-Heist Bella Ciao Large Hand-Crank Christmas-Gift for Men,1.67,4.31,30,5,0,Creative- Store,https://www.aliexpress.com/item/4000981756333.html
Face-Mask FILTER 100PC Child with Activated-Carbon-Pad Anti-Haze Non-Woven Kids/adult,1.73,11.97,13,0,1.27,BUY YOU Store,https://www.aliexpress.com/item/4001055230365.html
Aromatherapy-Diffuser Fragrance Essential-Oil-Burner Scent Lavender Candle Ceramic New,2.27,4.16,117,4.9,0,Secret Kitchen Store,https://www.aliexpress.com/item/2044735672.html
Tools-Set Toothbrush-Holder Bathroom-Accessories Sterilization-Drying Automatic Home,9.12,25.06,252,4.8,0,AliexpressFlagship Store,https://www.aliexpress.com/item/4000731166213.html
Crusher-Bowl Herb Garlic Mortar-Pestle-Set Kitchen-Tools Grinding Spice-Mixing Resin,7.89,8.27,58,5,0,Mr Luck's House Store,https://www.aliexpress.com/item/33035887490.html
Sticker Journal-Toy Deco Diy Scrapbooking Koala-Material Cute Girl Children Korea Album,0.88,0.88,2,0,0.08,Pink Catt Store,https://www.aliexpress.com/item/4001064692290.html
Duvet-Cover-Set Bedding-Set Grid Bed-Linen Pastoral-Bed-Sheet Grey Classic Blue 4pcs/Set,18.69,25.57,786,4.6,0,"Lifeng Trading Co., LTD",https://www.aliexpress.com/item/32733196250.html
Accessory-Tools Bead Pusher Cigarette-Beads Push-Ball-Box Smoke DIY Upgrade Pop-Up,7.87,7.87,17,0,0,My Bottle Store,https://www.aliexpress.com/item/4001094692065.html
Bracelet Embellish Spool Sewing-Accessories Knitting-Machine Loom Tricotin Weave-Tool,4.18,8.31,80,4.9,1.74,Homesupplies Store,https://www.aliexpress.com/item/4000411157371.html
TUUTH Food-Storage-Container Bento-Box Wheat-Straw Soup-Cup Microwave Bpa-Free 750ML,6.1,14.75,392,4.9,0,TUUTH Official Store,https://www.aliexpress.com/item/4000763177860.html
Fan Fly-Repellent Bugs-Away Insect Killer Mosquitoes Pest Reject From-Your-Food-Mosquito-Trap,7.22,7.32,799,0,0,HonyPet Store,https://www.aliexpress.com/item/4001030681468.html
Clamp Sealing-Clip Helper Clip-Snack Fresh-Sealer Food-Storage-Bag Kitchen Plastic Portable,0.94,1.68,90,4.9,0,A part of life house Store,https://www.aliexpress.com/item/4000927595138.html
Kiwarm Cork-Stopper Decorative Vial Bottle-Storage Wishing Glass-Craft Clear Transparent,1.47,1.47,136,4.6,0,hengdachenxu3 Decoration World Store,https://www.aliexpress.com/item/32822558478.html
Cleaning-Powder Moss-Remover Algae Repellent Aquarium Agent-Tank Hot-Sale D6,4.63,4.63,36,0,0,MDD 5062017 Store,https://www.aliexpress.com/item/4001124443812.html
Bee Pet Puppy Coat Apparel Outfit Fleece Clothes Dog Cat Hoodie Fancy Costume,2.54,2.54,126,4.9,0,LANSOON House Store,https://www.aliexpress.com/item/33002850364.html
Pets-Toys Simulation Electric-Doll Usb-Charging-Gift Dancing Interactive Moving Fish,6.05,6.05,11,5,2.21,Featured department Store,https://www.aliexpress.com/item/4001039017569.html
Decorative-Statue Flamingo-Ornaments Home-Accessories Living-Room Pink Resin Nordic 1pc,4.48,4.48,124,4.9,0,Third Street Store,https://www.aliexpress.com/item/33028331840.html
Drip-Kettle Tea-Pot Gooseneck Teflon Non-Stick Coffee Stainless-Steel Thin 350ml 600ml,11.75,17.58,777,4.8,0,DROHOEY Official Store,https://www.aliexpress.com/item/32801796054.html
Clear-Stamps Soap-Seal Dies Soap-Printing English-Rose Handmade Resin Kscraft DIY Pattern,2.9,2.9,138,4.7,0,Peas In A Pod,https://www.aliexpress.com/item/4000817404092.html
Oil-Spray-Bottle Watering Fuel-Injector Edible Barbecue-Spray Glass Stainless-Steel Lw02271125,1.99,5.99,235,4.8,0,CHAO WIN a Store,https://www.aliexpress.com/item/32979807366.html
Vest Dog-Harness Puppy Dogs French-Bulldog Printed Walking-Training Small for Pug,3.43,11.32,50,5,0,PetMundo Official Store,https://www.aliexpress.com/item/4001021894418.html
Wall-Clock Alarm Stand Table Date Temperature Desktop Digital Home-Decoration Automatic,10.69,10.69,356,4.9,0,wubowen Store,https://www.aliexpress.com/item/4000580039851.html
ONEUP Lunch-Box Worker Food-Container Portable 304-Stainless-Steel Children Student New,5.56,15.72,135,5,0,ONEUP Official Store,https://www.aliexpress.com/item/4000756584278.html
Canvas Posters Pictures Oil-Paintings Wall-Art No-Frame Landscape Abstract Print Red-Tree,5.28,12.65,205,4.9,0,MING ART DECOR Store,https://www.aliexpress.com/item/4000794948388.html
Metal Tin Sign Decorative-Plate Wall-Decor Rock-Band Cave-Bar Rolling-Stones Plaque,3.83,4.79,16,5,3.34,YiWu Painting Decor Store,https://www.aliexpress.com/item/4000921426647.html
Wood-Balls Spheres Natural Craft Accessories Round 50mm/60mm-Diameter,1.1,3.31,16,4.8,0,Youai House Store,https://www.aliexpress.com/item/4000288772999.html
HUACAN Embroidery Diamond-Painting Flowers Mosaic DIY Home-Decoration 5D Square Full,3.95,26.27,17,3.3,0,huacan official store,https://www.aliexpress.com/item/4000597799260.html
Cap-Opener Kitchen-Tools Glass-Bottle Wall-Mounted Beer Vintage Iron Bar Without 1pc,0.54,2.98,116,5,0,The Pythagras Store,https://www.aliexpress.com/item/33005168317.html
Alarm-Clock Led-Screen Kids Bedroom Curved-Dimmable Large 7inch for Lightweight Sma,9.24,9.24,161,4.8,0,SVIP Dropshipping & Customized Store,https://www.aliexpress.com/item/4000636140207.html
AAA 60-200g NATURAL Black TOURMALINE CRYSTAL STONE ORIGINAL 1pc,5.33,14.23,142,4.9,0,Mujia Store,https://www.aliexpress.com/item/4000808455155.html
Blade Punch Die-Mold Stencils-Dies Paper-Craft Label Embroidery Scrapbook Metal Tag Cut,1.22,1.22,51,4.9,0.29,Piggy Store,https://www.aliexpress.com/item/4000898485752.html
Rack Organizer Tray-Holder Pole-Shelf Shower-Storage Bathroom Largre,3.84,8.12,10,0,1.95,Shop4503052 Store,https://www.aliexpress.com/item/4000407120557.html
Marker-Set Clothing Garment Name-Labels Fabric-Tags Sewing-Accessories Iron Diy Love,2.13,2.9,106,4.5,0,She Love Official Store,https://www.aliexpress.com/item/4000222329704.html
LED Clock Watch Cube Desk-Gadget Digital Night-Glowing Home-Decor for Gifts TSLM1 7-Colors,1.12,3.1,693,4.5,0,522 Smily House Store,https://www.aliexpress.com/item/33029635968.html
Tapestry Decor Wall-Art Forest Landscape-Printed Bohemian Natural Large 150-200-230 Cheap,5.53,16.28,78,4.8,0,Wanna You Warm Store,https://www.aliexpress.com/item/4000768429207.html
Ceramics-Tools Pellet Polymorph Thermoplastic-Friendly Polycaprolactone for Handmade,2.55,4.09,59,4.6,0,Festiva Decor Store,https://www.aliexpress.com/item/32852827067.html
Plastic Feeder Quail-Kettle Hen Animal-Supplies Bird-Farm Waterer-Feeding Chicken Poultry-Drinker,1.39,3.21,83,3.3,0,Beautiful Day 1989,https://www.aliexpress.com/item/33023819224.html
Board Recipes Tropical-Bar Metal Iron Painting Tin-Signs Wall-Decor Hawaii Plaque Cocktail,3.42,4.89,1,0,0,You Are The One Fashion Boutique,https://www.aliexpress.com/item/4000793120091.html
Dog Grooming Comb Trimmer Pet-Hair-Removal Puppy Hair Shedding Newest Pets Cats Kitten,7.77,11.79,132,5,0,HomeDecor-Pet Store,https://www.aliexpress.com/item/4000778962634.html
Bright-Clip-Lamp Led-Light Aquarium Fish-Tank Aquatic-Plant Blue Waterproof Super-Slim,7.63,14.83,359,4.8,0,Leewince Official Store,https://www.aliexpress.com/item/4000619596698.html
Die-Mold Punch-Stencils Cutting-Dies Craft Leaf-Frame Scrapbook-Paper Irregular-Flower,1.15,1.15,170,4.8,0.29,Piggy Store,https://www.aliexpress.com/item/4000879109815.html
Blade Punch Stencils-Dies Cut-Die-Mold Ring-Decoration Paper-Craft Scrapbook Metal Leaf,1.57,1.57,39,4.9,0.29,Piggy Store,https://www.aliexpress.com/item/4000898656500.html
PVC Gloves Powder-Free Disposable 100pieces Soft Cleaning One-Box High-Huality,7.61,10.05,49,0,0,Dream Lifestyle Store,https://www.aliexpress.com/item/4000785074360.html
Clothing Seal Name-Seal Seal-Order Custom-Logo Kindergarten Waterproof Children's Photosensitive,1.42,2.83,47,4.9,3.68,My favourite Store,https://www.aliexpress.com/item/33035439533.html
Measuring-Spoons Lcd-Display Kitchen-Scales Pet-Food Digital Precise,4.02,9.23,39,4.5,0,Miaow Life Store,https://www.aliexpress.com/item/4000955081320.html
Vintage Poster Picture Art-Painting Wall-Decoration Morocco-Door Quotes Canvas Print,2.3,10.6,197,4.7,0,NICOLESHENTING Official Store,https://www.aliexpress.com/item/4000765655107.html
AQUARIUM-FILTER Water-Purifier Oxygen Fish-Cylinder Turtle Mini Round Ultra-Quiet Triple,4.6,10.12,205,4.7,0,ReefOctopus Store,https://www.aliexpress.com/item/32977995551.html
Alarm-Clock Clock-Table Voice-Control Wooden Home-Decor Digital Backlight Electronic,7.44,10.92,159,5,0,Chenhan Store,https://www.aliexpress.com/item/4000911683326.html
Baking-Mat Non Stick Food-Grade Silicone Large-Size Reusable Bpa-Free 60--60cm/60--50cm,2.71,12.23,295,4.9,0,TWOYOUI Store,https://www.aliexpress.com/item/33014355809.html
