Title,PriceMin,PriceMax,Sold,Rating,Shipping,Store,URL
Throw Pillow Cushion Decorative Sofa Almofadas Gold Black Golden-Leaves Brozing Para,3.04,3.04,947,4.6,1.04,doxa Pint Life Store,https://www.aliexpress.com/item/33001135665.html
Vest Shirts Dogs French-Bulldog Outdoor Medium Summer Letter Small Cartoon for Ropa Pet-Dog,1.81,3.16,81,4.6,0,Pets Station Store,https://www.aliexpress.com/item/4000854933142.html
Popular spot wedding wooden DIY night light LED Night Light MrMrs wedding party decoration,6.86,6.86,0,0,21.83,OMSR Store,https://www.aliexpress.com/item/4000971969904.html
Garment-Board T-Shirt Storage Douyin Product Partition Lazy-Fold Useful,4.23,4.23,9,0,0,Cutesliving Store,https://www.aliexpress.com/item/4000244117701.html
Minerals Crystals Labradorite-Decoration Amethyst Chakra-Healing Rose Quartz Natural-Stones,3.04,9.02,291,5,0.66,Stone Brothers Store,https://www.aliexpress.com/item/4000402660307.html
Home-Decoration Hoop Wreath Iron Metal Ramadan Kareem Festival Party Eid Mubarak Islamic,1.05,3.39,363,4.7,0,Wedding & Home Decoration Supplies Store,https://www.aliexpress.com/item/4000844211350.html
Mincer-Tools Press-Crusher Masher Ginger-Squeezer Garlic Vegetables Cooking Kitchen Stainless-Steel,1.76,2.58,2344,4.5,0,Rayfox Life Store,https://www.aliexpress.com/item/4000479234390.html
HUACAN Diamond Embroidery Painting-Waterfall Mosaic Landscape Home-Decoration 5d Diy,3.6,28.16,2375,4.8,0,huacan official store,https://www.aliexpress.com/item/32754349400.html
Sofa-Covers Spandex Elastic L-Shape Stretchable Modern Solid-Color,5.29,18.82,231,5,0,LilyHome Store,https://www.aliexpress.com/item/4000506123611.html
Stickers Decoration Scrapbooking Photo-Albums-Frame Id-Holder 120-Pockets Solid-Color,1.3,2.5,1682,4.8,0,Emmily Homem Store,https://www.aliexpress.com/item/33011801243.html
ECOCO Toothpaste Squeezer Wall-mounted Floating Toothpaste Squeezer Dispenser Nail-free Bathroom Accessories for Family Kids,3.79,3.79,71,4.6,2.41,Colourful House Life Store,https://www.aliexpress.com/item/4000309986009.html
Vest Leash-Set Harness-Leads Mesh Puppy Yorkies Dogs Reflective Kitten Nylon Small Pug,2.54,3.69,3632,4.9,0,Pretty Elf,https://www.aliexpress.com/item/32881835373.html
Plant Vases Bonsai-Decor Flower-Pot Wooden-Frame Glass Terrarium-Hydroponic Vintage Home,3.83,4.55,2077,4.8,1.61,LDASQDD Store,https://www.aliexpress.com/item/32966180689.html
Jacket Raincoat Pet-Products Puppy Yorkie Small-Dogs Waterproof for Chihuahua 30S2,2.88,4.12,174,4.9,2.58,gjh-001 Store,https://www.aliexpress.com/item/32955050556.html
Raincoat Thickened Hoodie Clear Transparent Waterproof Fashion Women Camping Protective-Clothing,3.38,3.38,126,5,0,Jana Service First Store,https://www.aliexpress.com/item/4000860977210.html
Bags Buckle Clasp. Snap. Magnetic Metal Environmental 18-Mm Thickening 10sets-Per-Pack.,1.76,2.08,214,4.9,0,HOMEWORLD Accessories Store,https://www.aliexpress.com/item/32858141549.html
Organizer Basket Flower-Vase Hanging Seagrass-Woven Household Storage Foldable Garden,3.87,6.6,151,4.8,0,Vicki Yo Store,https://www.aliexpress.com/item/4000979641567.html
Linen fabric textile fabrics Solid fabric for sofa furniture Plain upholstery fabric,1.99,8.46,575,4.8,0.84,Xiyunxiang Textiles Store,https://www.aliexpress.com/item/10000038075918.html
UNTIOR 500g/0.1g Precise Digital Measuring Spoons Electronic LCD Digital Spoon Weight Volumn Food Scale Gram Mini Kitchen Scales,10.79,14.39,2,0,0,Untior Dropship Store,https://www.aliexpress.com/item/4001090239793.html
Bucket-Organizer Toys-Holder Storage-Bag Laundry-Basket Dirty Foldable Kids Home Barrel,1.41,6.46,146,5,0,Newgoodfine Store,https://www.aliexpress.com/item/4000628429801.html
Craft-Supplies Stitch-Markers Helpful-Accessories Sewing Knitting Silver-Color Home 10pcs,1.36,1.71,5,0,0.38,DoreenBeads Crafting Store,https://www.aliexpress.com/item/4001108490293.html
Cup-Dispenser Drinker Water-Bowl Pet-Puppy Sport-Bottle Dogs Travel Outdoor 500ml Cat,3.71,3.71,230,0,0,Venxuis Official Store,https://www.aliexpress.com/item/4000971362577.html
Wool Blanket Bedding Carpet Sofa Plush Small Micro-Throw Warm Kids Home Super Office,0.65,0.65,85,3,1.29,Richness Store,https://www.aliexpress.com/item/4000712432189.html
Handmade Charms Art-Paper-Kit Blank-Sheets Shrink-Film DIY Plastic Clear,1.97,1.97,12,0,1.68,HOMEABCD Store,https://www.aliexpress.com/item/4000979607180.html
Badges Patches Souvenirs Morale Negative-Blood-Type Positive Black Tactical 3D Outdoor,0.84,1.39,65,4.9,2.74,LIBERWOOD Official Store,https://www.aliexpress.com/item/4000934606493.html
Pegs Clips Clothespin-Paper Plastic Small Mini Craft 20pcs for Decoration Size,0.67,0.67,359,4.9,0,Shop3897015 Store,https://www.aliexpress.com/item/4000506742851.html
2020 Vintage Manual Hand Crank Wooden Metal Coffee Pepper Herb Mill Spice Grinder Adjustable Coarseness Coffee Hand Grinder,3.56,3.56,91,4.7,0,ForU-Live Store,https://www.aliexpress.com/item/4000538185167.html
Liquid-Spray-Bottle Vinegar-Sprayer Cruet Cooking-Seasoning-Supplies Olive-Oil Convenient,4.08,5.14,33,0,0,Shine Girl Store,https://www.aliexpress.com/item/4001094745002.html
Necklace Puppy Engraving Cat-Collar Small Dog Safety Kittens Adjustable Nylon Personalized,22.4,22.4,3227,4.7,0,Pawfect pet Store,https://www.aliexpress.com/item/4000093411225.html
Glass-Cleaner Cleaning-Brush Good-Helper Washing The-Windows Multifunctional Magic Hot,1.53,1.53,71,5,0,Aestheticism House Store,https://www.aliexpress.com/item/4000008503273.html
Posters Coated-Picture Paintings Room-Decoration Wall-Art Blond Frank-Ocean Portrait,2.66,2.66,21,0,0,htt poster Store,https://www.aliexpress.com/item/4001085570197.html
Paper Planner Decorative Scrapbooking Junk Journal Book-Pages Collage-Material Old Mini,1.74,1.74,113,5,0,XINAHER Store,https://www.aliexpress.com/item/4001032066262.html
Stationery Refills-Markers Replace-Supplies Watercolor-Gel-Pen Office School-24colors,0.7,2.13,66,0,0.73,CHENTUAN Store,https://www.aliexpress.com/item/4001028833185.html
Dough-Mat Pad-Accessories Bakeware Cooking-Gadgets Silicone Pastry Kitchen -25 Kneading,1.91,7.53,5,0,0.73,Aliexpress Dining Kitchen Store,https://www.aliexpress.com/item/4001139679417.html
USB Mini Fan Type C Small Fan Portable Pocket Fans For Smart Phones 1W Power 5V USB Devices Low Consumption,1.06,1.06,5,0,0,Anpro Kitchen Store,https://www.aliexpress.com/item/4001142586605.html
Vacuum-Bag Clothes Organizer Storage-Border Travel Foldable Compressed Transparent Saving,0.24,2.39,540,4.9,0,urban life Store,https://www.aliexpress.com/item/4000212201073.html
Fairy-String-Light Ornament Curtain Garland Navidad Christmas-Decorations Gift LED Home,2.94,15.75,1610,4.7,4.98,VOILEY Official Store,https://www.aliexpress.com/item/4000145508484.html
Diamond Embroidery Cross-Stitch Mosaic Crystal Rhinestones Icon Religious Gift True Diy,4.68,6.48,2037,4.9,0,store 326232 Store,https://www.aliexpress.com/item/32894829841.html
Snap-Buttons Clothing-Accessory DIY Plastic Baby Children 12mm Round New T5 for 10sets,1.01,1.01,154,5,0,QIMONTON China Store,https://www.aliexpress.com/item/4000979758279.html
Stretch-Band Crafts-Supplies Ribbon-Fold Over Elastic Color-Printed 5-Colors Mix 5yards/Set,1.91,2.38,131,0,0,WeiAi Crafts Store,https://www.aliexpress.com/item/4001002324720.html
Decro Embroidery-Kits Cross-Stitch-Sets House Counted Needlework Garden Small QIANZEHUI,5.68,25.62,425,4.8,0,QIANZEHUI Store,https://www.aliexpress.com/item/32811835115.html
Glass-Bead Beading Accessories Jewellery Mixed-Seed-Beads Garment Embroidery Bugle Multi-Colors,0.81,0.98,346,4.8,0,MICHAEL ANDERSON,https://www.aliexpress.com/item/4000835484848.html
"1Pcs Foldable 4 Layers Drying Rack for Vegetable Fish Dishes Mesh Hanging Drying Net Hanging ,Natural Way to Dry Food",9.55,9.55,0,0,0.25,No. 18 House Supplies Store,https://www.aliexpress.com/item/4001151691255.html
Pajamas Pet-Jumpsuit Star-Costume Dogs Cats Flannel Winter Warm,2.5,3.62,15,0,0,HoneyLife Store,https://www.aliexpress.com/item/4000944186153.html
Trap-Lamp Repellents Ultraviolet-Light Killer LED USB Pest Electric Electronics-Photocatalyst,8.12,8.12,2831,4.5,0,TETOU House Store,https://www.aliexpress.com/item/4000718152444.html
Garden Kneeler Kneeling-Pad-Supply Folding Handles with Stainless-Steel Eva Welcome-Dropshipper,0.97,0.97,27,0,1.75,Welcome Oversea Store,https://www.aliexpress.com/item/4001066588610.html
Balloon-Garland Macaron-Balloons Latex Party-Decoration Pastel-Party Birthday Candy Wedding,1.57,3.54,3114,4.8,0,Gee Decoration Store,https://www.aliexpress.com/item/4000280780163.html
Melamine Sponge Eraser Nano Bathroom Clean-Accessory/dish-Cleaning Office Kitchen White,5.96,5.96,12612,4.5,0,MeyJig Official Store,https://www.aliexpress.com/item/32763674955.html
Dentures-Props Glue Decorations Adhesive Teeth-Fangs False-Teeth Vampire Party Diy Halloween,0.68,1.5,3392,4.7,0,Knitting Daily Store,https://www.aliexpress.com/item/4000099218410.html
Diamond Embroidery Mosaic Cross-Stitch Animals Home-Decoration 5d Diy Princess Cartoon,2.63,2.63,1255,4.7,0,Qluo Store,https://www.aliexpress.com/item/4000372297671.html
Feather Hand Fan Handmade Luxurious Spanish Dance Lace Feather Fans for Wedding Party Gift Dropshipping TOP Wedding Decoration,6.09,13.33,152,4.7,1.56,Sweetest Life Store,https://www.aliexpress.com/item/4000325420485.html
Tape Sealing-Strip Sink Wall-Sticker Self-Adhesive Shower Bath Kitchen Waterproof PVC,4.99,4.99,20178,4.8,1.74,Pearly Life Store,https://www.aliexpress.com/item/4000200299073.html
Kitchen Aprons Cleaning-Pinafore Linen Cotton Women 1pcs Alphabet Letter Bib Household,1.97,3.49,222,4.9,0,DecorBetter Store,https://www.aliexpress.com/item/4000627795929.html
Paillette Sequin Diy-Accessory Sewing-Decoration Crafts Coser Round Lentejuelas Flat,0.47,0.55,274,5,0,lucky sewing Vicky wu Store,https://www.aliexpress.com/item/4000099313855.html
Macrame Wall Hanging Handwoven Bohemian Cotton Rope Boho Tapestry Home Decor,29.47,32.06,199,4.5,0,YoYo-Home Store,https://www.aliexpress.com/item/4000437167101.html
Packing Sewing-Accessories Universal All-Brand 130x705h 15x1 for Mixed-Kit 10pcs/Set,0.63,1.11,248,4.8,0,ZOTOONE Garment Store,https://www.aliexpress.com/item/4000158902517.html
Kit Accessories Hoop-Frame Ring-Hoop Embroidery Bordado Cross-Stitch Wood Bamboo Mini,1.34,4.75,222,4.8,0,have a trying Store,https://www.aliexpress.com/item/4000229004490.html
Clothing Hair-Remover Wood Dry-Cleaning Wool Shaving-Ball Manual Cashmere Portable To,2.14,2.14,201,4.6,0.49,China Home&Garden Store,https://www.aliexpress.com/item/4000442553203.html
Mold Dessert-Ice-Cream-Mold Popsicle-Stick Ice-Cube-Tray Silicone Diy with Allforhome,1.89,4.99,5586,4.9,0,Allforhome Official Store,https://www.aliexpress.com/item/33014775496.html
MIUSIE Stitching-Tool Hole-Punches Prong Diamond-Point with 1/2/4/6 1pcs Lacing Handmade,1.53,3.35,492,4.9,0,MIUSIE Official Store,https://www.aliexpress.com/item/4000114364272.html
Soap-Mold Form-Tray Cake-Mould Craft Baking-Tools Homemade 6-Cavity Rectangle Diy-Making,0.86,2.86,716,4.8,0,US World Store,https://www.aliexpress.com/item/4000334431890.html
Paper-Stickers Packs House Laptop-Decoration Money-Heist Phone Scrapbooking Diy Anime,1.95,1.95,198,4.9,0,Remagic Official Store,https://www.aliexpress.com/item/4000497906749.html
5-ring hat storage coat hook behind the door without trace wardrobe bag scarf coat hook,7.9,7.9,0,0,0,ABD Department Store,https://www.aliexpress.com/item/4001052783570.html
Teacup Wine-Cups Soup-Cup Ceramic Lattice-Pattern Pottery Hand-Painted Coarse Originality,5.69,13.29,626,4.6,0,Breezy Valley,https://www.aliexpress.com/item/32858446835.html
Belt-Box-Set Glass-Seed-Beads Charm Rondelle-Beads Embroidery-Making 2mm for DIY,3.69,4.91,148,4.9,0,Rhinestone & Crystal Jewelry world,https://www.aliexpress.com/item/4000731884473.html
Niclosamide Tablets 500mg Deworm 100 Tablets,6.32,6.32,20,0,3.17,Ali-Kitchen Store,https://www.aliexpress.com/item/4001118113437.html
Dogs-Costume Puppy-Pets Milk-Print Chihuahua Cotton Small Medium Soft for Pet-Shirt Pug,4.02,4.71,28,0,0,PetMundo Official Store,https://www.aliexpress.com/item/4001084478579.html
Hot Sale 10pcs 0.5mL Mini Small Tiny Clear Cork Stopper Glass Bottles Vials Wholesale,1.04,1.04,161,4.5,0,Enjoying+life Store,https://www.aliexpress.com/item/32904303979.html
Sewing-Machine-Needles Household Assorted Metal DIY 50pcs Home Universal 11/14/16/18,1.19,1.19,107,5,0.16,World Market Store,https://www.aliexpress.com/item/4000411371771.html
Riche-Fabric Dress Lemon Wedding Nigerian Green African Brode Bazin Lace for LAM-A1,24.42,24.42,124,5,6.97,Swallow's Fabric Store,https://www.aliexpress.com/item/4001067488758.html
Wall Shelf Decorative Metal Wooden Rustic Floating Shelf Storage for Kitchen Bathroom Towel Frame Multifunction Storage Holder,25.73,50.09,89,4.9,48.81,ourwarm HomeDecoration Store,https://www.aliexpress.com/item/4000735117311.html
Harness Vest Leash Bell Pet Puppy Small Medium For Kitten Dog with Walking Imitated Pet-Cat,2.59,3.74,336,4.9,0,HANDINHAND Official Store,https://www.aliexpress.com/item/4000759681843.html
Posters Glossy-Paper Wall-Prints Home-Decoration Kpop Vivid-Color,1.69,2.34,370,4.8,0,Lulu loves cucumber Store,https://www.aliexpress.com/item/33060819665.html
Charger Case-Accessories Organizer Cables-Wires Storage-Bags Item Usb-Gadgets Power-Battery-Zipper,6.9,6.9,1394,4.9,0,Shop5595024 Store,https://www.aliexpress.com/item/4000602710350.html
Blade Punch Die-Mold Stencils-Dies Scrapbook Paper-Craft Mushroom-Decoration Metal Cut,1.06,1.06,112,4.9,0.29,Piggy Store,https://www.aliexpress.com/item/4000895831862.html
Topper Birthday Cake-Decoration Dinosaur Cake Kids Toys Jungle-Party Baby Shower Boy,0.97,3.91,286,4.8,0,cakelove Official Store,https://www.aliexpress.com/item/4000688875893.html
Plastic Package Resealable Self-Sealing Cellophane Clear Small Thick 100pcs/Lot,3.84,3.84,71,5,0,Cowslip Storage Bag Store,https://www.aliexpress.com/item/4000420604002.html
Cat-Bowl Pet-Products Pet-Supplies Raised-Stand Dog-Feeder Non-Slip Double with,7.71,11.27,3092,4.8,0,"eLife Co.,Ltd",https://www.aliexpress.com/item/4000350193602.html
304 stainless steel portable student multi-layer lunch box 1PC thermal insulation adult children picnic school food containers,13.09,22.08,7,5,4.67,Kitchen Artifact Store,https://www.aliexpress.com/item/4000873945678.html
Keychain Mold Castle Mould Silicone Jewellery-Making Epoxy Resin Glossy for DY0479 Shiny,2.24,2.24,306,5,0.34,Aliminhao Official Store,https://www.aliexpress.com/item/4001004937471.html
Fan Hand-Fans Round-Disk Folding Cool Creative Portable Summer Gift Party Mini 1PC Nylon,0.21,0.95,80,4.9,0,Fantasy Trend Life Store,https://www.aliexpress.com/item/4000093416826.html
Blade Punch Stencils-Dies Knife-Mould Paper-Craft Scrapbook Cloud-Decoration Metal 5pcs,0.88,0.88,102,5,0.29,Piggy Store,https://www.aliexpress.com/item/4000753905561.html
Wall-Sticker Imitation-Brick Marble Bedroom Self-Adhesive DIY Home-Decoration Kitchen,0.36,3.9,901,4.5,0,Kaguyahime Store,https://www.aliexpress.com/item/33031330074.html
100PCs Pm2.5 Activated Carbon Filter Face Cover Breathing Insert Protective Mouth,9.11,12.27,64,4.5,4.19,BOMBOM Store,https://www.aliexpress.com/item/4001062300565.html
Ostrich-Feathers Hot-Cakes Green Party/wedding-Decoration Like Blackish High-Quality,0.99,0.99,221,4.9,0,913725 Store,https://www.aliexpress.com/item/4000519761874.html
Modern Canvas Painting Wall-Pictures Hot-Poster Prints Music-Star Living-Room Harry-Styles,5.67,23.59,138,4.9,0,Seven-Plus Store,https://www.aliexpress.com/item/4000226775004.html
Smart UV Toothbrush Sterilizer Solar Energy Electric Toothbrush Disinfectant Cleaning Wall Mount Toothpaste Dispenser Holder,7.67,13.97,1,0,0,Foryourpage Store,https://www.aliexpress.com/item/4001066248895.html
Adult Masks Dust-Face-Mask Mascarillas Protect AIR-FILTER Fine 5-Layers 400pcs In-Stock,8.4,82.32,43,0,0,Shop5878232 Store,https://www.aliexpress.com/item/4001132174654.html
Dog Jumpsuit Overalls Pet-Costume Avocado Fleece Chihuahua Winter Cute for Warm Comfortable,2.48,4.39,52,4.3,0,IN Trend -PET Store,https://www.aliexpress.com/item/4000483310484.html
Hammock Seat-Cover Pet-Carriers-Bag Pet-Basket Transportin Folding Cats Travel Dog Dogs,6.51,12.55,62,0,0,AliExpress Stylized Pets Store,https://www.aliexpress.com/item/4001101073924.html
Top Finel Purple Tulle for Windows Luxury Sheer Curtains for Kitchen Living Room The,3.33,23.86,732,4.7,0,Topfinel official store,https://www.aliexpress.com/item/32255723375.html
Red Rose Artificial-Decoration Gift Christmas-Gifts Teddy Bear 25cm Valentines Flower,5.66,7.52,23494,4.7,3.41,Shop4745018 Store,https://www.aliexpress.com/item/32974518041.html
Poster Art-Decoration Wall Anime Tokyo Old-Style Ghoul Japan Family O23 High-Popularity,0.97,0.97,254,4.6,0,MrrChen Store,https://www.aliexpress.com/item/4000548693794.html
Box Handbag Container Storage-Bag Painting-Accessories Embroidery-Tools Carry-Case 60-Bottles,3.59,16.3,837,4.9,0,Fofest Store,https://www.aliexpress.com/item/4000062682818.html
Jungle Forest Animal Theme Disposable Tableware sets Leopard Zebra paper Plates/cups/napkins Wedding Birthday Party Decoration,1.27,3.14,39,5,1.23,Party Yearn Store,https://www.aliexpress.com/item/4000860216443.html
Bbq-Needle-Stick Barbecue-Skewers Cooking-Tools Stainless-Steel Flat Outdoor Reusable,4.44,4.44,1807,4.6,0,M & Q funny life Store,https://www.aliexpress.com/item/32853322157.html
Rolling-Pin Flower Cookie Fondant-Roller Embossing Wooden Kitchen-Baking Christmas NEW,1.99,4.61,381,4.6,0,A Little Life Store,https://www.aliexpress.com/item/4000183906297.html
Disposable Tableware Plates Napkins Party-Supplies Birthday-Pack Ladybug-Theme Favor,1.55,3.5,219,4.7,0,Daniel's party Store,https://www.aliexpress.com/item/4000751867551.html
Pet-Bed House Kennel Puppy Washable Small Soft Large For Dogs Medium Warm Bone Linen,2.36,6.83,7,0,0.52,AliExpress Stylized Pets Store,https://www.aliexpress.com/item/4001112994278.html
Storage-Rack Refrigerator-Organizer Drawer-Basket Spacer Pull-Out Layer Adjustable 1--5pcs,0.99,24.31,17,0,0,MO-OD Store,https://www.aliexpress.com/item/4001091329459.html
Basins Dish-Tub Folding-Sink-Drain-Basket Cutting-Board Multifunction Travel Collapsible,6.91,7.49,59,0,0,Aliexpress Dining Kitchen Store,https://www.aliexpress.com/item/4001101146012.html
Tulle Curtains Window Treatments White Yarn Living-Room Kitchen Modern Europe Solid,2.69,46.03,1694,4.9,0,tiyana Official Store,https://www.aliexpress.com/item/32705221484.html
Timemore Electronic Scale with Timer 2kg/0.1g LCD Digital Kitchen Coffee Scales Weighing tool libra Precision Jewelry Scale USB,48.6,58.5,237,4.8,0,LVXIAO&COMPANY Store,https://www.aliexpress.com/item/4000313483351.html
Patches Thermal-Stickers Iron-On-Transfer Coffee Russian Girls Lady for Mom,1.47,2.39,2448,5,0,DIY Iron-on Transfer Store,https://www.aliexpress.com/item/4000631455989.html
Chair-Cover Spandex Stretch Dining-Room Elastic Wedding Banquet Kitchen for Hotel Solid-Color,0.47,17.78,2257,4.7,0,Newgoodfine Store,https://www.aliexpress.com/item/4000640699054.html
Sign Decorative-Plate Seaside Beach-Decor Plaque Metal Vintage,3.92,4.9,647,4.8,0,Putuo Decor Official Store,https://www.aliexpress.com/item/4000124110204.html
Nozzle Pastry-Bag Cake-Decorating-Tools Icing-Piping-Cream Stainless-Steel Kitchen 48pcs/Lot,2.11,3.76,51,0,0,YXMOULD Sugarcraft Museum Store,https://www.aliexpress.com/item/4001052005701.html
Bunting-Banner Flags Garland-Supplies Decoration Paper Baby Shower Happy-Birthday Bnaner,1.49,4.03,746,4.7,0,WNYZQA Store,https://www.aliexpress.com/item/10000009681788.html
Ice-Bucket-Mold Cube-Maker Space-Saving Barware Kitchen Party Silicone Large Portable,3.99,11.59,1293,4.5,0,mixxarbulb Store,https://www.aliexpress.com/item/4000192642259.html
Corer Windmill Slicer Watermelon-Cutter Tong Fruit-Salad-Tool Stainless-Steel for Summer,3.94,3.94,280,5,0.53,Shopping Cabin of tiny Zhang,https://www.aliexpress.com/item/33007775464.html
Timemore BLACK BASIC coffee scale smart digital scale pour coffee Electronic Drip Coffee Scale with Timer2kg,53.6,53.6,304,4.6,0,Coffee Talk Store,https://www.aliexpress.com/item/10000017999031.html
Basins Dish-Tub Folding-Sink-Drain-Basket Cutting-Board Multifunction Travel Collapsible,6.91,7.49,59,0,0,Aliexpress Dining Kitchen Store,https://www.aliexpress.com/item/4001101146012.html
Modern Canvas Painting Wall-Pictures Hot-Poster Prints Music-Star Living-Room Harry-Styles,5.67,23.59,138,4.9,0,Seven-Plus Store,https://www.aliexpress.com/item/4000226775004.html
Zip-Lock Pouches Reclosable Plastic-Bag Hologram Aluminum-Foil Zipper Small Water-Proof,0.83,14.55,1068,4.7,3.05,World vs You Store,https://www.aliexpress.com/item/4000352864258.html
"chameleon pigment 9612 color changing pearl powder for paint, auto paints, nail polish",4.99,4.99,43,5,0,Colour and life Store,https://www.aliexpress.com/item/32855040151.html
Chair-Cover Spandex Stretch Dining-Room Elastic Wedding Banquet Kitchen for Hotel Solid-Color,0.47,17.78,2257,4.7,0,Newgoodfine Store,https://www.aliexpress.com/item/4000640699054.html
Storage-Rack Refrigerator-Organizer Drawer-Basket Spacer Pull-Out Layer Adjustable 1--5pcs,0.99,24.31,17,0,0,MO-OD Store,https://www.aliexpress.com/item/4001091329459.html
Red Rose Artificial-Decoration Gift Christmas-Gifts Teddy Bear 25cm Valentines Flower,5.66,7.52,23494,4.7,3.41,Shop4745018 Store,https://www.aliexpress.com/item/32974518041.html
Nozzle Pastry-Bag Cake-Decorating-Tools Icing-Piping-Cream Stainless-Steel Kitchen 48pcs/Lot,2.11,3.76,51,0,0,YXMOULD Sugarcraft Museum Store,https://www.aliexpress.com/item/4001052005701.html
Blade Punch Stencils-Dies Knife-Mould Paper-Craft Scrapbook Cloud-Decoration Metal 5pcs,0.88,0.88,102,5,0.29,Piggy Store,https://www.aliexpress.com/item/4000753905561.html
Tulle Curtains Window Treatments White Yarn Living-Room Kitchen Modern Europe Solid,2.69,46.03,1694,4.9,0,tiyana Official Store,https://www.aliexpress.com/item/32705221484.html
Top Finel Purple Tulle for Windows Luxury Sheer Curtains for Kitchen Living Room The,3.33,23.86,732,4.7,0,Topfinel official store,https://www.aliexpress.com/item/32255723375.html
free ship new style max long 5m Japanese hanging string flag sushi resturant small flags izayaka decoration flag small banners,19.73,34.18,2,0,0,AISONG Official Store,https://www.aliexpress.com/item/4000782700116.html
Chair-Cover Computer Removable Rotating Office Waterproof Stretch-Desk-Seat Anti-Dirty,3.79,8.85,160,4,0,Newlife Dropshipping Store,https://www.aliexpress.com/item/4001058151742.html
Poster Art-Decoration Wall Anime Tokyo Old-Style Ghoul Japan Family O23 High-Popularity,0.97,0.97,254,4.6,0,MrrChen Store,https://www.aliexpress.com/item/4000548693794.html
Wind-Chime Living-Decoration Garden Oriental-Lucky Copper Chinese Outdoor Antique Metal,2.62,2.62,191,4.8,0,Mr Luck's House Store,https://www.aliexpress.com/item/33055458958.html
Disposable Tableware Plates Napkins Party-Supplies Birthday-Pack Ladybug-Theme Favor,1.55,3.5,219,4.7,0,Daniel's party Store,https://www.aliexpress.com/item/4000751867551.html
Dog Jumpsuit Overalls Pet-Costume Avocado Fleece Chihuahua Winter Cute for Warm Comfortable,2.48,4.39,52,4.3,0,IN Trend -PET Store,https://www.aliexpress.com/item/4000483310484.html
Folding Fan Ornaments Hand-Fan Art-Craft Gift Dance Silk Japanese-Pattern Home-Decoration,1.52,1.52,20,0,0,Joyment Store,https://www.aliexpress.com/item/4000805233919.html
Corer Windmill Slicer Watermelon-Cutter Tong Fruit-Salad-Tool Stainless-Steel for Summer,3.94,3.94,280,5,0.53,Shopping Cabin of tiny Zhang,https://www.aliexpress.com/item/33007775464.html
Master Star Granite Coating Chinese Hot Pot 6.5L Deep Two-flavor Pot High Quality Thick Stockpot Induction Cooker,39.98,43.36,1,5,0,Master Star Dropshipping Store,https://www.aliexpress.com/item/4000764532079.html
Waterproof Tablecloth Glass Transparent Kitchen-Pattern PVC with D',1.87,38.94,589,4.6,0,LOVRTRAVEL FIERY Store,https://www.aliexpress.com/item/4000557378220.html
Sofa-Covers Corner Stretch Spandex Living-Room Elastic L-Shape Solid-Color for Towel,11.4,37.33,10244,4.4,0,S-EMIGA Official Store,https://www.aliexpress.com/item/4000081573135.html
Bunting-Banner Flags Garland-Supplies Decoration Paper Baby Shower Happy-Birthday Bnaner,1.49,4.03,746,4.7,0,WNYZQA Store,https://www.aliexpress.com/item/10000009681788.html
Pet-Bed House Kennel Puppy Washable Small Soft Large For Dogs Medium Warm Bone Linen,2.36,6.83,7,0,0.52,AliExpress Stylized Pets Store,https://www.aliexpress.com/item/4001112994278.html
Ice-Bucket-Mold Cube-Maker Space-Saving Barware Kitchen Party Silicone Large Portable,3.99,11.59,1293,4.5,0,mixxarbulb Store,https://www.aliexpress.com/item/4000192642259.html
Dresses Puppy-Skirt Summer Cute Lattice-Style for Spring XS-XL Pet-Dog Delicate,2.77,3.24,323,4.8,0,BenRussell Store,https://www.aliexpress.com/item/32867370118.html
Riche-Fabric Embroidery Bazin Brode-Latest African Fashion with Net HL053001 7-Yards,49.28,49.28,133,5,0,Ding Dong fabric Store,https://www.aliexpress.com/item/4001099089664.html
The Moon Puzzles 1000 Pieces Difficult For Adult Jigsaw Puzzle Toys The Moon And Earth Puzzles Educational Toys Child Kids Gifts,3.79,17.16,93,4.4,0,Nordicn Store,https://www.aliexpress.com/item/4001032041494.html
Mirrored Stickers Decorative Art Acrylic Living-Room Hexagon Wall J2Y 12pcs DIY 3D,0.62,1.98,1419,4.6,0,Happyard Store,https://www.aliexpress.com/item/32828379691.html
Dogs Swimwear Swimming-Suit Pet Life-Jacket Shark Summer,8.03,12.03,717,4.9,0,Piang Gouer Store,https://www.aliexpress.com/item/32903067070.html
Gloves Dance-Tight Jewelry Etiquette Summer Thin Black 1-Pair Spring Stretch Women,1.48,1.48,69,5,0,Super-Rich Homesupply Store,https://www.aliexpress.com/item/4000933218564.html
