Title,PriceMin,PriceMax,Sold,Rating,Shipping,Store,URL
Bodysuit Outfits T-Shirt Father's-Day-Gift Me Daddy Baby Matching And Our 1pcs Infant,3.98,4.98,32,5,0,jiangkao fashionable Store,https://www.aliexpress.com/item/4000789931636.html
Suit Suspender-Trousers Down-Jacket Baby Winter Children's Girl New Male Raccoon-Hair,71.25,71.25,312,5,0,Jieshan's Store,https://www.aliexpress.com/item/4000436950140.html
Canvas Shoes Sneakers Girls Autumn Baby Boys Breathable Children New Mesh Casual,7.73,9.5,114,4.4,0.52,HUMOR RABBIT Boutique Store,https://www.aliexpress.com/item/4000601881240.html
600ml Baby Kids Children Sippy Suction Cup School Drinking Water Straw Bottle,4.92,4.92,7,0,0,Mummy Baby Store,https://www.aliexpress.com/item/4000823679381.html
Chain Pacifier-Clip Dummy-Clip Floral Baby Silicone Wood Nipple-Feeding Infant Panda,0.34,2.59,10,0,0,Shop5573027 Store,https://www.aliexpress.com/item/4000562949542.html
Matching Dress Lemon Summe Baby-Girls Family-Look Mommy And Mum Sleeveless C0477,7.26,10.68,37,5,0,Unique Friend Store,https://www.aliexpress.com/item/33048885979.html
MIYOCAR Pacifier-And-Clip-Set Lip-Bling Sexy Baby Red with Princess Red-Bow First-Walker-Shoes-Set,12.41,33.12,11,5,0,YoYo hand made Store,https://www.aliexpress.com/item/4000157044881.html
Sleepwear Pajamas-Set Toddler Baby-Girl Shorts Nightclothes-Set Summer Sling Cotton Two-Piece,5.24,5.58,7,0,1.35,lbaby Store,https://www.aliexpress.com/item/4001014513127.html
Learning-Dishes Bowls Dinnerware Feeding-Bowl Soup Baby Kids Lid-Straw Training Infant,7.31,7.31,5,0,0.63,growbaby Store,https://www.aliexpress.com/item/4001035096606.html
Stockings Tights Pantyhose Girl Rhinestone Toddler Baby Kids Fishnet Children New Girls,1.34,1.34,23,5,0.2,babymama Store,https://www.aliexpress.com/item/4000536601717.html
Toddler Bow Headband Turban Kids Baby/girls FOCUSNORM Soft Big-Ball,1.02,1.02,67,5,0.43,Lenny Lemons Store,https://www.aliexpress.com/item/32953553000.html
Tableware Bowl Spoon Feeding-Set Baby-Plate Silicone Non-Slip Food-Grade,5.63,12.92,16,5,0,Toy City 002 Store,https://www.aliexpress.com/item/4000960681263.html
Girls Pajamas Sleepwear Snow-White Elsa Princess Children Autumn Mermaid Anna 3-14y,3.48,4.55,66,4.1,2.85,extraordinary baby Store,https://www.aliexpress.com/item/4000750949812.html
Toddler Shoes Baby-Girls 1-3years Boys Spring P01 TX08 22-27 Autumn 3colors,2.66,3.43,29,5,4.26,AnTong2016 Store,https://www.aliexpress.com/item/4000551378711.html
Blouse T-Shirts Clothing Jurassic Park Dinosaur Kids Girl Children Boy Graphic Teenagers,4.5,7.99,39,4.9,1.17,World T-shirt Store,https://www.aliexpress.com/item/4000488837451.html
Thumb-Gloves Stop Sucking-Fingers Baby Prevent-The-Baby Child of Give-Up Finger-Bite-Prevention,3.94,3.94,352,4.8,2.42,Guoqing store,https://www.aliexpress.com/item/32740774006.html
Disney Fork-Cutlery-Set Chopsticks Training Baby Children's Auxiliary-Spoon Practice,6.15,6.15,7,5,5.79,Disney MUMBABY Store,https://www.aliexpress.com/item/4001034180766.html
SAILEROAD Pajamas Kids Sleepwear-Set Homewear Long-Sleeve Luminous-Dinosaur Girls Boys,3.66,9.16,428,4.8,0,SAILEROAD kidsclothes Store,https://www.aliexpress.com/item/4000029107445.html
T-Shirt Matching-Set Short-Sleeve Low-Discount Family Bear Fashion Children's,39.85,46.37,3,0,0,Little fish children's clothes Store,https://www.aliexpress.com/item/4001090203483.html
Clouds Baby Cushion Pillow Bedding Crib-Decor Nordic-Style Infant Plush Cotton INS,7.14,8.88,13,5,0,Good For You2 Store,https://www.aliexpress.com/item/4000825709703.html
Kids Headwear Barrettes Hair-Clips Crown Baby-Girl Bows Cute Bowknot 5pcs/Set,1.62,2.59,61,4.9,0.2,Enjoy shopping ( offer drop shipping ),https://www.aliexpress.com/item/32967206406.html
Pacifier Clips Chain Nipple-Holder Baby Leash Feeding Cotton for Infant Belt,0.94,0.94,237,4.7,0.48,Funny Toy&Baby Store,https://www.aliexpress.com/item/33051715592.html
Girls Sandals Shoes Pearl Green Kids Summer Open-Toe Pink Cute Flower Beading Zip Roman,7.75,10.72,62,4.3,0,Shop4434035 Store,https://www.aliexpress.com/item/4000822128898.html
Baby-Mask Mask-Hooks Extender Disposable Child for Anti-Pain 5pcs/Lot Mouth,2.84,2.84,17,5,0,Elves Baby Store,https://www.aliexpress.com/item/4001015126320.html
Breathable Panties Underwear Shorts Teenager Baby-Boy Boys Kids Cartoon Cotton Cute Children's,7.14,8.52,60,4.8,2.51,Anything Store,https://www.aliexpress.com/item/4000180337593.html
Child Socks Babe Matching Girls Striped Winter Boys Kids New Autumn 1-12 Color Student,4.68,4.68,364,4.8,0,Tukla babe Official Store,https://www.aliexpress.com/item/32955003117.html
Swaddle Blanket Bamboo Muslin Cotton-Fabric Baby 6-Layer Wholesale,7.03,11.53,9,4.8,0.78,LuckyBabyFans Store,https://www.aliexpress.com/item/4000466089694.html
Ear-Hairband Turban Green Baby Kids Wraps Knot-Head Pink Girls Hot Bow Black Cotton Rabbit,0.3,0.81,20,4.8,0.84,Baby&Mommy Store,https://www.aliexpress.com/item/4000315224227.html
Matching Skirt T-Shirt Daughter-Dress Mom Pink Baby-Girl Bow-Knot Fashion And NASHAKAITE,7.88,11.83,35,5,0,NASHAKAITE DAD&MOMMY & ME Store,https://www.aliexpress.com/item/32922081396.html
Dress Family Outfits Daughter-Dresses Highwaist-Tank Mom Matching Girls Mum Baby Mommy And,5.59,11.33,36,5,0,Princess Online Store,https://www.aliexpress.com/item/4000755827043.html
Hook-Loop Diaper Microfiber-Inserts Washable Nappy Bloomz Littles Reusable 0 AND,25.19,25.19,303,5,0,Littles&Bloomz Store,https://www.aliexpress.com/item/32921441765.html
Cute Baby Toddler Dummy Pacifier Soother Nipple Wooden Chain Clip Holder Gift Gift,1.34,1.34,135,4.9,0.37,Baby SHOpping emm Store,https://www.aliexpress.com/item/32839352672.html
Pacifier-Clip-Holder Dummy-Clips Clasps-Holders-Accessories Infant Baby Solid for 5pcs/Lot,0.49,0.49,14,0,1.2,Shop5800758 Store,https://www.aliexpress.com/item/4001041935134.html
Sleepwear Boys Pajamas-Set Nightwear Short-Sleeve Baby Kids Children Cartoon Summer Clothing,2.93,6.25,45,4.3,0,YsoYok Store,https://www.aliexpress.com/item/4000718175483.html
Muslin Cotton Blanket Swaddle Infant Baby Kids Children 6-Layers 29-Styles 110--110cm,9.71,18.78,433,4.8,0,WINJAUNT Maternal&infant Store,https://www.aliexpress.com/item/32984075768.html
Daughter-Dresses Family-Look Mommy And Me Floral NASHAKAITE Half with Belt Half-Puff-Sleeve,10.37,14.76,48,4.1,0,NASHAKAITE DAD&MOMMY & ME Store,https://www.aliexpress.com/item/32907802483.html
Bed Throw Blanket Simba Lion Anime Warm Bayby Kids Fleece Children Cartoon Print 3D 015,17.67,28.55,2,0,0,PLstar Cosmos Professional Children's Set Store,https://www.aliexpress.com/item/4000785634760.html
Magic-Socks Boat Anti-Skid Invisible Silicone Super-Elastic Shallow Baby-Girl Kids Summer,0.96,2.58,14,5,0.22,Beikinyuans Store,https://www.aliexpress.com/item/33053272879.html
Unicorn Socks-Set Girls Boys Winter Children Cartoon 100%Cotton 5pairs/Pack Unisex,4.09,4.09,306,4.9,0,Felkg good Luck Store,https://www.aliexpress.com/item/32966846932.html
Clothing-Suit Leggings-Pants Pajama-Set Baby-Girl Cartoon Kids Children Warm 2pcs Cotton,2.58,4.49,280,4.7,3.35,extraordinary baby Store,https://www.aliexpress.com/item/32855763052.html
Stockings Tights Pantyhose Toddler Girls Winter Cotton Kids Autumn Solid 5-Colors Hosiery,1.93,2.25,43,3.9,1.63,Baby Here Store,https://www.aliexpress.com/item/4000470934748.html
Swaddle Blankets Bath-Towel 120x120cm Bamboo Baby Plain-Color Newborn Cotton Solid Gauze,3.43,11.01,19,5,0,BabyLucky Store,https://www.aliexpress.com/item/4000751803998.html
Bedding-Set Nest Bed-Linen Baby Bed Custom-Design Luxury Blue Cot Star Orthopedic,45,45,61,4.5,0,JajuBaby Store,https://www.aliexpress.com/item/10000057319065.html
Sleepwear Children Bathrobes Pajamas Home-Clothes Toddler Girls Kids Nightgown Flannel,1.58,7.74,92,4.8,4.74,wertqty Store,https://www.aliexpress.com/item/4000289305492.html
Pajama Lolita Loungewear.children Sleep Toddler Girls S-Clothing Sets.vintage Kid Turndown-Collar,9.98,13.98,4,0,0,UNIKIWI _Baby_ Store,https://www.aliexpress.com/item/4001021280659.html
Couples Outfits Swimsuit Bikini Mom Daughter Family Matching Girls Boys Men Dad Son Blue,3.7,9.99,34,4.5,0,Sunshine Kids Store,https://www.aliexpress.com/item/4000624210576.html
Big Size Food Grade Silicone Nipples Adult Pacifier Funny Parent-child Toys,0.75,1.45,371,4.6,0.14,baby & mami park Store,https://www.aliexpress.com/item/32898858888.html
Kids Tights Girls Winter Cotton Autumn for Children 1-10-Years Princess-Dress High-Elasticity,1.93,3.69,61,4.5,0,Coconut Tree Store,https://www.aliexpress.com/item/4000092992389.html
Family Dress Parent Child Daughter Outfits And Hollow-Out,3.44,4.46,13,5,5.56,Attracted by your baby Store,https://www.aliexpress.com/item/4000599380488.html
Bath-Towel Blanket Poncho Hood Newborn-Baby Infant Velvet SPA Fleece 90--90cm,7.31,7.31,104,4.5,0,Bainily Official Store,https://www.aliexpress.com/item/4000706378153.html
Swimsuit Pregnant Tankinis Black Flouncing Plus-Size Summer Solid,6.6,12.14,12,5,0,TELOTUNY baby Store,https://www.aliexpress.com/item/33015676474.html
Patpat Matching Swimsuits Swimwear Family-Look Summer New Navy Geometric-Pattern In-Stock,9.19,11.99,5,0,0,PATPAT Official Store,https://www.aliexpress.com/item/4000834276079.html
Toddler Shoes Non-Slip Comfortable First-Walking Baby-Girl Winter Soft-Bottom Infant,8.98,8.98,174,4.8,0.94,mengyuyan Store,https://www.aliexpress.com/item/4000081845633.html
Children Pajamas Sleepwear Strawberry Baby-Boy-Girl Kids New Autumn Spring Long-Sleeves,8.99,11.69,108,4.8,0,Tingbang Baby Store,https://www.aliexpress.com/item/32907933739.html
Dress Daughter-Dresses Mom NASHAKAITE Mommy And Me Mini Summer Spaghetti-Strap Leaf-Print,3.98,7.98,21,4.8,0,NASHAKAITE DAD&MOMMY & ME Store,https://www.aliexpress.com/item/32998673326.html
Mesh Socks Crystal Elastic Baby-Girl Summer Lace Kids Silk 1/4pairs/lot Flowers Floral,1.57,1.57,61,4.7,2.34,VNAIL Dzieci Store,https://www.aliexpress.com/item/4000581600766.html
Stroller Blanket Envelope Swaddle-Wrap Sleepsack Button-Wool Knitted Warm Infant Newborn,11.66,11.66,71,5,0,Elves Baby Store,https://www.aliexpress.com/item/4000166055376.html
Pacifier-Clips Beads Nipples Baby Name Silicone Personalized Teething with Safe ABS,3.78,3.78,457,4.8,0.13,Mystical island Store,https://www.aliexpress.com/item/32916154336.html
Toddler Shoes Infant Baby-Girls Anti-Collision Non-Slip Breathable Summer Children Casual,9.37,10.69,85,5,0,WENWENDEXINGFU Official Store,https://www.aliexpress.com/item/4000883790111.html
Carrier Backpack Sling-Wrap Omni Egobaby Breathable Toddler Kid 360 Suspenders Multifunction,24.08,38.25,225,4.8,0,One World_One Dream,https://www.aliexpress.com/item/4000522768865.html
Nike 720 Parent-Child-Shoes Air-Cushion Sports-Sneakers Air-Max Original Comfortable,42.93,64.53,381,4.7,0,KidsNike Store,https://www.aliexpress.com/item/4000726183602.html
Swimsuit Matching Beachwear Mom Family Outfits Mommy And Daughter Feather-Wing Me New,6.78,11.51,168,4.5,1.56,Luoyimeng Store,https://www.aliexpress.com/item/32979396474.html
Underwears Children Pants Cartoon Briefs Girls Short Cotton Kids 36pcs/Lot Atnn0002 Designs,18.34,21.54,54,4.8,0,"Ningbo chen bei Trading Co., Ltd.",https://www.aliexpress.com/item/33005921123.html
Pajamas Home-Service-Suit Girls Minnie Cartoon Clothing Children's Sleeveless Summer,4.27,4.27,8,5,2.74,Leyi Children's Clothes Store,https://www.aliexpress.com/item/32983115219.html
Shoes Wedding-Dress Pink Purple Girls Elsa Blue Kids Children Flat for Bowtie,12.28,15.33,42,4.6,0,Shop5592323 Store,https://www.aliexpress.com/item/4000660106406.html
Pregnant-Swimsuit Beachwear Swimwear Women Plaid Maternidad Plus-Size One-Pieces Summer,4.15,9.13,6,0,0,Him & Her Store,https://www.aliexpress.com/item/4000476345068.html
Robe Bath-Towel-Set Hooded Luvable-Friends Baby Cartoon Square Animal-Charater Infant,4.42,4.64,466,4.6,0,In the warm spring Store,https://www.aliexpress.com/item/32853148883.html
Disney Swimming-Towel Stitch Beach-Towel Simba Baby Bath Lion Microfibre Winnie Children,9.55,9.56,38,4.8,0,Baby-BoyGirl Store,https://www.aliexpress.com/item/4000932599293.html
Boys Sandals Shoes Velcro Toddler Sport-Mesh Girls Summer Comfortable Baby Beach Brand,10.37,13.42,133,4.9,0,HJSUNFORYOU Store,https://www.aliexpress.com/item/4000790809423.html
Dress Outfit Overall Matching Toddler Newborn Baby-Boy-Girl Pants Kids Stripe Romper,4.19,4.7,47,4.6,3.53,"HEY, BABY Store",https://www.aliexpress.com/item/4000290534321.html
Jackets Clothing Parkas-Coats Teenage-Girls Winter Children Outerwear Fur 2 Fashion Hooded,7.45,15.71,27,4.9,3.03,Shop3657038 Store,https://www.aliexpress.com/item/4000028968307.html
Kids Socks Footwear Flower-Girls Animal Print Designer Long Boys Cartoon Children Funny,2.37,2.37,178,4.9,0.23,Dreamy Garden,https://www.aliexpress.com/item/4000474049447.html
Cartoon Pajamas Girls Infantil Kid Boys New Cotton for Children's Suit,6.71,7.62,1,0,0,Sunny baby's store,https://www.aliexpress.com/item/4000740319000.html
Suction-Bowl Dishes Tableware Children Plate Feeding Training Baby Kids Cartoon Lid Binaurall,1.97,4.91,67,5,0,Sunny Baby Store,https://www.aliexpress.com/item/32871247600.html
5 Pairs Kids Pure White Sock Baby Boy Girl Solid Breathable Cotton Sport Spring,2.53,5.96,171,4.8,0,How do you do Store,https://www.aliexpress.com/item/4000047836983.html
Kids Bowl Tableware Spoon-Set Dishes Baby-Plate Bpa-Free Children Silicone Cartoon,3.6,9.66,304,4.8,4.67,let's make Mother&Baby Store,https://www.aliexpress.com/item/4000463095332.html
Daughter Dresses Outfits Sister Me Family Matching Baby-Girl Kids Summer Mommy Child,10.83,12.81,1,0,0.85,Shop4428158 Store,https://www.aliexpress.com/item/4000822142103.html
Cup Drinking-Cup Toddler Baby Silicone Kids Infant 3PCS 210ML Tablewar Heat-Resistant,11.04,11.04,1,0,0,Hi JMs Store,https://www.aliexpress.com/item/4000938420146.html
Cartoon Hairpins Hair-Band-Accessories Baby-Girls Winter Headwear Flower Fabric Kids,1.9,1.9,20,5,0.2,Enjoy shopping ( offer drop shipping ),https://www.aliexpress.com/item/4000378270148.html
Headband Hair-Accessories Lace Embroidery Floral Kids Children Flat Knot for Lady Fashion,2.39,2.39,2,0,0,Inforest Baby Store,https://www.aliexpress.com/item/4001089390365.html
Dress-Shoes Pearl-Drill Rhinestone Newborn Toddler Baby-Girls Infant First-Walkers Soft-Sole,1.97,4.93,38,5,0,"Dongguan Babytree Garment Co.,Ltd Store",https://www.aliexpress.com/item/32983359101.html
Muslin Baby Blanket Quilt Swaddle-Wrap Bed-Cover Receiving Bamboo Kids Cotton Infant,7.89,11.29,209,4.8,1.83,LuckyBabyFans Store,https://www.aliexpress.com/item/4000587113233.html
Baby Blanket Envelope Swaddle-Wrap Stroller-Accessories Footmuff Infantsleeping-Bag Knitted,10.99,12.24,612,4.7,0,Children Dreamy World Store,https://www.aliexpress.com/item/32955801317.html
Baby Towel Bathrobe Blanket Hooded Comfortable Newborn Cotton Cute Animal Babies Beach,11.97,11.97,516,4.9,0,Tale Forest Store,https://www.aliexpress.com/item/32906395410.html
Family Matching Dress Romper Costume Outfits Mom Parent-Child Plaid Baby-Girls Kids Summer,3.13,4.51,660,4.6,3.69,Wisebaby Store,https://www.aliexpress.com/item/33054381754.html
Swaddle Blanket Bamboo Muslin 1PC Newborn 120cm--110cm,1.49,4.29,44,5,0.18,Momm's loveing Store,https://www.aliexpress.com/item/4000543130827.html
Disney Pajamas Sleepwear Nightgowns Mouse Simulation-Silk Home-Clothing Short-Sleeved,11.44,11.79,45,0,0,Shop5044280 Store,https://www.aliexpress.com/item/4000920305313.html
Pantyhose Stockings Kids Tights Children Clothes Knitted Baby-Girls Cartoon-Bear Cotton,4.91,4.91,18,5,0,Thirty Store,https://www.aliexpress.com/item/4000485791969.html
Blanket Muslin Swaddle Big-Diaper Bamboo Baby Print-Wrap Cotton 120x120cm,9.24,9.24,4,5,1.89,LuckyBabyFans Store,https://www.aliexpress.com/item/4001095695661.html
Baby Blankets Nursery-Stroller Minky Newborn Double-Layer Super-Soft Crib Fleece,14.31,14.31,23,4.8,0,Children Dreamy World Store,https://www.aliexpress.com/item/4000813635609.html
Family Matching Dress Baby-Girl Daughter Summer Fashion And Sleeveless Q004 Leaves,7.81,14.13,1,0,0,XingYing Store,https://www.aliexpress.com/item/33027329892.html
Kids Shoes Lace Toddler Girls Princess Infant for Bowknot Solid Brand,8.31,9.19,154,4.4,0,shoes shoes for you,https://www.aliexpress.com/item/32856614285.html
Water-Bottle Sippy-Cup Straw-300ml Baby with Training-Cup Infant Handle,4.92,4.92,11,0,0,Mummy Baby Store,https://www.aliexpress.com/item/4000955423404.html
Baby Shoes Toddler Summer Beach First-Walker Rubber-Bottom Anti-Slip Infant Breathable,5.78,8.61,17,5,0.8,AMOZAE Official Store,https://www.aliexpress.com/item/4000924063221.html
Pillowcase Bedding-Sets Bed-Cover Unicorn Linens Panda Baby Kids Cute Cartoon Gift,10.74,46.65,2,0,0,Baby-BoyGirl Store,https://www.aliexpress.com/item/4001089625603.html
Shoes Wedding-Dress Girls Kids Children Blue for Flat Bowtie,13.66,16.61,65,5,0,Shop5383239 Store,https://www.aliexpress.com/item/4000533811649.html
Blanket Wool Swaddles-Wrap Bedding Newborn Baby Warm Birth Gift Soft with 15cm Triple-Color,37.39,37.39,2,0,0,Shop5196073 Store,https://www.aliexpress.com/item/4000551853458.html
Receiving Blanket Bed-Spread Pet-Cushion Baby Swaddle Furry Pink Plaid Kids Super-Soft,4.99,14.99,67,4.6,0,MINMAX BABY BLANKET Store,https://www.aliexpress.com/item/4000588784936.html
Elfdiaper Nappy Cloth Swimming-Pant Pocket-Stay Newborn Reusable Dry New-Arrival,4.29,11.99,107,5,2.08,ElfDiaperRetail Store,https://www.aliexpress.com/item/32843248955.html
Coats Jacket Baby-Girl Winter Children Outerwear Warm Windproof for 2-6-Years Fur-Collar,8.64,15.68,78,4.5,0,Shop3657038 Store,https://www.aliexpress.com/item/33063107700.html
Leg-Warmer Stockings Baby Kids Cotton Unisex Cute Anti-Slip Knee Long 0-3T Stuff-Accessories,0.54,0.61,16,4.5,0.72,pudcoco Official Store,https://www.aliexpress.com/item/4000236333568.html
Baby Socks Rubber Animal Anti-Slip Newborn 0-6-12month Toddlers Kids Cartoon Floor Cute,1.29,1.39,1349,4.8,0,ZFMP socks Store,https://www.aliexpress.com/item/1000006529084.html
Girls Underwear Panties Briefs Baby Kids Short Cotton Children 6pcs/Lot Colorful,3.8,3.8,19,5,0,"Ningbo chen bei Trading Co., Ltd.",https://www.aliexpress.com/item/32445941297.html
Kids Panties Underwear Boxer-Shorts Doraemon Baby-Boys Cartoon Children Cotton Soft,14.95,14.95,78,4.8,0,Feite baby clothes Store,https://www.aliexpress.com/item/32956331556.html
Pacifier Chain Nipple-Holder Beads Dummy-Clip Hand-Made Kids New for Baby Colourful,1.1,1.1,25,5,0,Unique Baby Store,https://www.aliexpress.com/item/32707337514.html
Baby Swaddle Blanket Bedding Sleeping-Bag Infants Newborn Cotton Cute Babies Cap,2.06,5.08,61,4.9,1.63,Babywell Store,https://www.aliexpress.com/item/4000124659489.html
Edge-Guard-Strip Protection-Bumper Anti-Collision-Strip Desk-Table L-Shaped Soft Baby Safety,1.75,1.75,885,4.9,0,All Seasons Store,https://www.aliexpress.com/item/4000439559770.html
Beach-Sunglasses Toddler Baby-Girls Child Summer Kids New Wear Gift Outdoor UV400,1.79,1.79,152,5,0.44,FOCUSNORM Official Store,https://www.aliexpress.com/item/4000439602882.html
Headwears Head-Accessories Kiwi Stretch-Hair-Band Papaya-Patterns Elastic Children Cute,0.6,0.72,23,0,0,Baby-Care Dropship Store,https://www.aliexpress.com/item/4001034265936.html
Cotton Swaddle Towel Blanket Newborn-Baby Infant 120x120cm for 200g,1.95,1.95,51,5,4.54,PINK SWAN Mother&Baby Store,https://www.aliexpress.com/item/32876950418.html
Cups Spiderman Straw Feeding-Bottles Kids Cartoon Children with 390ML Captain-America,1.99,12.26,28,4.8,0,Sail Fish Store,https://www.aliexpress.com/item/33018188912.html
Socks Toddler Girls Baby-Boy Sport 5pairs/Set Cartoon Cotton for Kids Autumn,3.79,4.36,173,4.6,0,Alisenna Store,https://www.aliexpress.com/item/32947269445.html
Children Pyjamas T-Shirt Clothes-Sets Long-Sleeve Baby-Girl Kids Cartoon New Boys Pants,6.35,7.92,1,0,0,MGoodbaby Store,https://www.aliexpress.com/item/4000195405119.html
Bonnet Hair-Accessories Baby Turban Bohemian-Style Toddler Girl Kids Summer Beanie New,2.14,2.14,78,4.7,0,Boutique Baby Decor Store,https://www.aliexpress.com/item/33056894568.html
Girls Pajamas Suits Short-Sleeve Bottom-Clothing Boys Sleepwear Character Kids Children,2.88,4.16,20,5,3.35,happygirl Store,https://www.aliexpress.com/item/32856825730.html
Baby Nipple Pacifiers-Feeder Safe-Supplies Fresh Fruit-Feeding Silicone Food Kids,0.55,1.37,59,5,0,Ranavoar Mother&Baby Specialty Store,https://www.aliexpress.com/item/4000544171204.html
Girls Socks Ruffles-Bow Toddlers Baby Lace Warm Kids Cotton Knee-High Autumn Solid Big,0.85,0.89,24,0,0.62,pudcoco Official Store,https://www.aliexpress.com/item/4001036261450.html
Family Matching Short-Sleeve Little-Helper Papa Boys Summer Son And 1pc Dad Tops,4.09,6.07,8,0,3.12,About Baby Store,https://www.aliexpress.com/item/4000929134125.html
Dollbling Baptism Shoes Outfit Headband-Set Bottom Diamond Fluff Delicate-Apricot Butterfly,5.99,23.99,13,5,0,Glisten Store,https://www.aliexpress.com/item/1000006165009.html
Stocking Baby-Accessories Baby-Girl Boys Knee-High Lace Non-Slip Mesh Infant Princess,0.8,0.83,83,5,0.53,pudcoco Official Store,https://www.aliexpress.com/item/33039631733.html
Matching Dress Daughter-Dresses Family Outfits Butterflies Baby-Girls Mommy And Mama,7.02,12.12,129,4.5,0.69,B MAMI Store,https://www.aliexpress.com/item/4000008681471.html
Children Panties Briefs Boxer Teenager Baby Cotton Kids Boys for Teenager/Underpants/2-12y,7.19,7.99,5,0,0,anna wang 's store,https://www.aliexpress.com/item/4001037286483.html
Kids Pajamas Clothing Boys Sleepwear Infantil Toddler Baby-Girl Children Cartoon Summer,3.03,6.39,198,4.7,0.8,GACOOS Store,https://www.aliexpress.com/item/33040897006.html
Toddler Shoes Headband-Set Flower Unicorn First-Walkers Soft-Sole Girls Anti-Slip Cute,1.83,3.85,1144,4.8,0.2,I LOVE DADDY & MUMMY Baby Store,https://www.aliexpress.com/item/4000263139424.html
Children Sandals Shoes Slippers Footwear Clogs Rubber Mules Girls Outdoor Breathable,8.43,11.08,48,5,1.87,Shop4991158 Store,https://www.aliexpress.com/item/4001021482763.html
Pajamas Sleepwear Girls Toddler Kids Boys Solid for Baby Pants Outfits Nio Algodon Algodon,4.12,7.95,9,0,0.37,Asexy Store,https://www.aliexpress.com/item/4000930944073.html
Boy Socks Angel-Wings Flower Mesh Calcetines Newborn-Baby Baby-Girl Lace Anti-Slip Cotton,1.03,1.57,17,5,4.16,Sonkpuel Store,https://www.aliexpress.com/item/4000025921529.html
Kettle Drinking-Cups 260ml-Feeding Toddler Baby Kids Dual-Handle Training Printed Infant,3.06,3.07,16,4.5,0.42,Babe Wonder Store,https://www.aliexpress.com/item/4000800933660.html
Baby Headband Hair-Accessories Turban Toddler Girl Kids Bow Cotton Knot Stretchy,1.65,1.65,217,4.7,3.28,Miracle2013 Baby Store,https://www.aliexpress.com/item/4000127846572.html
Girls Parka Jacket Clothing Outwear Casual Warm Fashion Hooded for 3-12yrs Coat New-Arrivals,25.93,27.45,2,5,0,Shop3241063 Store,https://www.aliexpress.com/item/4000207294272.html
Sport-Shoes Boys Sneakers Baby-Boys Kids Summer Enfant Breathable Casual for Children,12.58,17.34,13,5,0,HOTAIRkids Store,https://www.aliexpress.com/item/4000973574504.html
Bath-Towel Blanket Poncho Hood Newborn-Baby Infant Velvet SPA Fleece 90--90cm,7.31,7.31,104,4.5,0,Bainily Official Store,https://www.aliexpress.com/item/4000706378153.html
Infant Swaddle Bedding Baby-Stroller-Cover Sleeping-Diapers Muslin Fabric Newborn Girls,3.94,3.94,1,0,2.99,SONDR BABY Store,https://www.aliexpress.com/item/4001058833981.html
Girl Socks Mesh Baby Toddler Breathable Cotton Summer New-Fashion Boy Soft Spring 5-Pairs,3.25,3.25,194,4.8,0,MIAOYOUTONG Baby Store,https://www.aliexpress.com/item/32859338369.html
Kids Boys Underwear Panties Shorts Boxers Teenager Baby-Boy Cartoon Children's for Stripes,1.73,2.56,58,4.3,0,FeiHan Store,https://www.aliexpress.com/item/4000393475190.html
T-Shirt Ice-Cream Family-Look Popular Fashion Streetwear Kids Casual Floral Short Tops,3.53,4.19,2,0,0,Once Select Store,https://www.aliexpress.com/item/4001085024076.html
Toddler Shoes Infant Baby-Girls Anti-Collision Non-Slip Breathable Summer Children Casual,9.37,10.69,85,5,0,WENWENDEXINGFU Official Store,https://www.aliexpress.com/item/4000883790111.html
Trainers Shoes Flatform Girls Boys Genuine-Leather Fashion Children Little/big Brand,33.6,35.7,145,4.7,0,UP KIDZ Store,https://www.aliexpress.com/item/4000900549824.html
Shoes Kids Slippers Sandals Flip-Flops Slides Raccoon Plush-Fur Rainbow Real-Fox-Fur,5.62,6.11,6,0,6.32,GUCGG Store,https://www.aliexpress.com/item/4001078919563.html
Headband Flower-Headwear Shoot-Accessories Newborn-Baby Baby-Girl Infant Photography-Props,1.96,1.96,74,4.8,0.47,Lullaby Baby Photography Store,https://www.aliexpress.com/item/4000344331457.html
Suspenders Carrier-Sling Backpack Wrap Ecnomic Toddler Newborn Infant Baby Organic Cotton,14.95,14.95,2,0,0.21,FzcTech Store,https://www.aliexpress.com/item/32958933128.html
Pantyhose Stockings Kids Tights Children Clothes Knitted Baby-Girls Cartoon-Bear Cotton,4.91,4.91,18,5,0,Thirty Store,https://www.aliexpress.com/item/4000485791969.html
Short Socks Toddler Baby-Girls Kids Summer Knee Cotton Children New Solid Spring,1.72,1.72,475,4.8,0.23,WONBO Official Store,https://www.aliexpress.com/item/32870135259.html
Corner-Guards Table-Protection-Cover Furniture Silicone Children Anticollision-Edge 20pcs,1.66,2.14,670,4.8,0.11,Shop4963036 Store,https://www.aliexpress.com/item/4000164068642.html
Melissa Sandals Jelly-Shoes Princess Ultragirl Kids Summer Snow for Non-Slip Soft,9.36,10.92,33,5,0,MelissaOnline Store,https://www.aliexpress.com/item/4000826633039.html
Underwear Girls Panties Briefs Baby Cotton Cartoon Children 3-12T Bowknot Female 1piece,1.42,1.42,238,4.7,0.17,Shop5008198 Store,https://www.aliexpress.com/item/4000173358812.html
