Title,PriceMin,PriceMax,Sold,Rating,Shipping,Store,URL
Child Lock Wardrobe Closet Plastic Window Baby Toddler Care TXYB1,0.64,0.64,7,0,0,Baby Clothes 001 Store,https://www.aliexpress.com/item/4000868640669.html
Safety-Protector Table-Corner Transparent Baby Silicone Child New 4PCS WARMOM,1.07,1.07,78,5,0,Warmom Baby World Store,https://www.aliexpress.com/item/4000308508079.html
Lock-Protection Safety-Lock Locking-Doors Child of Plastic for Kids 10pcs/Lot,2.95,4.14,15671,4.5,0,LOVYNO Store,https://www.aliexpress.com/item/32949538785.html
Safety Kids Locks Wardrobe Drawer Cupboard Cabinet Security-Protection Baby Children,1.65,1.65,2522,4.9,0,All Seasons Store,https://www.aliexpress.com/item/4000396717799.html
Pacifier-Clip-Holder Chain Dummy Clip Nipples-Pacifier Baby Children for Anti-Drop-Rope-Nimbler,0.86,0.86,497,4.8,0,Habao Store,https://www.aliexpress.com/item/32928019875.html
Learning-Dishes Bowl Tableware Dinnerware-Set Suction-Cup Spoon Training-Bowl Temperature-Sensing,0.53,2.14,1827,4.8,0,Babywell Store,https://www.aliexpress.com/item/33021207838.html
Furniture-Protector Strip Guards-Cover Soft-Edge-Corners Baby Child for Toddler Infant,0.86,1.35,1642,4.9,0,All Seasons Store,https://www.aliexpress.com/item/4000434257752.html
Pacifier-Clip Nipples Feeding-Teat Food-Nibbler-Holder Silicone Soother Fruit Nimbler,0.99,1.61,1389,4.8,0,Habao Store,https://www.aliexpress.com/item/32879637909.html
Head-Wrap Decoration Hair-Accessories Turban Big Bow Toddler Newborn Rabbit Baby-Girls,0.18,0.66,281,4.6,0,Lymn Hellen Store,https://www.aliexpress.com/item/4000313228637.html
Rainbow Unicorn Slippers For Kids New Summer Boy Girl Beach Shoes Baby Toddler Soft Indoor Bathroom Slippers Flip Flops,3.54,10.75,50,5,0,Familys Baby's Store Store,https://www.aliexpress.com/item/4001068044861.html
Hair-Ring Rubber-Band Elastic Polka-Dot Rabbit Girl Children's Cute Bow of Ear 10pieces,0.66,0.66,228,0,0,baby store Store,https://www.aliexpress.com/item/4001018249368.html
Teething Pacifier Straw-Handle Feeding-Bottles Fresh Baby Nipple Milk Food-Fruit Nibbler,1.41,1.41,1697,4.9,0,Ranavoar Mother&Baby Specialty Store,https://www.aliexpress.com/item/4000406007001.html
Baby Shoes Bottom Comfortable Fashion Non-Slip Soft,1.85,2.05,865,4.7,0,Colourful Mommy Baby Store,https://www.aliexpress.com/item/33005503402.html
Newborn Headwear Hair-Accessories Tiara Floral Toddlers Infant Baby-Girl Children Bow,0.64,0.72,1576,4.9,0,Lytwtw's Infant Store,https://www.aliexpress.com/item/33045877673.html
Clips Nipple-Feeder Feeding-Supplies Pacifier-Fruits Baby Infant Silicone New,0.65,1.17,1436,4.8,0,GlowBaby Store,https://www.aliexpress.com/item/4000493840340.html
Nibbler Baby Pacifiers-Feeder Nipple-Teat Baby-Supplies Safe Fresh Food Kids 1pcs,0.27,1.6,4092,4.9,0,HolyLamb Store,https://www.aliexpress.com/item/32809195109.html
Chain Pacifier-Holder Nipples Baby Children New The,0.85,0.85,4089,4.8,0,Habao Store,https://www.aliexpress.com/item/32926112168.html
SUNVENO Ergonomic Baby Carrier Infant Baby Hipseat Waist Carrier Front Facing Ergonomic Kangaroo Sling for Baby Travel 0-36M,35.38,39.44,1881,4.9,0,Sunveno Official Store,https://www.aliexpress.com/item/32838399242.html
Baby Nipple Pacifiers-Feeder Fruit-Feeding Food Kids Safe-Supplies Fresh,1.06,1.86,8435,4.8,0,Smgslib Baby products Store,https://www.aliexpress.com/item/32968082995.html
Baby Socks Clothing Lace Big Bow Toddlers Girls Long Knee-High Kids Cotton Summer New,0.5,0.53,4717,4.9,0.56,pudcoco Official Store,https://www.aliexpress.com/item/4000246892469.html
Baby Socks Bells Cute Boots Floor Non-Slip Boys Soft Cotton Cartoon,1.29,1.39,9030,4.7,0,ZFMP socks Store,https://www.aliexpress.com/item/33059820345.html
Kids Socks Kniekousen Big Bow Cotton Lace Toddlers Baby Soft Girls Long Knee-High Meisje,1.02,1.68,5365,4.9,0,Zerone Store,https://www.aliexpress.com/item/33032720270.html
Baby Diapers Panties Underwear Nappy Cloth Training-Pants Changing Washable Cotton Children,0.38,1.3,1492,5,0,Hi my baby Store,https://www.aliexpress.com/item/4000931479091.html
3 Colors Temperature Sensing Spoon for Kids Boys Girls Silicone Spoon Feeding Baby Spoons,0.32,0.34,4292,4.9,0,For you Mother&Baby Store,https://www.aliexpress.com/item/4000152451477.html
Baby Headband Hair-Accessories Turban Flower Elastic Toddler Newborn Kids Lovely,0.48,0.92,5247,4.8,0.09,Enjoy shopping ( offer drop shipping ),https://www.aliexpress.com/item/32967259117.html
Soft Cotton Tights For Girls Spring/Summer Baby Girls Tights Cute Cartoon Pantyhose Children Knitted Kids Stockings for 3-12Yrs,0.97,1.96,1,0,1.77,YN Baby Kids Store,https://www.aliexpress.com/item/4001098529673.html
Baby Headband Ribbon Hair-Accessories Tiara Turban Newborn-Bows Toddler Girl Infant Kids,0.4,0.41,6156,4.8,0,Lytwtw's Infant Store,https://www.aliexpress.com/item/32846424273.html
Muslin Swaddles Baby Blankets Photography Accessories Bedding For Newborn Swaddle Towel,3.5,3.5,2337,4.9,0,Wutongshu Official Store,https://www.aliexpress.com/item/32909523091.html
Baby Shoes Sports-Sneakers Canvas Soft-Sole Anti-Slip Toddler Newborn Infant Baby-Boys-Girls,2.01,2.84,6961,4.7,0.11,BabyCute Store,https://www.aliexpress.com/item/32838855604.html
Lovyno Silicone Protector Table-Corner Baby Safety Child Anticollision-Edge--Guards 8/10pcs,1.47,1.96,7053,4.7,0,ECMLN Mother & Baby Store,https://www.aliexpress.com/item/32787648014.html
Headbands Turban Knotted Baby-Accessories Nylon Toddler Newborn Girl's Children for 21color,0.62,0.72,467,4.8,0,Funny Toy Dropship Store,https://www.aliexpress.com/item/4000986273028.html
Spoon-Bottle Dropper Feeder Utensils Feeding-Medicine Toddler Cutlery Children-Accessories,1.75,3.15,1481,4.7,0,Happbear baby Store,https://www.aliexpress.com/item/4000093564695.html
Baby Shoes Sandals Girls News Boys Summer High-Quality Fashion Soft 1-5-Years-Old Breathable,2.13,3.19,2693,4.8,1.28,gongrdf Store,https://www.aliexpress.com/item/4000304638951.html
3pcs/set Baby Headband Girls Hair Accessories Cotton Rabbit Ear Turban Bow Elastic Hairband Baby Princess Christmas Day Gifts,1.86,3.39,7897,4.8,0,Boutique Baby Decor Store,https://www.aliexpress.com/item/32899835204.html
Headband Turban Hair-Accessories Bow Baby Nylon Girl Kids 3pcs/Lot Cute for Newborn,1.19,1.36,3588,4.8,0.11,AliMing Proton's store,https://www.aliexpress.com/item/4000163458508.html
Stockings Knitted Toddler Baby-Girls Boys Kids Cotton Infant Anti-Slip Long Solid Knee,0.54,0.88,1899,4.7,0.71,pudcoco Official Store,https://www.aliexpress.com/item/4000522587754.html
Headband Hair-Accessories Bebe-Girl Baby-Boys Princess Soft-Head Elastic New Cute Bowknot,0.14,0.17,656,4.6,0.33,Yaya Baby sweat Store,https://www.aliexpress.com/item/4000435502907.html
Spoon Feeding-Tools Temperature-Sensing Food Candy-Color Baby Soft-Silicone Hot-Sale,0.78,0.78,6496,4.9,0.15,Mami Baby House Store,https://www.aliexpress.com/item/32973070076.html
Feeding-Cups Straws Water-Cup Baby Outdoor Creative Kids Portable Children's Cartoon,2.89,2.89,622,4.8,0,Hi my baby Store,https://www.aliexpress.com/item/4000844972637.html
Gyro-Bowl Umbrella Balance Feeding-Dishes Spill-Proof Novelty Rotary Practical-Design,3.44,3.44,9266,4.7,0,ECMLN Mother & Baby Store,https://www.aliexpress.com/item/32832143514.html
Baby Hats Turban Knot-Girl Toddler Newborn Soft Winter Baby-Girl-Boy Kids Children's,0.97,1.35,1581,4.8,0,For you Mother&Baby Store,https://www.aliexpress.com/item/4000156004361.html
Ergonomic Baby Carrier Infant Kid Baby Hipseat Sling Front Facing Kangaroo Baby Wrap Carrier for Baby Travel 0-36 Months,15.41,15.47,17,0,0,Hi my baby Store,https://www.aliexpress.com/item/4001091887602.html
Corner-Protector Furniture-Corners Baby Safety 2M,1.97,3.75,4665,4.8,0,LOVYNO Store,https://www.aliexpress.com/item/32857560905.html
Sneaker Newborn-Shoes Mocassins Canvas Soft-Sole Toddler Infant Girl Baby KIDS Hot Boy,2.22,2.46,386,4.5,0.35,UNIKEA CUTE Store,https://www.aliexpress.com/item/32772816227.html
Suihyung Unicorn Slippers Shoes Sandals Rainbow Toddler Girls Baby Boys Beach Kids Summer,4.28,8.44,2134,4.7,0,Unicron Baby Store,https://www.aliexpress.com/item/4000505880372.html
Pillow Cushion Sleep-Support Prevent-Flat-Head Newborn Infant Baby Cartoon Concave,2.87,2.87,2871,4.7,0,Goodsimfamily Store,https://www.aliexpress.com/item/32986561723.html
Spoon-Fork Tableware-Set Wheat-Straw Training-Bowl Dinner-Plate Baby Children Cartoon,1.47,3.11,1912,4.8,4.05,Rosikyoffical Store,https://www.aliexpress.com/item/32960510567.html
Turban Headband Hair-Accessories Big Bow Toddler Newborn Baby-Girls Brand-New Gifts Knot,0.38,0.44,4760,4.7,0.34,pudcoco Official Store,https://www.aliexpress.com/item/32966262742.html
Headband Newborn Baby-Accessories Nylon Elastic Baby-Girl Infant Cute Solid Bow Gifts-Props,0.56,0.62,2503,4.6,0.52,pudcoco Official Store,https://www.aliexpress.com/item/4000026473132.html
Baby Carrier Wrap 0-24M Ring Sling Baby Carrier Breathable Mesh Fabric Ideal for Summers Kangaroo Newborn Infant Child Sling,9.98,9.98,2,0,0,CUBY Store,https://www.aliexpress.com/item/4001135874598.html
Baby Headband Turban Bows Flower-Girls Toddler Newborn for Kids Hair-Accessories,0.92,1.53,4682,4.8,0.09,Be Better Life,https://www.aliexpress.com/item/32871187791.html
Baby Bowl Fork Tableware Dinnerware-Set Suction-Cup Spoon Learning-Dishes Temperature-Sensing,1.09,2.18,1400,4.7,0.11,Shop4963036 Store,https://www.aliexpress.com/item/32994513687.html
Spoon Tableware Learning Toddler Baby Girl Soft-Silicone Infant-Feeder Boy Kid Safety,0.3,1.07,599,4.6,0,Babywell Store,https://www.aliexpress.com/item/33005143681.html
Baby Socks Fox Animal-Print Girl Knee-High Cartoon Children New Boy Cat Long Leg-Warmers,0.69,1.23,225,4.9,0.11,Shop4963036 Store,https://www.aliexpress.com/item/4000329506324.html
Cabinet-Lock Door-Lock Drawer Security-Protector Plastic Safety Baby-Proof 10pcs,1.9,3.93,4404,4.9,0,K-iss Baby Store,https://www.aliexpress.com/item/4000411574224.html
Sport-Shoes Footwear Basket Running-Sneakers Tenis-Infantil Lightweight Girl Summer Children,9.4,11.25,2282,4.7,0,Shop5383239 Store,https://www.aliexpress.com/item/4000559433908.html
Corner-Protector Angle-Ball Table-Corner Anti-Collision Transparent Baby Child 4-Pc-Lot,0.99,1.22,448,4.8,0.16,Shop5284009 Store,https://www.aliexpress.com/item/4000308622227.html
Let'S Make 1set Silicone Baby Feeding Set Waterproof Spoon Non-Slip Feedings Silicone Bowl Tableware Baby Products Baby Plate,5.46,12.9,1630,4.8,0,let's make handmade Store,https://www.aliexpress.com/item/4000410940954.html
DIMI Kids Shoes Sneakers Soft-Bottom Girls Autumn Infant Boys Casual Breathable Non-Slip,9.48,11.1,3096,4.8,0,DIMI YanTe Store,https://www.aliexpress.com/item/33059447603.html
Colour Pacifier Container-Holder Storage-Case Solid-Box Travel Plastic Baby 1PCS,0.16,0.75,1344,4.9,0,LOLEDE Toy Store,https://www.aliexpress.com/item/4000430246401.html
Baby Socks Fox Animal-Print Girl Knee-High Cartoon Children New Boy Cat Long Leg-Warmers,0.69,1.23,225,4.9,0.11,Shop4963036 Store,https://www.aliexpress.com/item/4000329506324.html
Cabinet-Lock Door-Lock Drawer Security-Protector Plastic Safety Baby-Proof 10pcs,1.9,3.93,4404,4.9,0,K-iss Baby Store,https://www.aliexpress.com/item/4000411574224.html
Sport-Shoes Footwear Basket Running-Sneakers Tenis-Infantil Lightweight Girl Summer Children,9.4,11.25,2282,4.7,0,Shop5383239 Store,https://www.aliexpress.com/item/4000559433908.html
Ergonomic Baby Carrier Infant Kid Baby Hipseat Sling Front Facing Kangaroo Baby Wrap Carrier for Baby Travel 0-36 Months,15.41,15.47,17,0,0,Hi my baby Store,https://www.aliexpress.com/item/4001091887602.html
DIMI Kids Shoes Sneakers Soft-Bottom Girls Autumn Infant Boys Casual Breathable Non-Slip,9.48,11.1,3096,4.8,0,DIMI YanTe Store,https://www.aliexpress.com/item/33059447603.html
Colour Pacifier Container-Holder Storage-Case Solid-Box Travel Plastic Baby 1PCS,0.16,0.75,1344,4.9,0,LOLEDE Toy Store,https://www.aliexpress.com/item/4000430246401.html
Kids Pyjamas Unicorn Long-Sleeve Girls Cotton High-Quality New for 2-8years,4.9,7.29,728,4.8,0,Little Bitty Official Store,https://www.aliexpress.com/item/4000312769122.html
Pillows Fastening-Belt Playpens Car-Seat-Head-Support Sleep Positioner Adjustable Baby,1.62,1.62,2741,4.8,0.09,Enjoy shopping ( offer drop shipping ),https://www.aliexpress.com/item/32967966784.html
Ponytail-Holder Hair-Accessories Rubber-Bands Candy-Colors Girls Kids Children Nylon,0.89,1.61,1841,4.7,0,L&S Store,https://www.aliexpress.com/item/4000156077125.html
Headband Bow Turbans Accessoire Knot Rabbit Bebe Girl Baby Kids Cute for Faixa Cabelo,1.01,1.01,829,4.7,0,Shop5003008 Store,https://www.aliexpress.com/item/32995194581.html
Pacifier Baby Container-Holder Storage-Case Nipple-Kit Solid-Box Plastic 1PCS Travel,0.16,0.75,763,4.9,0,LOLEDE Toy Store,https://www.aliexpress.com/item/4000430310036.html
Universal Gyro Bowl Practical Design Children Rotary Balance Novelty Gyro Umbrella 360 Rotate Spill-Proof Solid Feeding Dishes,2.33,2.33,54,0,0,Hi my baby Store,https://www.aliexpress.com/item/4001027598490.html
Nylon Headband Turban Soft Baby-Girls Children for Bow Knot Hair-Accessories 21-Colors,0.64,0.84,1622,4.5,0,For you Mother&Baby Store,https://www.aliexpress.com/item/4000115449037.html
Toddler Headband Ribbon Elastic Girl Bow Boho Newborn Kids Knot Colorful,0.44,0.44,7636,4.7,0.45,pudcoco Official Store,https://www.aliexpress.com/item/32817400430.html
Safety-Care Toilet Plastic Lock Cupboard Cabinet Drawer-Door Baby-Protection Child,1.86,2.88,1818,4.7,0.11,Shop4963036 Store,https://www.aliexpress.com/item/4000164008943.html
Spoon Feeding-Tools Temperature-Sensing Food Candy-Color Baby Infant Soft-Silicone Hot-Sale,0.78,0.78,71,5,0,Hi my baby Store,https://www.aliexpress.com/item/4001053560469.html
Anti-Electric-Shock-Plugs-Protector-Cover Eu-Power-Socket Security-Guard-Protection Electrical-Outlet,1.42,1.42,205,4.8,0.91,HiHappy Toy Store,https://www.aliexpress.com/item/33047932670.html
Candy-Color Stockings Tights Pantyhose Velvet Ballet-Dance-Girl White Kids Spring/Autumn,0.92,1.97,1443,4.8,0,Kidmozo Store,https://www.aliexpress.com/item/32866323446.html
Fridge-Lock Drawer Cupboard Cabinet Safety-Locks-Protection Adhesive Door Pet-Proofing,0.39,0.39,30,0,0,Welcome to Mommy Baby Store,https://www.aliexpress.com/item/4001080403876.html
Cute Slippers Unicorn Slippers Boy Girls Shoes Rainbow Toddler Shoes Baby Slippers Cartoon Animal Beach Swimming Kids Slippers,3.86,7.56,579,4.7,0,I Lovee Walk Store,https://www.aliexpress.com/item/4000898337366.html
Pacifier Chain Rope Nipple-Holder Dummy-Clip Baby Children New 1PC for Anti-Drop,0.17,0.99,1399,4.8,0,"The Girl Next Door Trading Co., Ltd",https://www.aliexpress.com/item/32883084255.html
Dummy Clip Pacifier-Clips Nipple Silicone-Holder Kids Feeder Feeding Baby Fruit Food,0.5,1.4,327,5,0,Happbear baby Store,https://www.aliexpress.com/item/4000168846503.html
Pacifiers Safe Orthodontics Animals Printing Food-Grade Baby Cotton Silicone Cute Round,0.16,0.67,840,4.8,0,LOLEDE Toy Store,https://www.aliexpress.com/item/4000448558568.html
Family Tshirts Me Boys Mom Baby-Girl Mommy And MINI MAMA Fashion Cotton,3.25,4.59,1342,4.6,0,KAD Store,https://www.aliexpress.com/item/4000788531933.html
Hair-Clip Ribbon-Bow Headwear Baby Full-Cover-Clips Baby-Girls Kids 10pcs/Lot Bowknot,0.4,0.8,1027,4.7,0,Baby's life Store,https://www.aliexpress.com/item/4000152630651.html
Toddler Dummy Chain-Holder Strap Pacifier Nipple-Clip Spring Baby Infant New for Chew-Toy,0.38,0.49,2072,4.9,0.11,SIRENXI GIRL Store,https://www.aliexpress.com/item/33007739532.html
Hair-Accessories Rubber-Bands Scrunchie Elastic Kids Gum for 50pcs/Lot Decorations-Ties,0.93,0.93,381,4.8,0,Ms. Yang Dropshipping Store,https://www.aliexpress.com/item/4000180587016.html
Let'S Make 1set Silicone Baby Feeding Set Waterproof Spoon Non-Slip Feedings Silicone Bowl Tableware Baby Products Baby Plate,5.46,12.9,1630,4.8,0,let's make handmade Store,https://www.aliexpress.com/item/4000410940954.html
Toilet Door-Stopper Drawer Safety-Lock Cabinet Plastic Security 10pcs/Lot Castle Infant,1.75,3.52,241,4.6,0,fanta2019 Store,https://www.aliexpress.com/item/4000615190467.html
Baby Socks Newborn Toddler Infant Girls Stripe Boys Kids Cotton Fashion Lovely 0--6-Months,0.8,0.93,578,4.9,1.15,Store 007,https://www.aliexpress.com/item/32947777623.html
Pretty Girl Panties Child Underwear Kids Boxer Breathable Cotton 4pieces/Lot Cartoon,3.34,4.04,3808,4.8,0,WURUOTIM Store,https://www.aliexpress.com/item/32953384937.html
Corner-Guards Table-Protection-Cover Furniture Silicone Children Anticollision-Edge 20pcs,1.66,2.14,670,4.8,0.11,Shop4963036 Store,https://www.aliexpress.com/item/4000164068642.html
Kids Socks Lace Frilly Pink Ruffle Baby Girls Designer Cotton Summer Fashion Toddle White,0.97,1.13,252,5,0.4,VNAIL Dzieci Store,https://www.aliexpress.com/item/4000732756612.html
Sneakers Shoes Prewalker Soft-Sole Toddler Girl Baby Sports Fashion 0-18M Hook Loop Non-Slip,4.59,4.79,131,4.7,0,strawberry baby Store,https://www.aliexpress.com/item/4000691634854.html
Cartoon Pacifier Baby Infant Sleeping-Soothers Food-Grade All Round Head-Type,0.78,0.78,6,0,0,Habao Store,https://www.aliexpress.com/item/4000293063652.html
Baby Carrier Sling for Newborns Sling Ring Ergo Backpack Wrap Baby Kangaroo Manduca Infant Breathable Baby Holder,12.33,18.08,103,5,0,CUBY Store,https://www.aliexpress.com/item/32665618295.html
Blanket Muslin Swaddle Baby Cotton 120 120cm--110cm,4.49,4.49,601,4.8,1.22,LuckyBabyFans Store,https://www.aliexpress.com/item/4000670897172.html
Shoes Newborn Sneakers Prewalker Anti-Slip Soft-Sole Baby-Girl Boys Causal Summer Bow,1.83,2.07,1933,4.7,1.16,pudcoco Official Store,https://www.aliexpress.com/item/33041519545.html
Boys Sneaker Shoes Spiderman Spring Toddler Girls Autumn Kids with Children,6.84,10.61,2189,4.5,0,Shop5132076 Store,https://www.aliexpress.com/item/4000087901034.html
Swaddles-Wrap Towel Bibs Diaper Blankets Newborn Scraf Bamboo Muslin Baby 30%Cotton-Muslin,2.84,2.84,535,4.8,0.39,LuckyBabyFans Store,https://www.aliexpress.com/item/4000748514801.html
Hair-Bands Bow-Headband Flower-Turban Ball Gift-Sets Bowknot Nylon Newborn Girls Baby,3.14,3.14,1575,4.7,0,"Nishine E-Commerce Co., Ltd. Store",https://www.aliexpress.com/item/32963368288.html
Baby Headband Hair-Accessories Bows Elastic-Candy Newborn Kids Bowknot Solid 12-Colors,0.48,1.2,663,4.6,0,For you Mother&Baby Store,https://www.aliexpress.com/item/4000238389281.html
Newborn Blankets Stroller-Cover Sleepsack Play-Mat Bath-Gauze Infant-Wrap Baby Swaddles,3.47,3.69,4218,4.8,2.73,Bainily Official Store,https://www.aliexpress.com/item/32969207997.html
HH Children winter jacket for kids girl silver gold Boys Casual Hooded Coat Baby Clothing Outwear kids Parka Jacket snowsuit,18.32,20.81,27,4.8,0,HH Official Store,https://www.aliexpress.com/item/32899793633.html
Shoes Newborn Sneakers Anti-Slip Soft-Sole Canvas Baby Toddler Infant Baby-Boys-Girls,1.66,2.7,8590,4.8,0.11,AMOZAE Official Store,https://www.aliexpress.com/item/33053691303.html
Girls Shoes Sandals Canvas Bowknot Toddlers Newborn Baby Kids Boys Children Non-Slip,1.49,1.64,3213,4.8,0.68,Stepan Store,https://www.aliexpress.com/item/32977971601.html
Disney Water-Cups Mouse Drinking-Water-Bottle Straw-Boys Mickey Girls Minnie Princess,4.53,4.74,1215,4.8,0,My China Store,https://www.aliexpress.com/item/4000078490848.html
Socks Baby Girls Breathable Sport Kids Cute Children Knee Cotton,1.27,1.27,193,5,0,Children Of Fun Store,https://www.aliexpress.com/item/4000752406864.html
Pyjamas Children Airplane Unicornio Boys Sleepwear Infantil Baby-Girls Full-Sleeve 100-Cotton,4.86,6.37,813,4.7,0,Little Bitty Official Store,https://www.aliexpress.com/item/32802979319.html
Leg-Warmer Socks Tights Ribbon-Bow Stretch Toddlers Girls Baby Infants Boys Kids Knee-High,1.39,1.39,928,4.7,0,Happbear baby Store,https://www.aliexpress.com/item/4000281723502.html
Baby Socks Clothes-Accessories Mesh Toddler Infant Newborn Boy Girls Cotton Cute,3.24,3.24,10904,4.7,0,JhonTang child Store,https://www.aliexpress.com/item/4000055913131.html
Magnetic Child Lock 4-12 locks+1-3key Baby Safety Baby Protections Cabinet Door Lock Kids Drawer Locker Security Invisible Locks,4.98,13.99,438,4.9,2.55,BUUS Store,https://www.aliexpress.com/item/4000040234652.html
Chain Pacifier-Clip Dummy-Clip Nipples-Chupetas Baby Kids for Para,0.75,0.75,404,4.9,0,CandyHouse Store,https://www.aliexpress.com/item/32894209619.html
Chain Pacifier-Clip Leash-Strap Nipple-Holder Baby for Infant,1.02,1.02,492,4.9,0,Shop4666111 Store,https://www.aliexpress.com/item/33015939124.html
Baby Headband Hair-Accessories Flower-Girls Children Dropship Cute 14-Colors,0.41,0.45,208,5,0,For you Mother&Baby Store,https://www.aliexpress.com/item/4000170560001.html
Toilet Locks-Straps Cupboard Safety-Locks Cabinet Drawer-Door Baby-Protection Plastic,2.46,4.14,4301,4.6,0,ECMLN Mother & Baby Store,https://www.aliexpress.com/item/32950887478.html
Baby Blankets Scarf Towel Wrap-Feeding Muslin Swaddle Burp-Cloth Newborn Soft Organic Cotton,2.9,2.9,401,5,0,lucky kids,https://www.aliexpress.com/item/4000545531024.html
Newborn-Baby Headband Headwears-Decoration Flower Stretch-Head Mesh Elastic Girl Lace,0.22,0.53,64,4,0,Baby-Care Dropship Store,https://www.aliexpress.com/item/4001034164260.html
Girl Tights Stockings Baby Pantyhose Sheer Kids Summer Children's Cute Cat Cartoon,1.36,1.36,2469,4.8,0.11,Sweety beard Store,https://www.aliexpress.com/item/4000403031180.html
Baby Carrier Wrap 0-24M Ring Sling Baby Carrier Breathable Mesh Fabric Ideal for Summers Kangaroo Newborn Infant Child Sling,9.98,9.98,2,0,0,CUBY Store,https://www.aliexpress.com/item/4001135874598.html
LOFCA Plastic Pacifier Clips Toy Clamp Multi-Color Baby Infant 10pcs Solid,1.99,1.99,1579,4.9,0,lofcababy Store,https://www.aliexpress.com/item/32960853599.html
Flower Headband Ribbon Girl Bow Chiffon Elastic Toddler Newborn-Baby Kids for Knot-Styling,0.37,0.95,43,0,0,Baby-Care Dropship Store,https://www.aliexpress.com/item/4001035703660.html
Toddler Shoes Sneakers Unicorn Soft-Bottom Anti-Slip Baby-Boy-Girl Children New Cute,2.09,2.53,3208,4.9,0.2,I LOVE DADDY & MUMMY Baby Store,https://www.aliexpress.com/item/4000329006454.html
Magnetic Child Lock 4-12 locks+1-3key Baby Safety Baby Protections Cabinet Door Lock Kids Drawer Locker Security Invisible Locks,4.98,13.99,438,4.9,2.55,BUUS Store,https://www.aliexpress.com/item/4000040234652.html
Drink-Cups Straw-Copo Water-Bottles Feeding Sippy Newborn-Baby Toddler Kids with Infantil,4.91,4.91,3069,4.9,0,Mummy Baby Store,https://www.aliexpress.com/item/33041071824.html
Hollow-Out-Sock Sox In-Tube Royal-Style Candy-Colors Socks.kid's Girl's Toddler High-Socks.baby,1.78,1.78,630,4.9,0,UNIKIWI _Baby_ Store,https://www.aliexpress.com/item/4000567317825.html
Kids Underwear Panties Shorts Children's Briefs Baby-Girl Cartoon-Designs Cotton New-Arrive,3.99,4.99,3276,4.9,0,Seamos Store,https://www.aliexpress.com/item/32956040271.html
Spoon Utensils Feeding-Tools Temperature-Sensing-Spoon Baby Soft-Silicone Children Food,0.58,0.58,28,0,0,Shop5798799 Store,https://www.aliexpress.com/item/4001015780289.html
Long-Socks Soccer Football Sports-Clothing Active Over-Knee Baby-Girls Striped Kids Hockey-J,1.11,1.32,146,5,0,Felkg good Luck Store,https://www.aliexpress.com/item/33015686202.html
Head-Wrap-Accessories Headbands Turban Flower-Print Big-Bow Nylon Bunny Baby-Girl,2.04,2.04,1860,4.8,0,YiShan baby Accessories Store,https://www.aliexpress.com/item/4000117761201.html
Outfits Matching-Clothes T-Shirt Mom Family-Look Daughter Mommy And Baby-Girl Boys Son,2.85,4.23,2108,4.8,0.98,Gourd doll Official Store,https://www.aliexpress.com/item/4000422865907.html
Christmas Pajamas Baby Autumn Winter Long Sleeve Silk Sleepwear Set Solid Color Comfort Girl Boy Nightwear Clothing,6.32,9.48,52,4.8,0,jxmyyc baby Store,https://www.aliexpress.com/item/4000072919659.html
Edge-Guard-Strip Protection-Bumper Anti-Collision-Strip Desk-Table L-Shaped Soft Baby Safety,1.75,1.75,885,4.9,0,All Seasons Store,https://www.aliexpress.com/item/4000439559770.html
Headband Accessories Baby-Boy-Girl Kids Cute Bowknot Solid Seamless Super-Soft,0.37,0.8,18,0,0,JeanDan Store-ufza Store,https://www.aliexpress.com/item/4000990907549.html
Floral-Bows Headbands Hair-Accessories Girls Kids Bowknot Dot Cotton 3pcs/Set,2.32,3.2,4375,4.8,0.2,Simple Happy Life,https://www.aliexpress.com/item/32888309092.html
Baby Moccasins Shoes Footwear Bow-Fringe Soft-Soled Baby-Boy-Girl Non-Slip PU,2.63,3.02,3362,4.8,0.11,BabyCute Store,https://www.aliexpress.com/item/32838740299.html
Temperature-Sensing-Spoon Baby Spoons Feeding Toddler Kids Boys for Girls Silicone Flatware,0.15,0.79,99,4.6,0,SaiCi,https://www.aliexpress.com/item/4000586557025.html
Girls Pajamas Sleepwear Shorts T-Shirt Baby Boys Summer 2-7T,5.84,7.44,1177,4.8,0.66,HEYFRIEND Official Store,https://www.aliexpress.com/item/4000913190708.html
Knot Bow Baby Headbands Toddler Headwraps 6m-18m Baby Turban Hats Babes Caps,2.98,3.26,2933,4.7,1.13,yuxic Store,https://www.aliexpress.com/item/32977339208.html
Beineng Newborn Baby Bottle PPSU Anti-Flatulence Drop-Resistant Wide Aperture Silicone Pacifier Strap Straw Handle,10.15,10.15,13,5,0,BN Official Store,https://www.aliexpress.com/item/4001118997694.html
Clip-Head-Ornaments Hairpin-Set Hair-Accessories Rainbow Lollipop Cute Little-Girl Children,0.86,0.92,45,0,0,baby store Store,https://www.aliexpress.com/item/4001018829036.html
Short Socks Angel-Wing Toddler Baby-Girls Kids Cotton Summer Children Knee Solid Autumn,1.67,1.67,2809,4.9,0,Children's lives Store,https://www.aliexpress.com/item/4000086673265.html
Sunglasses Leopard Toddler Girl Fashion Beach-Eyewear Boy Solid 6-Colors Kid,0.82,0.82,750,4.9,0.56,FOCUSNORM Official Store,https://www.aliexpress.com/item/4000791308096.html
