Title,PriceMin,PriceMax,Sold,Rating,Shipping,Store,URL
Funny Socks Ankle Happy Smiley-Face Embroidered Baby-Boys-Girls Cotton Fashion Kawaii,1.03,1.26,32,5,0.03,Her Baby Store,https://www.aliexpress.com/item/4000809043198.html
Chain-Holders Pacifier-Clips Feeding-Accessories Newborn-Baby Cartoon Nipple-Safe Pp-Strap,0.17,0.17,105,5,0.36,BabyCaring Store Store,https://www.aliexpress.com/item/4000505650925.html
Shoe Toddler Newborn Infant Baby Boys Wholesale Summer Soft-Sole Girl Kids 0-18M Bow,1.97,2.33,121,4.7,0.78,pudcoco Official Store,https://www.aliexpress.com/item/32855911060.html
New Baby Girl Hair Band Big Bow Headband Turban Knot Hair Accessory Head Wrap,1.16,1.16,171,4.7,0.28,Babywow Store,https://www.aliexpress.com/item/4000039924337.html
Bowknot Hair-Band Hair-Accessories Elastic Newborn Infant Baby Kids Nylon Solid 5pcs/Lot,1.69,1.69,148,4.8,0,"Nishine E-Commerce Co., Ltd. Store",https://www.aliexpress.com/item/32966279577.html
Family Look Baby Romper Striped Sleeveless Summer Mother Daughter Dress Family Matching Outfits Adult Kids Clothes,6.99,12.98,4,0,0,Shop5069294 Store,https://www.aliexpress.com/item/4001128087982.html
Hair-Clips Barrettes Baby-Girls Kids Kawaii 50pcs Fashion 3cm for Snap Candy-Color,2.35,2.35,25,5,0,Selfless Mother Store,https://www.aliexpress.com/item/4000935629156.html
Baby Blankets Swaddling Bedding-Towel Wrap-Sleeping-Bag Newborn Bebe Infant 100%Cotton,4.24,4.24,42,5,0,Matey Toy Store,https://www.aliexpress.com/item/4000586230903.html
Toddler Shoes Flower Baby-Boy Fashion Cotton Hollow 1pair Stitching Casual,0.55,2.55,3,0,0,"The Girl Next Door Trading Co., Ltd",https://www.aliexpress.com/item/4001085469081.html
Toddler Girls Sneakers Kids Shoes Boys Fashion Breathable Casual New Mesh Unisex Spring/autumn,12.37,14.46,2258,4.8,0,DIMI YanYan Store,https://www.aliexpress.com/item/33024777468.html
Pillows Cushion Head-Protector Safety-Pad Unicorn Back Security Toddler Baby Prevent,3.14,3.14,713,4.7,4.35,Fashion baby GD,https://www.aliexpress.com/item/4000199978834.html
Baby Nipple Pacifiers-Feeder Safe-Supplies Fresh Fruit-Feeding Silicone Food Kids,0.55,1.37,59,5,0,Ranavoar Mother&Baby Specialty Store,https://www.aliexpress.com/item/4000544171204.html
Disney Shoes Socks Mermaid Princess Cartoon Children's Non-Slip Snow-White Cotton New,1.45,1.45,52,5,1.46,Disney Sweethearts Store,https://www.aliexpress.com/item/4000318209817.html
Girls Winter Jacket Kids Parka 2018 New Hooded Thicken Warm Children Winter Jacket Girls Coat Little Girls Winter Jacket,10.87,24.9,79,4.6,1.66,Bao Ma Store,https://www.aliexpress.com/item/4000142996507.html
Outfit T-Shirt Sibling Matching Big-Sister Newborn Baby Jumpsuit Girls Boys Kids,3.53,4.98,64,4.5,0,jiangkao H Store,https://www.aliexpress.com/item/4000163377241.html
Baby Blankets Scarf Bibs Muslin Swaddle Burpy-Towel Wrap-Feeding Big-Diaper Newborn Organic Cotton,2.92,2.92,21,0,0,lucky kids,https://www.aliexpress.com/item/4001063292709.html
Bowl Baby Dishes Silica-Gel Waterproof Tableware Shatter-Resistant,1.87,1.87,11,0,2.43,BOOSMAI Official Store,https://www.aliexpress.com/item/4000960351399.html
Socks Clothes-Accessories Terry Newborn-Baby Infant Winter Warm Solid for Thick Girls,0.8,0.8,122,4.8,0.76,LAWADKA Official Store,https://www.aliexpress.com/item/4000241727124.html
Trainning Water-Have-Cup-Lid Learn-To-Drink-A-Cup Infant Double-Handle Leakproof-Cup,0.89,3.2,89,4.7,0.08,Shop5020189 Store,https://www.aliexpress.com/item/33032455016.html
Baby Socks Newborn Cotton Unisex Cute Autumn Fashion Spring 1-Pair Fresh Candy-Color,0.68,0.68,841,4.8,0,Lytwtw's Infant Store,https://www.aliexpress.com/item/32957925778.html
Strip Protector-Tape Corner-Cover Desk Angle-Guards Safety-Table Baby Security Children,1.81,3.06,41,5,0,fanta2019 Store,https://www.aliexpress.com/item/4000772806326.html
Lemon Comeon Silicone Beaded Pacifier Clip Baby Dummy Chain Nipple For Toddler Animal Teething Beads Colorful Soother Chew Toy,2.94,2.94,6,0,0,Happy Family Mile Store,https://www.aliexpress.com/item/4001120652906.html
2-9Y Clothes-Accessories Mesh Kid Socks Newborn Toddler Baby Girls Cotton Summer 5pairs/Lot,2.75,3.44,55,5,4.21,Missangel Store,https://www.aliexpress.com/item/4000112320209.html
Baby Shoes Embroidery Toddler Summer First-Walkers Girl Infant Crib Kid 0-18M Flower,2.66,2.84,19,0,0,tian tian baby Store,https://www.aliexpress.com/item/4000672077914.html
Pudcoco Shoes Baby Girl Boy Infant Kid Unisex Lace-Up Soft-Sole 0-18-M Casual New-Fashion,3.19,3.59,69,5,0,Yaya baby Store,https://www.aliexpress.com/item/4000184288469.html
Dummy Pacifier Teat Nipple Letters Name Orthodontic Newborn Silicone Kids Initial,3.69,3.69,172,5,0,Hang Hang Baby Store,https://www.aliexpress.com/item/4000861438779.html
Hair-Band-Accessories Headwear Bow-Flower Infant Girl Wholesale/ratil Kid 7pcs/Set,0.8,0.8,274,4.8,0.72,pudcoco Official Store,https://www.aliexpress.com/item/32805197025.html
Mesh Socks Baby-Girl Infantil Kids Cotton Summer Children Thin Meia Sokken Breathable,2.73,2.73,293,4.7,0.2,Be Better Life,https://www.aliexpress.com/item/4000012037173.html
Bands Ponytail-Holder Hair-Accessories Hair-Tpu Elastics Girls Baby Child Gum for Disposable,0.11,1.39,108,4.6,0,SaiCi,https://www.aliexpress.com/item/4000274925093.html
Outdoor supplies XPE foam four-fold folding cushion waterproof waterproof cool portable moisture-proof picnic mat,6.52,6.52,0,0,3.48,SENLAI Store,https://www.aliexpress.com/item/4001054593811.html
Warm-Leggings Stocking Gifts Toddler Baby-Girl Kids Cotton Lace Knee Solid Bowknot Ruffled,0.89,0.98,41,4.9,0.76,pudcoco Official Store,https://www.aliexpress.com/item/32968903602.html
Headbands Hair-Accessories Tiara Flower Orange Infant Baby-Girl Dot Gift Bowknot 1pcs,0.62,1.01,53,5,0,Lytwtw's Infant Store,https://www.aliexpress.com/item/4000786531052.html
Headbands Accessories Turban Bow Girl Toddler Infant Cute Solid,0.78,0.78,90,4.8,0,Zzp-Baby Toy Store,https://www.aliexpress.com/item/32985895088.html
Short Socks Batman Captain-America Superman Girls Kids Boys Cartoon Children New-Fashion,1.46,1.9,17,4,0,FeiHan Store,https://www.aliexpress.com/item/4000773457779.html
Dinnerware Spoon Fork-Feeding Baby-Bowl Eating Kids Dishes Training Cartoon-Bear Anti-Hot,1.52,3.03,1132,4.8,0.25,Shop3221069 Store,https://www.aliexpress.com/item/32919530682.html
Socks Children Baby-Girls Boys Kids Cotton Cartoon Fashion 5-Pairs Rabbit Spring Autumn,2.72,2.72,110,4.8,0.63,Shop2966100 Store,https://www.aliexpress.com/item/4000771450346.html
Kids Panties Clothing Boys Briefs Child Underwear Baby Lovely Cartoon 3pcs/Lot New,3.59,3.59,842,4.7,0.74,Shop4410027 Store,https://www.aliexpress.com/item/4000327244400.html
Electric Breast Pump Charged Easy Convenient Charged Easy Carry Outdoors Milk Pump Postpartum Supplies,34.3,51.94,148,4.9,0,SLAIXIU Official Store,https://www.aliexpress.com/item/4000158479208.html
0-To-6-Yrs Baby Sock Rubber-Grips Anti-Slip Girls Children's Cotton Boys Boat for Kid,7.92,10.72,74,4.9,0.56,TUKATO Store,https://www.aliexpress.com/item/4000774344929.html
Bowl-Plates Dishes Silica-Gel Baby Feeding Integrated Kids Children's,2.42,4.04,1004,4.7,4.15,Rosikyoffical Store,https://www.aliexpress.com/item/33026724376.html
Soft-Socks Mesh Newborn Baby-Boys-Girls Breathable Kids Knee Cotton Cute Infant 0-4years,1.19,1.19,20,0,0.11,Shop4963036 Store,https://www.aliexpress.com/item/4000131364065.html
Mom Hairband Hair-Accessories Floral-Print Rabbit Daughter Parent-Child 2pcs/Set Ears,1.46,2.25,22,0,0,Boutique Baby Decor Store,https://www.aliexpress.com/item/4001045886891.html
Family Matching Outfit Romper Short-Sleeve T-Shirt Daddy Baby Kids ME MINI And 1pcs Funny,3.53,4.98,200,4.7,0,jiangkao H Store,https://www.aliexpress.com/item/4000278480448.html
Kids Shoes Sandals Beach-Slippers Animal Prints Resistance Antislip Girl Baby Fashion,4.55,4.55,49,0,3.15,BUUS Store,https://www.aliexpress.com/item/4001015036716.html
Socks Clothing Toddler Baby-Girls Cartoon Cotton Cute Unisex Fox Leg-Warmer Character,0.98,1.19,2012,4.7,0.11,Sweety beard Store,https://www.aliexpress.com/item/32963310532.html
4 Giveaways Jusanbaby High View Lightweight 3 In 1 Baby Stroller Foldable Dolly Buggy Baby Accessories Good Quality 2020 New,169.46,169.46,2,0,0,jusanbaby Official Store,https://www.aliexpress.com/item/4001070038729.html
Baby Socks Newborn Cotton Unisex Cute Autumn Fashion Spring 1-Pair Fresh Candy-Color,0.68,0.68,841,4.8,0,Lytwtw's Infant Store,https://www.aliexpress.com/item/32957925778.html
Strip Protector-Tape Corner-Cover Desk Angle-Guards Safety-Table Baby Security Children,1.81,3.06,41,5,0,fanta2019 Store,https://www.aliexpress.com/item/4000772806326.html
2-9Y Clothes-Accessories Mesh Kid Socks Newborn Toddler Baby Girls Cotton Summer 5pairs/Lot,2.75,3.44,55,5,4.21,Missangel Store,https://www.aliexpress.com/item/4000112320209.html
4 Giveaways Jusanbaby High View Lightweight 3 In 1 Baby Stroller Foldable Dolly Buggy Baby Accessories Good Quality 2020 New,169.46,169.46,2,0,0,jusanbaby Official Store,https://www.aliexpress.com/item/4001070038729.html
Baby Shoes Embroidery Toddler Summer First-Walkers Girl Infant Crib Kid 0-18M Flower,2.66,2.84,19,0,0,tian tian baby Store,https://www.aliexpress.com/item/4000672077914.html
Pudcoco Shoes Baby Girl Boy Infant Kid Unisex Lace-Up Soft-Sole 0-18-M Casual New-Fashion,3.19,3.59,69,5,0,Yaya baby Store,https://www.aliexpress.com/item/4000184288469.html
Dummy Pacifier Teat Nipple Letters Name Orthodontic Newborn Silicone Kids Initial,3.69,3.69,172,5,0,Hang Hang Baby Store,https://www.aliexpress.com/item/4000861438779.html
Hair-Band-Accessories Headwear Bow-Flower Infant Girl Wholesale/ratil Kid 7pcs/Set,0.8,0.8,274,4.8,0.72,pudcoco Official Store,https://www.aliexpress.com/item/32805197025.html
Mesh Socks Baby-Girl Infantil Kids Cotton Summer Children Thin Meia Sokken Breathable,2.73,2.73,293,4.7,0.2,Be Better Life,https://www.aliexpress.com/item/4000012037173.html
Bands Ponytail-Holder Hair-Accessories Hair-Tpu Elastics Girls Baby Child Gum for Disposable,0.11,1.39,108,4.6,0,SaiCi,https://www.aliexpress.com/item/4000274925093.html
Warm-Leggings Stocking Gifts Toddler Baby-Girl Kids Cotton Lace Knee Solid Bowknot Ruffled,0.89,0.98,41,4.9,0.76,pudcoco Official Store,https://www.aliexpress.com/item/32968903602.html
TYRY.HU Ergonomic Baby Carrier infant baby hipseat carrier Kangaroo Bag for Hipseat Front Facing Baby Holder Baby Waist Carrier,18.89,23.12,105,4.9,0,TYRY.HU Official Store,https://www.aliexpress.com/item/4000575237050.html
Headbands Hair-Accessories Tiara Flower Orange Infant Baby-Girl Dot Gift Bowknot 1pcs,0.62,1.01,53,5,0,Lytwtw's Infant Store,https://www.aliexpress.com/item/4000786531052.html
Dinnerware Spoon Fork-Feeding Baby-Bowl Eating Kids Dishes Training Cartoon-Bear Anti-Hot,1.52,3.03,1132,4.8,0.25,Shop3221069 Store,https://www.aliexpress.com/item/32919530682.html
Socks Children Baby-Girls Boys Kids Cotton Cartoon Fashion 5-Pairs Rabbit Spring Autumn,2.72,2.72,110,4.8,0.63,Shop2966100 Store,https://www.aliexpress.com/item/4000771450346.html
Kids Panties Clothing Boys Briefs Child Underwear Baby Lovely Cartoon 3pcs/Lot New,3.59,3.59,842,4.7,0.74,Shop4410027 Store,https://www.aliexpress.com/item/4000327244400.html
0-To-6-Yrs Baby Sock Rubber-Grips Anti-Slip Girls Children's Cotton Boys Boat for Kid,7.92,10.72,74,4.9,0.56,TUKATO Store,https://www.aliexpress.com/item/4000774344929.html
Bowl-Plates Dishes Silica-Gel Baby Feeding Integrated Kids Children's,2.42,4.04,1004,4.7,4.15,Rosikyoffical Store,https://www.aliexpress.com/item/33026724376.html
Soft-Socks Mesh Newborn Baby-Boys-Girls Breathable Kids Knee Cotton Cute Infant 0-4years,1.19,1.19,20,0,0.11,Shop4963036 Store,https://www.aliexpress.com/item/4000131364065.html
Mother Daughter Lace Wedding Dress Prom Normal Clothing Mommy and Me Clothes Family Look Mum Mom Baby Kids Girls Outfits Shirts,12.8,19.88,1,0,0,Shop5791505 Store,https://www.aliexpress.com/item/4001054078259.html
Mom Hairband Hair-Accessories Floral-Print Rabbit Daughter Parent-Child 2pcs/Set Ears,1.46,2.25,22,0,0,Boutique Baby Decor Store,https://www.aliexpress.com/item/4001045886891.html
Family Matching Outfit Romper Short-Sleeve T-Shirt Daddy Baby Kids ME MINI And 1pcs Funny,3.53,4.98,200,4.7,0,jiangkao H Store,https://www.aliexpress.com/item/4000278480448.html
Kids Shoes Sandals Beach-Slippers Animal Prints Resistance Antislip Girl Baby Fashion,4.55,4.55,49,0,3.15,BUUS Store,https://www.aliexpress.com/item/4001015036716.html
Socks Clothing Toddler Baby-Girls Cartoon Cotton Cute Unisex Fox Leg-Warmer Character,0.98,1.19,2012,4.7,0.11,Sweety beard Store,https://www.aliexpress.com/item/32963310532.html
Sister Outfit T-Shirt Sibling Matching Pregnancy-Announcement Little Leopard,3.29,4.59,5,0,0,jiangkao H Store,https://www.aliexpress.com/item/4001027053688.html
Baby Socks Girls Cartoon Love 100%Cotton Slip-Resistant Dad Mum for Small Kid's,0.5,1.29,374,4.8,0,SaiCi,https://www.aliexpress.com/item/32800759767.html
10 Pcs/set Baby Dummy Pacifier Holder Clip Clear Silicone Button Baby Mam Rings Dummy,2.04,2.04,415,4.9,0.14,Innocence Children Store,https://www.aliexpress.com/item/4000188822068.html
Baby Crib Fitted Sheet Cotton Baby Cot Bedding For Newborns Kid Bed Mattress Cover With Elastic For Children Accept Custom Make,7.42,9.15,83,4.9,0,Monday Baby Store,https://www.aliexpress.com/item/4000115535130.html
Slippers Women Shoes Sandals Bathroom Girls Baby Boys Summer Parent-Child New LED,8.21,9.57,72,0,0,peter gojoy Official Store,https://www.aliexpress.com/item/10000277906362.html
Toddler Shoes First-Walkers Baby-Girl Princess Cotton Summer New for Cute Bowknot Soft,2.75,2.75,56,4.8,0.2,I LOVE DADDY & MUMMY Baby Store,https://www.aliexpress.com/item/4000708836787.html
Family Matching Bodysuit Outfits T-Shirt Baby And Ctrl V Dad,4.03,5.99,362,4.8,2.99,About Baby Store,https://www.aliexpress.com/item/4000111304685.html
Loafers Classic-Shoes First-Walkers DS19 Toddler Newborn Infant Baby-Girls Boys Brand-New,2.8,2.8,324,4.7,0.47,BBURQT Store,https://www.aliexpress.com/item/1000006764515.html
Disney Tights Stockings Girl Knitted Pink Baby-Girls Hello-Kitty Cotton Suitable-For,1.19,3.49,2521,4.8,0,Megan Kids-Baby Store,https://www.aliexpress.com/item/4000396996068.html
Girls Socks White School Knee-High Kniekousen Cotton Cartoon Meisje Heart/stripe-Design,1.29,1.47,233,4.7,0,FEOLYGX Toy Store,https://www.aliexpress.com/item/32998961607.html
Hairpin Hair-Accessories Baby-Girl Cartoon Children Bow Random-Pattern Heart 4pcs/Bag,0.18,0.52,12,5,0.17,Bauble Store,https://www.aliexpress.com/item/4000171135137.html
Maternity Clothes chiffon dress summer Short sleeve dress loose pregnant women dress 2019 new Floral Print Sundress Sexy Beach,27.49,27.49,2,0,0,AT20180915 Store,https://www.aliexpress.com/item/33057433657.html
Underwear Short-Pants Girls Toddlers Kids Children Cotton Cartoon Blue Pink for 1-Piece,0.83,0.91,53,4.9,0.63,Shop2795220 Store,https://www.aliexpress.com/item/32969079188.html
Girl Socks Kids Children's Princess Cotton New Bow Long-Tube 2-15-Years-Old Version,1.1,1.59,118,5,0.11,Sweety beard Store,https://www.aliexpress.com/item/32921013936.html
Sandals Toddler Boots Shoes Girls Gladiator Hot-Sell Kids High-Quality Summer Fashion,7.89,10.9,312,4.6,0,Shop4434035 Store,https://www.aliexpress.com/item/4000545548312.html
Swimwear-Set Tropical-Leaves NASHAKAITE Mommy And Family Son Beach-Shorts Me Summer Dad,6.69,11.81,16,0,0,NASHAKAITE DAD&MOMMY & ME Store,https://www.aliexpress.com/item/4000943432674.html
Blankets Swaddle Stroller Velvet Fleece Bebe Infant Newborn-Baby Soft,8.27,8.27,100,4.8,0,Mami Care Store,https://www.aliexpress.com/item/10000126973280.html
Patpat Rompers Coconut-Tank Mom Family Matching Dresst-Shirt Baby-Girl Family-Look Summer,8.27,10.11,243,4.6,0,PATPAT Official Store,https://www.aliexpress.com/item/4000552291569.html
Corner-Protector Safety-Corner-Guards Baby Safety Silicone Children Anticollision-Edge,1.95,1.95,358,4.9,0,Smgslib Baby products Store,https://www.aliexpress.com/item/4000715790213.html
Children Backpacks Canvas Cartoon Cute Animal Modelling Schoolbag for Boys Girls Lovely Solid Kids Kindergarten Travel Backpacks,19.37,19.37,16,0,0,Thirty Store,https://www.aliexpress.com/item/4001024759292.html
Tableware-Set Spoon-Fork Dishes Wheat-Straw Feeding-Plate Training-Bowl Baby Kids Children's,1.41,2.72,812,4.7,0.17,ZDLDWJDP Store,https://www.aliexpress.com/item/4000003280023.html
Dishes Bowl Food-Dinnerware Learning Kids Eating Toddler Baby Assist for High-Quality,0.7,1.57,132,5,2.35,HY Baby&Mother Store,https://www.aliexpress.com/item/4000991038414.html
Socks Flowers Mesh Crystal Elastic Baby-Girl Kids Summer Children Lovely Lace Floral,3.3,3.3,426,4.6,0.11,Sweety beard Store,https://www.aliexpress.com/item/33048364306.html
Shoes First-Walkers Anti-Slip Toddler Newborn Baby-Girl Flower Soft-Bottom Cute Soled,3.13,3.13,20,5,0.2,I LOVE DADDY & MUMMY Baby Store,https://www.aliexpress.com/item/4000429881696.html
Neck-Tshirt Garland Family-Look Daughter Super-Mom Kids Summer with Spring Pretty-Printing,3.14,4.19,72,5,0,Once Select Store,https://www.aliexpress.com/item/4000857619775.html
Hairpins Hair-Accessories Rainbow Girls Children Barrette Flower New Star Sweet Fashion,0.15,1.99,5,0,0,SaiCi,https://www.aliexpress.com/item/4001085118231.html
High-Socks Crown Baby-Girls Princess Kids Cotton Fashion Children Knee Cute Autumn,1.45,1.93,1685,4.9,0,Wecute Retail Store,https://www.aliexpress.com/item/32986241894.html
cotton baby headband for girls baby bow Headbands children Turban Baby Accessories Hair Set cotton floral newborn headband,1.69,3.38,280,4.6,0,Florial BB Club Store,https://www.aliexpress.com/item/32977086709.html
Pyjamas Baby Vest Children Sleepwear Snow-Queen Superman Girl Kids Cartoon Princess Summer,2.05,2.26,126,4.4,3.79,MissL Store,https://www.aliexpress.com/item/4000197559860.html
Bow Baby Headwear Hairpin Hair-Accessories Ribbon Girl Pins Kids Wrapped Windmill Safety,0.68,0.68,32,5,0,Kawaii Children World Store,https://www.aliexpress.com/item/32967481312.html
Baby Shoes First-Walkers Toddler Newborn Cotton Love Soft-Sole Print,1.69,1.69,40,5,0.32,Mammy-Baby Store,https://www.aliexpress.com/item/4000686685842.html
Socks Bow-Fishnet Baby-Girls Kids Short Fashion Summer Mesh Ankle High-Lace,0.66,0.66,38,5,0.14,Firstgift Store,https://www.aliexpress.com/item/4000890817165.html
Bottle Cup Milk Holder Adjustable Safety Plastic Baby Toddler Juice Box Drinking,1.47,1.47,42,5,0.17,My Toy Station Store,https://www.aliexpress.com/item/4000388449907.html
Short Sock Ruffle Infant Baby-Girl Cotton Lace Warm Princess Cute 6-Pairs/Lot Spring-Clothing-Accessory,2.2,2.2,54,5,0.62,Grape baby Store,https://www.aliexpress.com/item/33033148962.html
Baby Dummies Nipple-Teat Baby-Supplies Food-Nibbler-Feeder Kids Teethers-Ring Fresh Feeding-Safe,0.58,1.59,18,5,0.11,Shop4963036 Store,https://www.aliexpress.com/item/4000056450777.html
Newest Autumn Girls leather shoes Children girls baby princess bowknot sneakers pearl diamond single shoes Kids dance shoes,5.91,11.34,193,4.5,0,Bekamille Official Store,https://www.aliexpress.com/item/32698741739.html
Stockings Tights Pantyhose Flesh Ballet Toddler White Kids Children Girls for Summer,1.47,1.47,193,4.8,0.11,Shop4101005 Store,https://www.aliexpress.com/item/32972850774.html
Ankle-Socks Angel Lace Bow Children-Accessories Toddlers Girls Princess Kids Cotton Newborn,2.34,2.34,236,4.9,0.73,pudcoco Official Store,https://www.aliexpress.com/item/32999660477.html
Toddler Shoes Sneakers Anti-Slip Baby Booties Girl New Born Lovely Brand Fashion Boy,3.74,4.39,1198,4.8,0,Sonkpuel Official Store,https://www.aliexpress.com/item/4000263092291.html
5M+8pcs Baby Safety Proofing Edge Corner Guards Desk Table Corner Protector Children Protection Furniture Bumper Corner Cushion,1115.22,1115.22,226,4.9,0,SUPERMOM- Store,https://www.aliexpress.com/item/32989602431.html
Bamboo Baby Blanket Swaddle-Wrap Stroller Bath-Towel Sleep-Cover Bebe Newborn 120x120cm,7.89,7.89,388,4.9,0.85,LuckyBabyFans Store,https://www.aliexpress.com/item/4000586349655.html
Tableware-Set Spoon-Fork Cutlery Dinnerware Baby Gadgets Children Utensil Stainless-Steel,2.39,2.41,716,4.9,0,Online Shopping Malls,https://www.aliexpress.com/item/32993404840.html
TYRY.HU Clip Pacifier-Clip Round-Shaped Baby Silicone Nipple DIY Bead Toy Clasps,1.96,1.96,291,4.9,0,TYRY.HU Official Store,https://www.aliexpress.com/item/32845377877.html
Pudcoco Matching Outfits T-Shirt Big Sister Baby-Girls Romper Tee Tops,3.16,3.91,87,4.8,0.08,FiTi Tree Store,https://www.aliexpress.com/item/32862654994.html
Kids Shorts T-Shirt Boys Pyjamas Spiderman Baby Sleepers Batman Summer,6.11,7.49,67,4,0,ZOO2 Store,https://www.aliexpress.com/item/4000813764600.html
Family Matching Daughter-Dresses Girl Big Sister Short Striped,5.98,9.1,155,4.6,0,babynico Store,https://www.aliexpress.com/item/33026483038.html
Toddler Shoes Floor-Socks Velvet Knitted Warm Infant Baby Girls Winter Boys Cotton Thick,1.83,1.83,131,4.9,2.11,partisig Official Store,https://www.aliexpress.com/item/4000529526590.html
1Pairs/Lot Flower Newborn Baby Socks Cotton Anti-Slip Kids Floor Socks Bow Girl First Walkers Infant Toddler Socks Mesh Shoes,4.85,4.85,2,0,3.95,Happiness Mommy Store,https://www.aliexpress.com/item/4000826516548.html
Kangobaby Blanket Wrap Swaddle Infant Bamboo Cotton 70-% Cartoon Soft Printed Breathable,5.94,6.79,36,0,0,kangobaby Sawddle Store,https://www.aliexpress.com/item/4001005902252.html
Cushion Pillows Positioner Flat-Head Anti-Roll Toddler Newborn Baby Prevent Infant Babies,0.66,0.66,219,4.9,1.07,Tancom Store,https://www.aliexpress.com/item/4000538652215.html
Chain Pacifier-Clip Beads Baby Baby-Boy-Girl Silicone Infant Chew 1pcs Safe for Toy Gifts,1.48,2.19,42,4.5,0,CNNINHAO Toy Store,https://www.aliexpress.com/item/4000794221474.html
Socks Children Baby-Girls Boys Kids Cotton Cartoon Fashion 5-Pairs Rabbit Spring Autumn,2.72,2.72,110,4.8,0.63,Shop2966100 Store,https://www.aliexpress.com/item/4000771450346.html
Pillow Cushion Headrest Protection-Pad Neck Baby-Head Nursing-Drop-Resistance Cute Wings,6.52,7.97,744,4.9,0,Nantong Diz Baby`s Store,https://www.aliexpress.com/item/32849804202.html
Muslin Swaddle Blanket Bamboo Infant 30%Cotton 70-% Soft Baby,4.07,4.68,67,5,1.22,LuckyBabyFans Store,https://www.aliexpress.com/item/4000790620995.html
Headwear Baby Hair-Rope Hair-Accessories Rubber-Bands Elastic Girls Hairball Children,1.64,1.64,313,4.8,0,Colourful Mommy Baby Store,https://www.aliexpress.com/item/32959380616.html
Qshare Baby Placemat Cute Pig Silicone Suction Plate Children Feeding Plate Baby Food Feeding Bowl Baby Dishes Pratos,8.25,8.25,59,4.6,0,Qshare Store,https://www.aliexpress.com/item/4000221960761.html
Girls Headwear Caps Beanie Shower-Hat Photo-Props Blend Baby Turban Birthday-Gift Toddler,1.78,1.86,1421,4.7,0,"Nishine E-Commerce Co., Ltd. Store",https://www.aliexpress.com/item/32907000353.html
Girl Tights Pantyhose Flroal-Pattern Retro Children New Summer 6-Colors Beautiful Ultra-Thin-Side,0.95,0.95,52,4.9,0.72,Ozijun _ Store,https://www.aliexpress.com/item/32993982341.html
Girls Tight Pantyhose Kids Pinstripe Baby Children White New Bow Autumn Infant Style,1,1,1,0,1.48,Ozijun _ Store,https://www.aliexpress.com/item/32828300505.html
Girl Socks Korean-Version Kids Summer Children's Princess Cotton New Long-Tube 3-10-Years-Old,1.48,1.97,33,4.2,0.11,Sweety beard Store,https://www.aliexpress.com/item/4000173502109.html
Boots Boys Shoes Toddler Autumn Girls Fashion NEW Warm Spring PU 3BB,5.5,11.45,1001,4.5,0,Yuanyuan Fashion,https://www.aliexpress.com/item/32864247668.html
Matching Floral-Dress Clothes Family Patchwork Baby Mommy And Me New Fashion Romper,6.79,12.61,59,0,0,Shop5069294 Store,https://www.aliexpress.com/item/4001006950215.html
Boy Socks TAO Spain-Design Toddler Girls Baby Autumn Kids Fashion Brand Knee New Infant,3.94,3.94,97,5,0,Baby Boom Store,https://www.aliexpress.com/item/4000811982808.html
Baby Feeding Universal Gyro Bowl 360 Rotate Spill-Proof Solid Feeding Dishes Baby Balance Novelty educational toys Practical,0.99,0.99,0,0,2.22,ASWJ Store,https://www.aliexpress.com/item/4001128328468.html
Kids Pillows Cushion Muslinlife-Head-Protection Animal-Printed Newborn-Baby Cotton Dropship,1.31,1.77,1178,4.6,2.14,HotMama's shopping cart Store,https://www.aliexpress.com/item/32968606584.html
Shoes First-Walkers Soft-Bottom Toddler Newborn-Baby Infant Girls Baby-Boy Blue-Color,4.86,4.86,166,4.4,0,"Dongguan Babytree Garment Co.,Ltd Store",https://www.aliexpress.com/item/32966640238.html
Hairpin Barrette-Accessories Hair-Clip-Head Princess Baby Children Kids Headwear Dropship,0.4,2.8,22,0,0,Baby-Care Dropship Store,https://www.aliexpress.com/item/4000929803013.html
Baby Swaddle Blanket Stroller-Cover SWAN Both-Towel PINK Infant 100%Muslin Cotton Warp,0.97,1.56,50,4.4,2.86,PINK SWAN Mother&Baby Store,https://www.aliexpress.com/item/32862134594.html
Headbands MAYA Girls Newborn Infant Floral Retro STEPAN Rabbit Print Ears 1piece,0.36,0.36,76,5,0.47,Stepan Store,https://www.aliexpress.com/item/32865504569.html
Swaddle Wrap Blanket Quilt Bed-Cover Tassel Muslin Baby Infant Cotton,8.92,11.48,129,4.8,1.83,LuckyBabyFans Store,https://www.aliexpress.com/item/4000845474065.html
Baby Shoes Newborn-Dot Girls Summer First-Walker Princess Cotton for Bow,2.99,3.73,9,0,0.11,BabyCute Store,https://www.aliexpress.com/item/4001065395117.html
New Pacifier Clips Baby Accessories Lovely Pacifier Chain Baby Soother Pacifier Nipple Holder Baby Teething Toys Dummy Clip,3.7,3.7,54,5,0,Siliwood Store,https://www.aliexpress.com/item/10000131511608.html
Family Matching Outfits Tshirt Daddy Baby-Boy Little Kids Summer Fashion And Big Man,4.03,5.99,87,4.9,3.12,About Baby Store,https://www.aliexpress.com/item/4000097698119.html
