Title,PriceMin,PriceMax,Sold,Rating,Shipping,Store,URL
Baby Pacifier Nipple Fruits Silicone Infant Kids Toddler Vegetable-Food,1.32,1.81,40,5,0,Shop5736069 Store,https://www.aliexpress.com/item/4000838309407.html
Kids Socks Mesh Smile-Dot Newborn Baby-Girls Thin Cotton Summer 5pairs/Lot Spring Multicolor,3.15,3.15,54,4.3,0.26,NEMO BABY Store,https://www.aliexpress.com/item/4000803173867.html
Invisible Socks Boat Anti-Slip Girls Kids Cotton Summer Children 5-Pairs/Lot Spring,4.43,4.43,165,4.9,2.94,Mother & babys Store,https://www.aliexpress.com/item/4000255584709.html
Dummy Clips Pacifier-Clip Baby Wooden 1pc DIY Natural Lovely New-Arrival,0.15,1.19,1,0,0,"The Girl Next Door Trading Co., Ltd",https://www.aliexpress.com/item/4001084877138.html
Soft-Silicone-Plate Tableware Food-Grade Baby Kids Microwaveable for Can-Be-Beated 1pc,2.76,4.92,33,0,0,let's make Mother&Baby Store,https://www.aliexpress.com/item/4000852989408.html
Boys Socks Mickey Mouse Minne Baby-Girls Stripe Cotton Cartoon 5-Pairs/Lot Sports-Autumn-Spring,3.58,4.12,115,4.8,0,toni Store,https://www.aliexpress.com/item/32960366505.html
MIYOCAR Pacifier-Queen Dummy Rhinestone Ideal Handmade Bling King-Style Baby Gift PBC,4.9,4.9,157,4.8,0,Unique personalised design Store,https://www.aliexpress.com/item/4000412946666.html
Beach-Sandals Shoes Cork-Sole Girls Design Boys Fashion Summer Children Newest for Brand,10.39,13.11,11,0,1.24,Shop5587158 Store,https://www.aliexpress.com/item/4001013609744.html
Toddler Shoes Sneakers Batman Superman Bebe Infant Baby-Boys Cartoon Fashion Soft-Sole,2.11,2.64,125,4.9,1.35,Baby&Mommy 's tale Store,https://www.aliexpress.com/item/4000666713718.html
Kids Headwear Ponytail-Holder Hair-Accessories Velvet Elastic Girls Cute Adult Fashion,3.39,3.39,91,4.9,0,"Nishine E-Commerce Co., Ltd. Store",https://www.aliexpress.com/item/4000547904373.html
Family Matching Outfits Polo-Shirt Couple Clothes Collar Dad Son Summer Dresses Turn-Down,8.73,12.66,55,4.7,0,Trusty Store,https://www.aliexpress.com/item/33055685699.html
Coat Down-Jacket Warm Baby-Boys-Girls Shiny Winter Child White-Duck-Down Kids Fashion,22.67,22.67,108,4.9,0,Onepoem Store,https://www.aliexpress.com/item/4000176748176.html
Baby Nightwear Pyjamas-Set Short-Sleeve Kids Summer Cute Child Cartoon Big Gift Lovely,4.08,6.15,4,0,0,jxmyyc baby Store,https://www.aliexpress.com/item/4001007609382.html
Shoes Sandals Clogs Toddler Baby-Boy Summer Soft-Sole Anti-Slip PU for 0-18M Hollow,1.13,4.97,71,4.7,0,The Internation Shopping Store,https://www.aliexpress.com/item/4000730156467.html
Baby Socks Slippers Shoes Grip Floor Toddler Infant Cotton Cute 0-3 6-Colors Polyester,0.57,3.39,69,5,0,Baby-Care Dropship Store,https://www.aliexpress.com/item/4000922109265.html
Kids Socks Korean-Style Cotton Children Cartoon for College Comfortable 4-14Y,1.8,4.77,79,5,0,FeiHan Store,https://www.aliexpress.com/item/4000522396880.html
Stockings Pantyhose Bright Girls Children Mesh Fashion Solid 4-12years Diamond-Base Network-Pattern,1.43,1.46,81,4.9,1.62,AiLe Rabbit official store,https://www.aliexpress.com/item/33025600687.html
Girls Pajamas Tshirt Shorts-Set Princess Sleepwear Baby Children's Summer 3-13T,6.67,7.35,99,4.3,0,Sunny baby's store,https://www.aliexpress.com/item/32981763120.html
Family Matching Dresses Outfits Daughter-Dress Women Summer Girl Boho Loose Off-Shoulder,4.26,5.25,195,4.6,3.25,Baby&Mommy Clothes Store,https://www.aliexpress.com/item/4000013598734.html
Plate Tableware-Tray Baby Dishes Car-Shape Kids Dinnerware Toddler Infant Child Cartoon,1.08,1.08,412,4.8,1.42,babymama Store,https://www.aliexpress.com/item/4000009166917.html
Clothes-Sets Shorts Pajamas Tee Home-Wear Baby-Boy Cartoon Kids Children Summer Year,2.73,3.35,76,4.8,3.76,Shop5004150 Store,https://www.aliexpress.com/item/4000688827344.html
Pregnant-Swimsuits Monokini Maternity-Swimwear One-Piece Flounce Vintage Off-Shoulder,10.99,10.99,63,4.9,0,Ecavus Official Store,https://www.aliexpress.com/item/33023107987.html
Baby Nightwear Pyjamas-Set Short-Sleeve Kids Summer Cute Child Cartoon Big Gift Lovely,4.08,6.15,4,0,0,jxmyyc baby Store,https://www.aliexpress.com/item/4001007609382.html
Shoes Sandals Clogs Toddler Baby-Boy Summer Soft-Sole Anti-Slip PU for 0-18M Hollow,1.13,4.97,71,4.7,0,The Internation Shopping Store,https://www.aliexpress.com/item/4000730156467.html
Baby Socks Slippers Shoes Grip Floor Toddler Infant Cotton Cute 0-3 6-Colors Polyester,0.57,3.39,69,5,0,Baby-Care Dropship Store,https://www.aliexpress.com/item/4000922109265.html
Kids Socks Korean-Style Cotton Children Cartoon for College Comfortable 4-14Y,1.8,4.77,79,5,0,FeiHan Store,https://www.aliexpress.com/item/4000522396880.html
Stockings Pantyhose Bright Girls Children Mesh Fashion Solid 4-12years Diamond-Base Network-Pattern,1.43,1.46,81,4.9,1.62,AiLe Rabbit official store,https://www.aliexpress.com/item/33025600687.html
Family Matching Dresses Outfits Daughter-Dress Women Summer Girl Boho Loose Off-Shoulder,4.26,5.25,195,4.6,3.25,Baby&Mommy Clothes Store,https://www.aliexpress.com/item/4000013598734.html
Plate Tableware-Tray Baby Dishes Car-Shape Kids Dinnerware Toddler Infant Child Cartoon,1.08,1.08,412,4.8,1.42,babymama Store,https://www.aliexpress.com/item/4000009166917.html
Pregnant-Swimsuits Monokini Maternity-Swimwear One-Piece Flounce Vintage Off-Shoulder,10.99,10.99,63,4.9,0,Ecavus Official Store,https://www.aliexpress.com/item/33023107987.html
Hairpin Ribbon-Bows Wisp-Clip Little-Bow Small Newborn Infant Babies Mini 20pc Latch,2.93,2.93,104,4.4,0,Ms. Yang Dropshipping Store,https://www.aliexpress.com/item/4000078086279.html
Sandals Crib-Shoes Newborn Baby-Girl Summer Casual Bow Kid Canvas,4,4,75,4.8,0,Steven Baby Store,https://www.aliexpress.com/item/32879241528.html
Baby Pacifier Food-Nibbler-Feeder Fruits Newborn Nipple-Mesh-Bag Fresh Safety-Feeding,1.68,1.68,72,4.9,0,Shop4836080 Store,https://www.aliexpress.com/item/32978708500.html
Baby Swaddle Headband Blanket Newborn Baby-Boys-Girls Infant 2pcs/Set Printed Fashion,1.09,4.48,26,5,0,"The Girl Next Door Trading Co., Ltd",https://www.aliexpress.com/item/4000001322186.html
SAILEROAD Dinosaur Pajamas Home-Wear Girls Kids Cotton Boys Children's Summer Short,6.6,8.63,28,5,0,SAILEROAD kidsclothes Store,https://www.aliexpress.com/item/4000927046474.html
Girls Hairband Hair-Accessories Gifts Little Clip Flower Kids Bow Cute Cartoon 10pcs/Lot,1.1,1.1,71,4.8,0,L&S Store,https://www.aliexpress.com/item/32920999913.html
EUDEMON Safety-Fridge-Lock Single-Door Kitchen Child Protection Kids,2.96,2.96,105,4.7,0,EUDEMON Official Store,https://www.aliexpress.com/item/4000812040095.html
Running-Shoes Boys Fashionable New Sports Autumn for Girls Net Leisure Brand,7.99,7.99,9,0,1.45,mengyuyan Store,https://www.aliexpress.com/item/4000746669565.html
Suit Nightwear Pajamas-Set Sleepwear Christmas Baby-Girls Boys Children Cotton HYL21,5.65,7.95,165,4.7,0,extraordinary baby Store,https://www.aliexpress.com/item/32855739700.html
Family Matching Sweatshirt Mommy Daughter And Autumn Spring I-Wear Digital-Print Pug,6.68,9.49,13,5,0,Happbear baby Store,https://www.aliexpress.com/item/4000393182296.html
Kids Shoes Slipper Funny Home-House Baby-Girls Winter Cartoon Indoor Soft,3.09,3.26,216,4.7,0,Rose Poppy Store,https://www.aliexpress.com/item/4000645162445.html
Elinfant Diaper Nappy Cloth Coffee Adjustable Eco-Friendly New 4pcs/Set,3.9,14.23,1211,4.8,0,Elinfant Official Store,https://www.aliexpress.com/item/32954782304.html
First-Walkers Moccasins Baby Shoes Sequin Newborn Girls Boys PU 0-18M Autumn/spring,2.52,3.21,936,4.9,0.23,WONBO Official Store,https://www.aliexpress.com/item/32792991292.html
Baby Blankets Swaddle Wrap Stroller-Accessories Bath-Towels Knitted Sleep Newborn Outdoor,8.05,8.05,253,4.9,3.51,Ziyunlong Baby Cothes Store,https://www.aliexpress.com/item/4000324289109.html
Toddler Shoes Headband-Set Anti-Slip Girls Princess Cotton Summer New Pink Bowknot PU,2.03,3.53,71,4.6,0.2,I LOVE DADDY & MUMMY Baby Store,https://www.aliexpress.com/item/4000717653364.html
Kids Sock Girls Winter Boys Cotton Children's 5-Pair Autumn And Spring Multi-Color Student,2.38,2.75,47,4.5,0.21,Shop41010005 Store,https://www.aliexpress.com/item/4000420321332.html
Breathable Socks Mesh Newborn Baby-Girls-Boys Cotton Children Wholesale Summer 5-Pairs/Lot,2.75,3.44,696,4.8,4.21,Sonkpuel Online Store,https://www.aliexpress.com/item/4000107359391.html
Baby Pacifier Clips Dummy-Clip-Holder Feeding-Accessories Wooden Solid 5pcs/Lot Clasp,3.73,3.73,434,4.9,0,lofcababy Store,https://www.aliexpress.com/item/32947692697.html
Balleenshiny Hair-Band Crown Rhinestone Elastic Baby-Girl Infant Child Mesh Three-Dimensional-Alloy,1.72,1.72,6,0,0,BalleenShiny Flag Ship Store,https://www.aliexpress.com/item/4001069259270.html
Baby Shoes Infant Sneakers Toddler Girls Boys Soft-Sole Breathable 0-18M,4.45,4.99,68,0,3.06,Shop5621242 Store,https://www.aliexpress.com/item/4001026902299.html
Fish-Shoes First-Walkers Toddler Girls Infant Baby Mesh-Bottom Breathable Cartoon Cute,1.98,2.32,43,0,0.91,pudcoco Official Store,https://www.aliexpress.com/item/4000911434589.html
Kids Cups Straw-Learning-Cup Water-Bottle-Kettle Baby-Cup Bpa-Free Child Bear Tritan-Material,18.53,18.53,13,0,0,Hi my baby Store,https://www.aliexpress.com/item/4001085168173.html
Blanket Muslin Swaddle-Wrap Diaper Newborn Cotton 120x110cm Baby Gauze,3.01,4.28,12,4.7,0.6,LuckyBabyFans Store,https://www.aliexpress.com/item/4001019425309.html
Face-Towels Handkerchief Newborn Baby Water-Washing 5pcs/Lot 6layers-Bottom Size30--30,3.64,3.64,448,4.8,0,Shop1198799 Store,https://www.aliexpress.com/item/32884181108.html
Headband Girl Bows-Accessories Rhinestone Newborn-Baby Mini Flower Ornament Solid 1set,1.06,1.06,22,4.2,0.47,Graceful Dance,https://www.aliexpress.com/item/32827117796.html
DIMI Toddler Sandals Shoes Baby-Girls Infant Boys Summer Non-Slip Kid Soft Anti-Collision,9.36,10.15,962,4.8,0.53,DIMI YanTe Store,https://www.aliexpress.com/item/33015863751.html
Tableware Fork Chopstick-Case Spoon Feeding-Cutlery-Set Picnic-Sets Eco-Friendly Baby,1.86,1.94,12,0,0.79,Warm Store,https://www.aliexpress.com/item/4000449765067.html
Swimsuit Clothing Bikini Beachwear Leopard Print Maternity-Swimwear Women Summer 522,5.24,9.04,89,4.5,3.63,Son Song Store,https://www.aliexpress.com/item/33021736919.html
Pajamas Sleepwear Teenage-Jacket Kids Nightwear Baby-Girl Children Cotton-Sets Spring,6.72,10.6,57,4.7,0,hello cute,https://www.aliexpress.com/item/4000842380449.html
Fox Boys Socks Girls Sports Winter Cotton Cartoon 10pcs/5pairs Unisex Spring Autumn Breathable,2.67,3.42,81,4.8,0.11,Sweety beard Store,https://www.aliexpress.com/item/4000022931362.html
Baby Pillow Support Memory-Foam Sleep Positioner Anti-Roll Adjustable Newborn Infant,1.14,1.14,260,4.6,1.92,Litchi Baby Store,https://www.aliexpress.com/item/33061182416.html
Spring Socks Boat Anti-Slip Baby Girls Infant Cotton Summer 3-Pairs/Lot Soft Solid,3.2,3.73,457,5,0.2,YWHUANSEN Official Store,https://www.aliexpress.com/item/4000705843508.html
Dropper Pipettes Gummy-Mold Candy Plastic Silicone Kids Children for Sweet Kitchen Cr,2.1,2.1,73,4.8,1.07,OH My Little Baby Store,https://www.aliexpress.com/item/4000379050059.html
Family Matching T-Shirts Outfits Mommy And Me Son Casual Cotton,5.7,6.69,93,4.9,0,FeJa Official Store,https://www.aliexpress.com/item/33031277989.html
Kids Boys Underwear Panties Shorts Boxers Teenager Baby-Boy Cartoon Children's for Stripes,1.73,2.56,58,4.3,0,FeiHan Store,https://www.aliexpress.com/item/4000393475190.html
Blanket Cover Swaddling Coral-Fleece Warm Office Winter New Thick 70x100cm Student Single,6.39,6.39,141,4.2,0,My China Store,https://www.aliexpress.com/item/32964403365.html
Baby Bow Hair-Clip Newborn-Decoration Mini Kids Dot Solid 10pcs/Set Printed Colorful,1.77,1.77,251,4.6,0.2,Enjoy shopping ( offer drop shipping ),https://www.aliexpress.com/item/32795492878.html
Stroller Blanket Swaddling Bedding-Set Crib Name Personalised Newborn-Baby Toddler Soft-Fleece,16.58,16.58,430,4.8,0,MrWr Personalization Store,https://www.aliexpress.com/item/4000544979093.html
Shoes Floor-Socks Non-Slip Soft-Bottom Toddler Transparent Leopard Girl Baby Solid-Color,3.91,4.62,1441,4.7,0,YWHUANSEN Official Store,https://www.aliexpress.com/item/33008426646.html
Photo-Blanket Milestone Newborn Baby Angel-Wings Floral for Cotton Shoots Cloth,2.54,6.26,2,0,0.82,HeyChildhood Store,https://www.aliexpress.com/item/4001022183703.html
Sneakers Shoes Rose-Gold Non-Slip Baby Booties Newborn Infant Girls Princess for Soft-Crib,2.34,2.34,67,5,0.92,Hi babies Store,https://www.aliexpress.com/item/4000319245157.html
Sneaker Crib-Shoes First-Walker Newborn Bebe Baby-Boys Summer Soft-Sole Children Fashion,3.29,4.08,49,5,0.93,DARling-Baby Store,https://www.aliexpress.com/item/4000860949716.html
Chain Pacifier-Clips Dummy-Clip Nipple Baby Infant Feeding-for 20/12,1.28,1.29,341,4.7,0,Come On 2015,https://www.aliexpress.com/item/32843233573.html
Nipple Pacifier Clip Dummy-Holder Crochet Gray Baby-Boys-Girls Cotton Simple,1.64,1.99,17,0,0.57,Shop4798016 Store,https://www.aliexpress.com/item/33037554036.html
Socks Toddler Sneaker Short Superman-Sock Mesh Dinosaur Funny Baby Girls Boys Cotton,4.86,4.86,1590,4.9,0,Grape baby Store,https://www.aliexpress.com/item/4000668663542.html
Lytwtw's Hairpins Hair-Accessory Toddlers-Clips Baby-Girl Infant Kawaii Newborn Gift,2.16,2.16,37,5,0,Lytwtw's Infant Store,https://www.aliexpress.com/item/33058396178.html
Kids Sandals Soft-Shoes Toddler Girls New-Arrival Glowing Princess with Light Children,7.79,9.76,63,0,0.96,18 CIWEI Store,https://www.aliexpress.com/item/4000976587957.html
Dance-Stockings Cover Pantyhose Tights Girls Kids Children Sheer Silk Summer for Thin,1.58,1.58,44,4.8,0.98,Ozijun _ Store,https://www.aliexpress.com/item/32870390129.html
Sport Sandals Beach-Shoes Girls Kids Summer Children Comfortable Baby New Boy Fashion,4.03,9.55,14,0,1.58,Shop5603037 Store,https://www.aliexpress.com/item/4000910763209.html
Sandals Beach-Shoes Comfortable Girls Kids Fashion Summer Baby New Boy Casual Size-21-30,7.8,10.44,604,4.5,0,Beaux Bebe Official Store,https://www.aliexpress.com/item/32979739683.html
Pudcoco Toddler Shoes Sport-Walkers Newborn Baby-Boy-Girl Soft-Sole Hook Solid 0-18M,3.19,3.59,71,3.6,0,Yaya baby Store,https://www.aliexpress.com/item/4000289414439.html
Fork-Set Training-Spoon Feeding-Flatware-Set Baby Soft-Silicone Baby-Girls-Boys Safe,7.55,7.55,8,0,0,HotMama's shopping cart Store,https://www.aliexpress.com/item/4001063422389.html
Baby Spoons Tableware-Set Forks-Box Feeding-Utensils Kids Cutlery Stainless-Steel 3pcs,3.24,3.73,198,4.8,0,Warm Smlie,https://www.aliexpress.com/item/4000469700658.html
Baby Blanket Swaddle-Wrap Bath-Towel Diapers Muslin Newborn Infant Toddlar Cotton 75x75cm,3.63,3.63,5,0,0,LuckyBabyFans Store,https://www.aliexpress.com/item/4001019114557.html
Slippers Children Sandals Slides Fluffy Girl Kids Summer Plush Fur Fox-Fur 25-35 Furry,9.52,12.95,40,4.7,0,jiangheng Store,https://www.aliexpress.com/item/4000836826633.html
Baby Socks Kids Cotton Anti-Slip Newborn Soft Candy-Color,1.89,1.89,29,4.8,0,Children's lives Store,https://www.aliexpress.com/item/4000086013863.html
Panties Underwear Boxer Briefs Boys Kids Cartoon 2-To-12-Years Cotton Cute Pattern 1pcs,1.57,1.96,61,4.3,0,Shop5008198 Store,https://www.aliexpress.com/item/4000052623348.html
YWHUANSEN Dressy-Sock Toddler Little-Girls' Princess Cotton Lace-Top Double-Ruffle,0.47,0.67,140,4.9,0.66,YWHUANSEN Official Store,https://www.aliexpress.com/item/4000467786950.html
Bamboo Baby Towel-Scarf Blanket Bibs Swaddle-Wrap Cloth Muslin Squares Solid-Bandana,2.95,2.95,5,0,1.63,LuckyBabyFans Store,https://www.aliexpress.com/item/4001101374640.html
Baby Pacifier Nipple-Mesh Food-Nibbler-Feeder Fruits Fresh Safety-Feeding Newborn Infant,0.94,1.54,31,5,0.27,Shop5165021 Store,https://www.aliexpress.com/item/4000405766678.html
Baby Pacifier Nipple-Feeding-Accessories Orthodontic Newborn Soft-Silicone Cartoon Infant,0.17,1.39,68,4.9,0,"The Girl Next Door Trading Co., Ltd",https://www.aliexpress.com/item/4000086550387.html
Infant Headbands Beanie Turban Bebe Girls Solid Cotton for Stretchy Hat Baby Faixa Cabelo,2.27,2.73,168,4.9,0,Mummy & Baby World Store,https://www.aliexpress.com/item/4000193464312.html
Kids Underwear Shorts Children's Briefs Baby-Girl Cartoon-Designs Cotton 5pcs Lot ZL15,4.24,4.24,57,4.9,0,Seamos Store,https://www.aliexpress.com/item/4000099852198.html
Mom Dress Outfits Tassel Nine Family Matching Newborn Baby-Girl Daughter Mini And Stripe,5.09,9.17,512,4.4,0,MagicMom Store,https://www.aliexpress.com/item/33002984366.html
Muslin Swaddle Wrap Baby Blankets Bebek Bamboo Monthly Newborn Kids Super-Soft Unicorn,8.25,8.25,101,4.9,0,Giol Me Num Official Store,https://www.aliexpress.com/item/32953320497.html
Baby Swaddle Blanket Bedding Sleeping-Bag Infants Newborn Cotton Cute Babies Cap,2.06,5.08,61,4.9,1.63,Babywell Store,https://www.aliexpress.com/item/4000124659489.html
Toddler Shoes Sandals Girls High-Gladiator Summer Flat-Heels Fashion Lace-Up,2.13,3.8,30,4.8,3.96,My Little Princess Dropshipping Store,https://www.aliexpress.com/item/4000569005849.html
Family Matching Outfits T-Shirt Mom Daughter Baby-Girls Boys Son Summer Mommy Cute And,4.19,5.19,42,5,3.12,About Baby Store,https://www.aliexpress.com/item/4000977368658.html
MIYOCAR Bling Pacifier Letter Dummy Gold Silver Initials Bpa-Free White Name And LA-W,9.53,10.59,212,4.9,0,YoYo hand made Store,https://www.aliexpress.com/item/33039123254.html
Eating Spoon-Set Training Plastic Toddler Baby Kids Food Safe for Hot-Sale,1.44,1.44,31,4,0.17,My Toy Station Store,https://www.aliexpress.com/item/4000411245499.html
ULKNN Kids Shoes Flower Glitter High-Heel Pink Silver Girls Princess Children for Casual,11.66,16.91,443,4.9,0,ULKNN Official Store,https://www.aliexpress.com/item/32842008240.html
Pillow Baby Headrest Protection-Pad Nursing-Drop-Resistance Wings Neck Toddler Cute New,0.9,4.29,514,4.7,0.17,Ali-Childhood Store,https://www.aliexpress.com/item/32838328853.html
Pajamas-Sets Trousers Sleepwear Clothing Tshirt Long-Sleeved Baby-Boys-Girls Kids Cotton,3.91,6.37,103,4.9,0,happybaby520 Store,https://www.aliexpress.com/item/4000763954367.html
Pajamas-Sets Rooter Excavator-Printing-Pajamas Boys Children Summer Infantil for 2-8yrs,5.29,6.53,211,4.8,0,Little Bitty Official Store,https://www.aliexpress.com/item/32872640356.html
Nylon Headband Hair-Accessories Turban Photography-Props Flower-Print Knotted Newborns,11.55,34.65,155,4.4,3.89,KIDOCHEESE Official Store,https://www.aliexpress.com/item/4000606715048.html
Pregnancy-Swimsuit Maternity-Swimwear Off-Shoulder Pregnant-One-Pieces Summer Print Striped,4.21,9.27,21,5,0,Him & Her Store,https://www.aliexpress.com/item/4000476338506.html
Newborn Infant Baby Pillow Newborn Infant Comfortable Cushion Prevent Flat Head,3.16,3.16,11,0,0,Baby Jouet toy Store,https://www.aliexpress.com/item/4000499990533.html
Girls Pyjamas Children Sleepwear Cotton Nightwear Baby-Homewear-Sets Boys 2-7yrs JIE223,3.28,7.4,18,4.7,0,MGoodbaby Store,https://www.aliexpress.com/item/32997439627.html
Briefs Panty Lingerie Underwear Heart Cotton Comfortable 4pcs/Lot Candy-Color Wholesalenh0032,4.9,4.9,134,4.8,2.66,Lustre Women & Kid,https://www.aliexpress.com/item/32734793502.html
Winter Jacket Coat Velour Girls Outwear Down Children's New Hooded for Thicken 3-12T,21.37,23.97,211,4.8,0,SunnySunday Store,https://www.aliexpress.com/item/32974522982.html
Pacifier Pink Food-Grade Funny Baby Teeth Silicone Red Kiss Rose Lip Lip-Shape,0.67,1.17,90,4.9,0,Fairy Mall,https://www.aliexpress.com/item/32597335026.html
Citgeett Summer Baby Girl Soft Crib Shoes Princess Leather First Walker Thong Sandals,3.42,3.66,14,5,0.36,citgeett Official Store,https://www.aliexpress.com/item/4000890225107.html
Kids Sneakers Light-Shoes Bright Baby-Girls-Boys Children New for Spring Easy,10.62,10.62,1,0,2.18,Shop5054090 Store,https://www.aliexpress.com/item/4001048298619.html
Bracelet Pacifier-Clips-Holder Baby Silicone Cartoon Food-Grade New Cat Chews Nurse,1.97,2.19,26,5,0,Baby teether Store,https://www.aliexpress.com/item/4000311296168.html
Head-Wraps Hair-Bands Bowknot Baby-Girls Large Kids Children DIY Print -40 Handmade,1.44,1.44,15,0,0,ALIwj Store,https://www.aliexpress.com/item/4000183604310.html
Animal Short Socks Ankle-Socks Funny Ears Girls Boys Cotton Cartoon Summer 5-Pairs/Lot,3.26,3.26,1174,4.9,0.2,Sweetly baby Store,https://www.aliexpress.com/item/32975794655.html
Headwear Hairpins Tiaras Hair-Accessories Lace Crown Rhinestone Girls Baby Princess Kids,1.57,2.36,14,0,0,Ms. Yang Dropshipping Store,https://www.aliexpress.com/item/4000529100079.html
US Fashion Adult Orthodontic Dummy Pacifier Silicone Teat Nipple Soother Newly,0.67,0.67,21,4,0.37,Baby Good Luck Store,https://www.aliexpress.com/item/4000833593270.html
Pink Boots Girls Shoes Outsole Winter Kids To 27 Antiskid Warm-Fur Plus-Size New-Style,21.73,27.84,63,4.9,0,SITAQI Official Store,https://www.aliexpress.com/item/32804033325.html
First Walkers Shoes Toddler Animal-Pattern Newborn Baby Baby-Girls-Boys 0-18-Months Crib,3.82,3.82,60,5,0.11,BabyCute Store,https://www.aliexpress.com/item/32981923984.html
Baby Clips Chain Dummy-Clip-Holder Nipples Cartoon Pacifier Children 1pcs Comfortable-Material,1.09,1.09,32,5,0,LOLEDE Toy Store,https://www.aliexpress.com/item/4000483255002.html
DANNEIS Moccasins Sneakers Girls Shoes Kids Footwear Toddler Baby Boys New-Born Slip-On,3.72,3.9,8,5,0,Danneis mother & infant Store,https://www.aliexpress.com/item/4000705938778.html
Tableware Bowl Dishes Snacks Feeding-Plate Food-Storage Anti-Spill Plastic Baby 360-Rotate,0.41,2.59,22,5,0,"The Girl Next Door Trading Co., Ltd",https://www.aliexpress.com/item/4000261713148.html
Hairpin Hair-Accessories Bb-Clips Newborn Baby-Girls Children Bowknot Scarce Mini Kid,1.59,1.59,70,5,0,Ms. Yang Dropshipping Store,https://www.aliexpress.com/item/4000078052535.html
Baby Shoes Sneaker Squeaky Toddler Newborn Rabbit First-Walker Cartoon Children Ears,3.96,3.96,20,4.5,1.04,BUUS Store,https://www.aliexpress.com/item/4000837776208.html
Pudcoco Kids Socks Anti-Slip Toddler Baby-Girls Boys Knee-High Cotton Solid Infant Casual,1.49,1.49,45,5,0.2,babymama Store,https://www.aliexpress.com/item/4000507151201.html
Newborn Blankets Swaddle Towel Stroller-Cover Wrap Baby-Bedding Infant Sleepsack Bath-Gauze,3.59,3.59,88,4.8,2.09,Penguin Papa Shopping Store,https://www.aliexpress.com/item/4000734429472.html
Headbands Turban Hair-Accessories Topknot Baby Bows Girls for Bebe Fille,1.28,1.82,193,4.8,0.74,BabyLucky Store,https://www.aliexpress.com/item/4000164325718.html
Feeding-Bowl Dinner-Plate Tableware Kids Eating Baby Children Spoon Food Cartoon,0.84,2.43,40,4.7,0.15,Baby Toy Shop Store,https://www.aliexpress.com/item/32900886093.html
4pcs/Pack Underwear Shorts Panties Boxer Teenage Young Boys Children Cotton for Striped,7.96,9.8,145,5,1.58,Maternal and children clothing store,https://www.aliexpress.com/item/32997715619.html
Baby Headband Infant Turban Bebe Girls Cotton for Faixa Cabelo Para Knot,2.11,2.68,153,5,0,Mummy & Baby World Store,https://www.aliexpress.com/item/4000109555844.html
Cups Duckbill-Bottle Sippy-Cup Training Safety Baby Leak-Proof Kids Soft-Mouth 240ml,4.91,4.91,361,4.7,0,Little Piggy Store,https://www.aliexpress.com/item/32966918027.html
Fruit-Feeder Pacifier-Bottles Nipple-Teat Infant-Supplies Baby Fresh Food Safe,0.54,1.13,187,4.4,0.29,Good For You2 Store,https://www.aliexpress.com/item/4000003071131.html
Socks Newborn Ruffled Girl Princess-Style Breathable Kids Children Lace Knee for Babies,1.25,1.56,134,4.8,0.27,Kids House Store,https://www.aliexpress.com/item/4000448336339.html
Baby Blanket Swaddle Wrap-Bedding-Covers Newborn Cotton Muslin Sleepsack Bath-Gauze Infant,1.03,3.68,33,5,3.89,Bainily Official Store,https://www.aliexpress.com/item/4000734269413.html
Newborn Blankets Stroller-Cover Swaddle-Wrap Diapers Play-Mat Flannel Baby Muslin Cotton,3.55,10.36,10,0,0,Azz Block Store,https://www.aliexpress.com/item/4001035832420.html
Family Swimsuit Beach-Shorts Mom Daughter Tropical Mommy And Dad Son Me Leaf Print,6.69,10.82,221,4.8,0,NASHAKAITE DAD&MOMMY & ME Store,https://www.aliexpress.com/item/32950733327.html
Chain Teether-Toys Pacifier-Clip Beads Baby Baby-Boy-Girl Silicone Infant Chew 1pcs Safe,1.92,2.24,452,4.6,0,My Dear Baby Store,https://www.aliexpress.com/item/4000594977183.html
Tshirt Family-Look Mommy And Daughter Love Me Fashion White Black Cotton Soft Short Heartbeat,4.48,5.82,108,4.9,0,KAD Store,https://www.aliexpress.com/item/4000717650985.html
Sneaker Shoes Slippers Trainers Newborn Baby-Boy-Girl Crib Anti-Slip Soft Canvas Shallow,2.41,2.57,23,4.5,1.07,Baby CC Store,https://www.aliexpress.com/item/33046806927.html
Socks Spiderman Batman Baby-Girls Breathable Boys Kids Cotton Cartoon Summer 5-Pairs,3.44,4.73,438,4.9,4.21,Sonkpuel Online Store,https://www.aliexpress.com/item/4000103850795.html
Kids Bowl Tableware Baby-Plate Feeding-Dishes Bpa-Free Children Spoon-Set Cartoon Silicone,6.66,11.77,64,4.9,0,let's make Mother&Baby Store,https://www.aliexpress.com/item/4000448643653.html
Chain Pacifier-Clips Dummy-Clip Nipple Baby Infant Feeding-for 20/12,1.28,1.29,341,4.7,0,Come On 2015,https://www.aliexpress.com/item/32843233573.html
Nipple Pacifier Clip Dummy-Holder Crochet Gray Baby-Boys-Girls Cotton Simple,1.64,1.99,17,0,0.57,Shop4798016 Store,https://www.aliexpress.com/item/33037554036.html
Socks Toddler Sneaker Short Superman-Sock Mesh Dinosaur Funny Baby Girls Boys Cotton,4.86,4.86,1590,4.9,0,Grape baby Store,https://www.aliexpress.com/item/4000668663542.html
Tops Pants Sleepwear Pajama-Sets Short-Sleeve Sleeping-Clothes Toddler Girls Baby Boys,7.17,8.07,37,5,0,Anrayan baby cloth world Store,https://www.aliexpress.com/item/4000691540543.html
